contractNumberSys;Supplier;descriptionRu;FaktTradeMethods;faktSum;contractSumWnds;RefSubjectType
961240000583/230043/00;"{'nameRu': 'Товарищество с ограниченной ответственностью """"Bilim Land""""'}";Услуги по предоставлению доступа к Продукту образовательной экосистемы, цифровой образовательный портал по дополнительному образованию и тестированию;{'nameRu': 'Запрос ценовых предложений'};80000.00;80000.00;{'nameRu': 'Услуга'}
961240000583/230042/00;"{'nameRu': 'ТОО ""Торговый дом стройматериалов""'}";Приобретение прочих запасов (Прожектор светодиодный);{'nameRu': 'Из одного источника по несостоявшимся закупкам'};12000.00;13440.00;{'nameRu': 'Товар'}
961240000583/230041/00;"{'nameRu': 'ТОО ""Серхан74""'}";Приобретение прочих запасов (Лампа светодиодная Т8 стекло 18w 1.2м);{'nameRu': 'Запрос ценовых предложений'};37900.00;42448.00;{'nameRu': 'Товар'}
961240000583/230040/00;{'nameRu': 'ИП БЕККЕР ИРИНА ЯКОВЛЕВНА'};Приобретение прочих запасов (Труба для канализации пластиковая Д-50, длина 2м);{'nameRu': 'Запрос ценовых предложений'};9588.00;9588.00;{'nameRu': 'Товар'}
961240000583/230039/00;"{'nameRu': 'ИП ""Бондарева""'}";Приобретение прочих запасов (Кран полуоборотный шаровый, сердцевина для замка 8см);{'nameRu': 'Запрос ценовых предложений'};13986.00;15664.32;{'nameRu': 'Товар'}
961240000583/230038/00;"{'nameRu': 'ТОО """"ТДС Костанай""""'}";Приобретение прочих запасов (Муфта Д- 20, отвод полипропиленовый Д- 20);{'nameRu': 'Запрос ценовых предложений'};3857.14;4320.00;{'nameRu': 'Товар'}
961240000583/230037/00;{'nameRu': 'ИП БЕРНИК ВИКТОР ЧЕСЛАВОВИЧ'};Приобретение прочих запасов (Сифон для умывальника гофрированный);{'nameRu': 'Запрос ценовых предложений'};5080.00;5689.60;{'nameRu': 'Товар'}
961240000583/230036/00;"{'nameRu': 'ИП ""Бондарева""'}";Приобретение прочих запасов (Кран полуоборотный шаровый);{'nameRu': 'Запрос ценовых предложений'};5076.00;5685.12;{'nameRu': 'Товар'}
961240000583/230035/00;{'nameRu': 'Плеханов Евгений Алексеевич'};Приобретение прочих запасов (Сантехника);{'nameRu': 'Запрос ценовых предложений'};19035.00;21319.20;{'nameRu': 'Товар'}
961240000583/230034/00;"{'nameRu': 'ТОО ""KGS Group & Co""'}";Приобретение прочих запасов (Тряпка для удаления пыли, 30*30);{'nameRu': 'Электронный магазин'};18883.93;21150.00;{'nameRu': 'Товар'}
961240000583/230033/00;{'nameRu': 'ИП Ақдидар'};Приобретение прочих запасов (Губка для мытья посуды);{'nameRu': 'Электронный магазин'};0.00;12450.00;{'nameRu': 'Товар'}
961240000583/230032/00;{'nameRu': 'ИП Акимхан'};Приобретение прочих запасов (Перчатки резиновые, хозяйственные, прочные гелиевые, размер L);{'nameRu': 'Электронный магазин'};34586.00;34586.00;{'nameRu': 'Товар'}
961240000583/230031/00;{'nameRu': 'ИП Родничок'};Приобретение прочих запасов (Мыло туалетное жидкое, антибактериальное, объем 5л);{'nameRu': 'Электронный магазин'};21536.00;21536.00;{'nameRu': 'Товар'}
961240000583/230030/00;{'nameRu': 'ИП ЖУРКЕНОВ ТАЛГАТ АЛПИСБАЕВИЧ'};Приобретение прочих запасов (Мешок для мусора прочный на 30л (в рулоне 20шт);{'nameRu': 'Электронный магазин'};41500.00;41500.00;{'nameRu': 'Товар'}
961240000583/230029/00;{'nameRu': 'ИП Sofia Sweets'};Приобретение прочих запасов (Мешок для мусора прочный на 60л (в рулоне 20шт));{'nameRu': 'Электронный магазин'};33605.00;33605.00;{'nameRu': 'Товар'}
961240000583/230028/00;"{'nameRu': '""SAQAN7"" ЖШС'}";Приобретение прочих запасов (Щетка металлическая для мытья посуды);{'nameRu': 'Электронный магазин'};5108.00;5108.00;{'nameRu': 'Товар'}
961240000583/230027/00;"{'nameRu': 'ТОО ""А.Р. Атлант""'}";Приобретение прочих запасов (Средство чистящее для сантехники, объем 400гр);{'nameRu': 'Электронный магазин'};22098.21;24750.00;{'nameRu': 'Товар'}
961240000583/230026/00;{'nameRu': 'ХАЛЛАМ'};Приобретение прочих запасов (Гофра на унитаз пластиковая диаметр 110*550мм);{'nameRu': 'Электронный магазин'};12408.96;12408.96;{'nameRu': 'Товар'}
961240000583/230025/00;"{'nameRu': 'Товарищество с ограниченной ответственностью ""ALMATAU LLC""'}";Приобретение прочих запасов (Жидкое дезинфицирующее средство объем 750мл);{'nameRu': 'Электронный магазин'};36830.00;41249.60;{'nameRu': 'Товар'}
961240000583/230024/00;{'nameRu': 'BerekeBlok'};Приобретение прочих запасов (Порошок для уборки помещений универсальный, объем 400гр);{'nameRu': 'Электронный магазин'};37300.00;37300.00;{'nameRu': 'Товар'}
961240000583/230023/00;"{'nameRu': 'ИП ""Бондарева""'}";Приобретение прочих запасов (Арматура для бачка унитаза, с нижним подводом);{'nameRu': 'Электронный магазин'};14508.00;16248.96;{'nameRu': 'Товар'}
961240000583/230022/00;"{'nameRu': 'Товарищество с ограниченной ответственностью ""Экспресс - Пресса""'}";Услуги по подписке на печатные периодические издания на 2023 год, согласно списка;{'nameRu': 'Из одного источника путем прямого заключения договора'};133928.57;150000.00;{'nameRu': 'Услуга'}
961240000583/230002/01;"{'nameRu': 'Товарищество с ограниченной ответственностью ""TURAN Security""'}";Услуги круглосуточной специализированной охраны школы;{'nameRu': 'Запрос ценовых предложений'};0.00;3410000.00;{'nameRu': 'Услуга'}
961240000583/230021/00;"{'nameRu': 'ТОО ""Производственно-коммерческая фирма ""Теплосервис""'}";Сервисное обслуживание приборов учета тепловой энергии на отопительный сезон 2023г.;{'nameRu': 'Из одного источника по несостоявшимся закупкам'};41071.43;85000.16;{'nameRu': 'Услуга'}
961240000583/230020/00;"{'nameRu': 'ТОО ""Uplink""'}";Услуги связи для передачи данных видеонаблюдения ЦОУ;{'nameRu': 'Из одного источника по несостоявшимся закупкам'};24249.99;108640.00;{'nameRu': 'Услуга'}
961240000583/230019/00;{'nameRu': 'IDHELP'};Услуга по продлению программного комплекса шлюза безопасности IDECO UTM;{'nameRu': 'Из одного источника по несостоявшимся закупкам'};1430000.00;1430000.00;{'nameRu': 'Услуга'}
961240000583/230018/00;{'nameRu': 'IDHELP'};Услуги по администрированию и техническому обслуживанию программного обеспечения (Обслуживание шлюза безопасности);{'nameRu': 'Из одного источника по несостоявшимся закупкам'};350000.00;420000.00;{'nameRu': 'Услуга'}
961240000583/230017/00;"{'nameRu': 'ТОО ""Uplink""'}";Услуги по доступу к Интернету;{'nameRu': 'Второй этап конкурса с использованием рамочного соглашения'};315862.50;1344000.00;{'nameRu': 'Услуга'}
961240000583/230016/00;"{'nameRu': 'АО ""Казахтелеком""'}";Услуги по доступу к Интернету;{'nameRu': 'Второй этап конкурса с использованием рамочного соглашения'};438864.61;1016080.04;{'nameRu': 'Услуга'}
961240000583/230015/00;"{'nameRu': 'АО ""Казахтелеком""'}";Услуги телефонной связи;{'nameRu': 'Второй этап конкурса с использованием рамочного соглашения'};16607.14;51808.78;{'nameRu': 'Услуга'}
961240000583/230014/00;"{'nameRu': 'Товарищество с ограниченной ответственностью ""Парус-КАЗ""'}";"Обслуживание программного продукта &quot;Парус-КАЗ.Бюджет&quot; (Бюджетное финансирование. Бюджетная заявка. Тарификация в образовании)";{'nameRu': 'Из одного источника путем прямого заключения договора'};445467.86;665232.00;{'nameRu': 'Услуга'}
961240000583/230013/00;"{'nameRu': 'ТОО ""Seven Hills of Kazakhstan""'}";Услуги по сопровождению программного обеспечения «Конфигурация «Бюджет» на платформе 1С»;{'nameRu': 'Из одного источника путем прямого заключения договора'};491071.43;600000.00;{'nameRu': 'Услуга'}
961240000583/230012/00;"{'nameRu': 'ТОО ""Костанайский ЭнергоЦентр""'}";Электроэнергия;{'nameRu': 'Из одного источника путем прямого заключения договора'};0.00;4795869.12;{'nameRu': 'Товар'}
961240000583/230011/00;"{'nameRu': 'Государственное коммунальное предприятие ""Костанай-Су"" акимата города Костаная государственного учреждения ""Отдел жилищно-коммунального хозяйства, пассажирского транспорта и автомобильных дорог акимата города Костаная""'}";Услуги по холодному водоснабжению и удалению сточных вод;{'nameRu': 'Из одного источника путем прямого заключения договора'};1448162.16;4144000.00;{'nameRu': 'Услуга'}
961240000583/230010/00;"{'nameRu': 'ГКП ""Костанайская теплоэнергетическая компания"" акимата города Костаная государственного учреждения ""Отдел жилищно-коммунального хозяйства, пассажирского транспорта и автомобильных дорог акимата города Костаная""'}";Отопление, горячее водосабжение.;{'nameRu': 'Из одного источника путем прямого заключения договора'};5449159.05;15083160.00;{'nameRu': 'Услуга'}
961240000583/230009/00;{'nameRu': 'ИП КУЖАХМЕТОВ ГАБИТ СЕРЕКБАЕВИЧ'};Техническое обслуживание речевого оповещения;{'nameRu': 'Запрос ценовых предложений'};37494.00;50000.00;{'nameRu': 'Услуга'}
961240000583/230008/00;{'nameRu': 'ИП КУЖАХМЕТОВ ГАБИТ СЕРЕКБАЕВИЧ'};Техническое обслуживание пожарной сигнализации;{'nameRu': 'Запрос ценовых предложений'};51822.00;69100.00;{'nameRu': 'Услуга'}
961240000583/230007/00;{'nameRu': 'ИП ДЕНИСОВ С.И.'};Дезинфекция, дератизация, дезинсекция ежеквартально;{'nameRu': 'Запрос ценовых предложений'};18000.00;36000.00;{'nameRu': 'Услуга'}
961240000583/230006/00;{'nameRu': 'KAZ-ITSERVICE'};Техническое обслуживание системы видеонаблюдения;{'nameRu': 'Запрос ценовых предложений'};72747.00;97000.00;{'nameRu': 'Услуга'}
961240000583/230005/00;"{'nameRu': 'ТОО ""2х2""'}";Вывоз и захоронение твердых бытовых отходов;{'nameRu': 'Запрос ценовых предложений'};34125.00;458640.00;{'nameRu': 'Услуга'}
961240000583/230004/00;"{'nameRu': 'ТОО ""ГБР Арыстан""'}";Тревожная сигнализация с выводом на ППМЦ;{'nameRu': 'Запрос ценовых предложений'};224775.00;335664.00;{'nameRu': 'Услуга'}
961240000583/230003/00;{'nameRu': 'ИП Емельянов Илья Сергеевич'};Заправка и ремонт картриджей, замена фотобарабана;{'nameRu': 'Запрос ценовых предложений'};79400.00;99000.00;{'nameRu': 'Услуга'}
961240000583/230002/00;"{'nameRu': 'Товарищество с ограниченной ответственностью ""TURAN Security""'}";Услуги круглосуточной специализированной охраны школы;{'nameRu': 'Запрос ценовых предложений'};0.00;3410000.00;{'nameRu': 'Услуга'}
961240000583/230001/00;{'nameRu': 'ИП Хоменко Лариса Васильевна'};Услуги по обеспечению питания остро нуждающихся учащихся государственных общеобразовательных школ из числа малообеспеченных семей.;{'nameRu': 'Из одного источника путем прямого заключения договора по питанию обучающихся'};1692149.55;5001750.00;{'nameRu': 'Услуга'}
