contractNumberSys;Supplier;descriptionRu;FaktTradeMethods;faktSum;contractSumWnds;RefSubjectType
110841005552/230114/00;{'nameRu': 'ИП МУКУШЕВА К.М.'};Услуга по перезарядке углекислотных, порошковых огнетушителей;{'nameRu': 'Из одного источника по несостоявшимся закупкам'};0.00;59000.00;{'nameRu': 'Услуга'}
110841005552/230111/01;"{'nameRu': 'ТОО ""Гормонтажпроект""'}";Многофакторное обследование ГТС с разработкой декларации безопасности плотины Каратомарского водохранилища;{'nameRu': 'Открытый конкурс'};0.00;72017120.00;{'nameRu': 'Работа'}
110841005552/230106/01;"{'nameRu': 'ТОО ""Гормонтажпроект""'}";Многофакторное обследование ГТС с разработкой декларации безопасности плотины Верхне-Тобольского водохранилища;{'nameRu': 'Открытый конкурс'};0.00;61354720.00;{'nameRu': 'Работа'}
110841005552/230113/00;{'nameRu': 'Алгужин А.С.'};Текущий ремонт поршневого компрессора 4ВУ1-5/9 на Каратомарском гидроузле-2 этап;{'nameRu': 'Запрос ценовых предложений'};0.00;439000.00;{'nameRu': 'Работа'}
110841005552/230112/00;"{'nameRu': 'ТОО ""Kst trade""'}";Бензин для двигателей с искровым зажиганием (талоны);{'nameRu': 'Из одного источника по несостоявшимся закупкам'};0.00;471408.00;{'nameRu': 'Товар'}
110841005552/230111/00;"{'nameRu': 'ТОО ""Гормонтажпроект""'}";Многофакторное обследование ГТС с разработкой декларации безопасности плотины Каратомарского водохранилища;{'nameRu': 'Открытый конкурс'};0.00;72017120.00;{'nameRu': 'Работа'}
110841005552/230110/00;{'nameRu': 'Алгужин А.С.'};Текущий ремонт электроосвещения левобережной, правобережной дамб и водопропускной части плотины Верхне-Тобольского гидроузла -1 этап;{'nameRu': 'Из одного источника по несостоявшимся закупкам'};0.00;555000.00;{'nameRu': 'Работа'}
110841005552/230109/00;{'nameRu': 'Алгужин А.С.'};Текущий ремонт поршневого компрессора КСЭ-5М на Кызыл-Жарском гидроузле;{'nameRu': 'Из одного источника по несостоявшимся закупкам'};0.00;890000.00;{'nameRu': 'Работа'}
110841005552/230108/00;{'nameRu': 'Алгужин А.С.'};Текущий ремонт электроосвещения затворов и водопропускной части плотины Каратомарского гидроузла -1 этап;{'nameRu': 'Из одного источника по несостоявшимся закупкам'};0.00;670000.00;{'nameRu': 'Работа'}
110841005552/230107/00;{'nameRu': 'Алгужин А.С.'};Текущий ремонт поршневого компрессора 4ВУ1-4/9 на Каратомарском гидроузле;{'nameRu': 'Из одного источника по несостоявшимся закупкам'};0.00;1280000.00;{'nameRu': 'Работа'}
110841005552/230106/00;"{'nameRu': 'ТОО ""Гормонтажпроект""'}";Многофакторное обследование ГТС с разработкой декларации безопасности плотины Верхне-Тобольского водохранилища;{'nameRu': 'Открытый конкурс'};0.00;61354720.00;{'nameRu': 'Работа'}
110841005552/230105/00;"{'nameRu': 'Товарищество с ограниченной ответственностью ""Учебный центр ""Aspect""""'}";Курсы повышения квалификации рабочего персонала в области промышленной безопасности;{'nameRu': 'Запрос ценовых предложений'};0.00;126000.00;{'nameRu': 'Услуга'}
110841005552/230104/00;"{'nameRu': 'ИП ""Кенже""'}";Услуга по текущему ремонту автотранспортных средств, трактора МТЗ-82.1;{'nameRu': 'Запрос ценовых предложений'};0.00;190000.00;{'nameRu': 'Работа'}
110841005552/230103/00;{'nameRu': 'ИП Soltustik-2020'};Услуга по промывке системы отопления в здании АУП;{'nameRu': 'Запрос ценовых предложений'};0.00;20000.00;{'nameRu': 'Услуга'}
110841005552/230102/00;{'nameRu': 'ИП Soltustik-2020'};Услуга по поверке средств измерений;{'nameRu': 'Запрос ценовых предложений'};20000.00;20000.00;{'nameRu': 'Услуга'}
110841005552/230101/00;"{'nameRu': 'ТОО ""Инверсия""'}";Текущий ремонт электроотопления помещений Верхне-Тобольского гидроузла;{'nameRu': 'Из одного источника по несостоявшимся закупкам'};0.00;167900.00;{'nameRu': 'Работа'}
110841005552/230100/00;"{'nameRu': 'ТОО ""Инверсия""'}";Текущий ремонт электроотопления проходной Опорной базы в г.Тобыл;{'nameRu': 'Из одного источника по несостоявшимся закупкам'};0.00;220000.00;{'nameRu': 'Работа'}
110841005552/230099/00;{'nameRu': 'ИП Естыбаев Ж.А.'};Услуга по ремонту автотранспортных средств, систем, узлов и агрегатов;{'nameRu': 'Запрос ценовых предложений'};710000.00;710000.00;{'nameRu': 'Услуга'}
110841005552/230098/00;{'nameRu': 'ИП МУКУШЕВА К.М.'};Услуга по перезарядке порошковых, углекислотных огнетушителей;{'nameRu': 'Запрос ценовых предложений'};0.00;32000.00;{'nameRu': 'Услуга'}
110841005552/230097/00;{'nameRu': 'Алгужин А.С.'};Текущий ремонт ограждения на правом берегу нижнего бьефа Каратомарского водохранилища 4 этап;{'nameRu': 'Из одного источника по несостоявшимся закупкам'};2850000.00;2850000.00;{'nameRu': 'Работа'}
110841005552/230096/00;"{'nameRu': 'ТОО ""HABEKA""'}";Услуга по утилизации аккумуляторных батарей;{'nameRu': 'Запрос ценовых предложений'};0.00;1000.01;{'nameRu': 'Услуга'}
110841005552/230095/00;"{'nameRu': 'ТОО ""Сигнал-Плюс""'}";Услуга по лабораторному испытанию контуров заземления, металлической связи электрооборудования;{'nameRu': 'Запрос ценовых предложений'};0.00;210000.00;{'nameRu': 'Услуга'}
110841005552/230094/00;"{'nameRu': 'АО ""Казахтелеком""'}";Услуги телефонной связи;{'nameRu': 'Второй этап конкурса с использованием рамочного соглашения'};0.00;11770.08;{'nameRu': 'Услуга'}
110841005552/230093/00;"{'nameRu': 'ПК ""№40""'}";Услуга по испытанию средств индивидуальной защиты;{'nameRu': 'Из одного источника по несостоявшимся закупкам'};53000.00;53000.00;{'nameRu': 'Услуга'}
110841005552/230092/00;"{'nameRu': 'ИП ""УНАЕВ Т. Ж.""'}";Ветошь обтирочная хлопчатобумажная;{'nameRu': 'Запрос ценовых предложений'};24500.00;24500.00;{'nameRu': 'Товар'}
110841005552/230091/00;"{'nameRu': 'ИП ""ТАБАРАН А.Г.""'}";Освежитель воздуха, аэрозоль.;{'nameRu': 'Запрос ценовых предложений'};2425.00;2425.00;{'nameRu': 'Товар'}
110841005552/230090/00;"{'nameRu': 'ИП""Усюкевич А.С.""'}";Средство чистящее для обработки ванн, раковин и поверхностей, порошкообразное;{'nameRu': 'Запрос ценовых предложений'};5280.00;5280.00;{'nameRu': 'Товар'}
110841005552/230089/00;"{'nameRu': 'ИП ""ХОД КОНЕМ""'}";Полироль для мебели, аэрозоль;{'nameRu': 'Запрос ценовых предложений'};1500.00;1500.00;{'nameRu': 'Товар'}
110841005552/230088/00;{'nameRu': 'МОЛДАХМЕТ НҰРЛЫБЕК'};Пакет мусорный полиэтиленовый, средство моющее для туалетов, гель;{'nameRu': 'Запрос ценовых предложений'};7500.00;7500.00;{'nameRu': 'Товар'}
110841005552/230087/00;{'nameRu': 'ИП Мазкенова'};Хозяйственные товары;{'nameRu': 'Запрос ценовых предложений'};32943.00;32943.00;{'nameRu': 'Товар'}
110841005552/230086/00;"{'nameRu': 'ИП ""Жувак Артем""'}";Текущий ремонт ограждения на правом берегу нижнего бьефа Каратомарского водохранилища 3 этап;{'nameRu': 'Запрос ценовых предложений'};2690000.00;2690000.00;{'nameRu': 'Работа'}
110841005552/230085/00;{'nameRu': 'ИП Анаш'};Журнал регистрации приказов;{'nameRu': 'Из одного источника по несостоявшимся закупкам'};0.00;3600.00;{'nameRu': 'Товар'}
110841005552/230084/00;{'nameRu': 'Алгужин А.С.'};Текущий ремонт и покраска затвора 9*16м 1шт. Каратомарского гидроузла 2 этап;{'nameRu': 'Из одного источника по несостоявшимся закупкам'};1950000.00;1950000.00;{'nameRu': 'Работа'}
110841005552/230083/00;"{'nameRu': 'ИП ""Жувак Артем""'}";Текущий ремонт ограждения санитарной зоны Каратомарского водохранилища на правом берегу нижнего бьефа - 2 этап;{'nameRu': 'Запрос ценовых предложений'};2600000.00;2600000.00;{'nameRu': 'Работа'}
110841005552/230078/01;{'nameRu': 'Алгужин А.С.'};Текущий ремонт и покраска металлического затвора 9*16м - 1 шт. Каратомарское водохранилище;{'nameRu': 'Запрос ценовых предложений'};3000000.00;5790000.00;{'nameRu': 'Работа'}
110841005552/230082/00;"{'nameRu': 'АО ""Казахтелеком""'}";Услуга по передаче фискальных данных ОФД;{'nameRu': 'Из одного источника путем прямого заключения договора'};223.21;9800.00;{'nameRu': 'Услуга'}
110841005552/230081/00;"{'nameRu': 'ИП ""Жувак Артем""'}";Текущий ремонт электрооборудования производственных и складских помещений Опорной базы г.Тобыл;{'nameRu': 'Из одного источника по несостоявшимся закупкам'};1299000.00;1299000.00;{'nameRu': 'Работа'}
110841005552/230080/00;"{'nameRu': 'ТОО ""Kst trade""'}";Топливо дизельное летнее (талоны);{'nameRu': 'Из одного источника по несостоявшимся закупкам'};1748950.00;1958824.00;{'nameRu': 'Товар'}
110841005552/230079/00;{'nameRu': 'BIM-REVIT'};Текущий ремонт системы видеонаблюдения гидроузла Каратомарского водохранилища;{'nameRu': 'Запрос ценовых предложений'};3360000.00;3360000.00;{'nameRu': 'Работа'}
110841005552/230078/00;{'nameRu': 'Алгужин А.С.'};Текущий ремонт и покраска металлического затвора 9*16м - 1 шт. Каратомарское водохранилище;{'nameRu': 'Запрос ценовых предложений'};0.00;6484800.00;{'nameRu': 'Работа'}
110841005552/230077/00;{'nameRu': 'ИП Бордо'};Текущий ремонт ограждения санитарной зоны Каратомарского водохранилища на правом берегу нижнего бьефа - 1 этап;{'nameRu': 'Запрос ценовых предложений'};4899000.00;4899000.00;{'nameRu': 'Работа'}
110841005552/230076/00;{'nameRu': 'ИП Родничок'};Журналы регистрации входящей и исходящей корреспонденции;{'nameRu': 'Запрос ценовых предложений'};912.00;912.00;{'nameRu': 'Товар'}
110841005552/230075/00;"{'nameRu': 'Товарищество с ограниченной ответственностью ""БАРС-2018""'}";Папка-скоросшиватель для бумаги формата А4 из картона с завязками;{'nameRu': 'Запрос ценовых предложений'};6100.00;6832.00;{'nameRu': 'Товар'}
110841005552/230074/00;"{'nameRu': 'ИП ""УНАЕВ Т. Ж.""'}";Папка регистратор А4 70мм;{'nameRu': 'Запрос ценовых предложений'};11900.00;11900.00;{'nameRu': 'Товар'}
110841005552/230073/00;{'nameRu': 'ИП КИРИК'};Приобретение канцелярских товаров;{'nameRu': 'Запрос ценовых предложений'};0.00;5132.90;{'nameRu': 'Товар'}
110841005552/230072/00;"{'nameRu': 'ТОО ""Казах Кенсе""'}";Бумага для офисного оборудования А4;{'nameRu': 'Запрос ценовых предложений'};81972.00;91808.64;{'nameRu': 'Товар'}
110841005552/230071/00;"{'nameRu': 'ТОО ""Kst trade""'}";Бензин АИ-92 (талоны);{'nameRu': 'Из одного источника по несостоявшимся закупкам'};701274.29;885427.20;{'nameRu': 'Товар'}
110841005552/230070/00;"{'nameRu': 'ТОО ""Kst trade""'}";Бензин АИ-92 (талоны);{'nameRu': 'Из одного источника по несостоявшимся закупкам'};1647000.00;1844640.00;{'nameRu': 'Товар'}
110841005552/230069/00;"{'nameRu': 'Товарищество с ограниченной ответственностью ""КосДинКом""'}";Жидкость для охлаждения двигателей внутреннего сгорания/ теплообменных аппаратов, охлаждающая;{'nameRu': 'Запрос ценовых предложений'};96250.00;107800.00;{'nameRu': 'Товар'}
110841005552/230068/00;"{'nameRu': 'ТОО ""Костанайшинторг""'}";Масло моторное для дизельных двигателей, минеральное, летнее;{'nameRu': 'Запрос ценовых предложений'};48150.00;53928.00;{'nameRu': 'Товар'}
110841005552/230067/00;{'nameRu': 'ИП КУСПАНОВ С.С.'};Масло трансмиссионное синтетическое, всесезонное;{'nameRu': 'Запрос ценовых предложений'};0.00;103200.00;{'nameRu': 'Товар'}
110841005552/230066/00;"{'nameRu': 'ТОО ""Костанайшинторг""'}";Масло моторное дизельное;{'nameRu': 'Запрос ценовых предложений'};212400.00;237888.00;{'nameRu': 'Товар'}
110841005552/230065/00;"{'nameRu': 'ТОО ""Костанайшинторг""'}";Масло гидравлическое минеральное всесезонное;{'nameRu': 'Запрос ценовых предложений'};36450.00;40824.00;{'nameRu': 'Товар'}
110841005552/230064/00;"{'nameRu': 'Товарищество с ограниченной ответственностью ""КосДинКом""'}";Масло трансмиссионное синтетическое, всесезонное;{'nameRu': 'Запрос ценовых предложений'};52000.00;58240.00;{'nameRu': 'Товар'}
110841005552/230063/00;"{'nameRu': 'АО ""Страховая компания ""Номад Иншуранс""'}";Страхование автотранспортных средств;{'nameRu': 'Запрос ценовых предложений'};0.00;394344.01;{'nameRu': 'Услуга'}
110841005552/230062/00;"{'nameRu': 'АО ""Нефтяная страховая компания""'}";Страхование автотранспортных средств;{'nameRu': 'Запрос ценовых предложений'};105791.01;105791.01;{'nameRu': 'Услуга'}
110841005552/230061/00;{'nameRu': 'ИП Касымова'};Текущий ремонт автотранспортных средств колесного трактора МТЗ-82.1;{'nameRu': 'Запрос ценовых предложений'};185000.00;185000.00;{'nameRu': 'Работа'}
110841005552/230060/00;{'nameRu': 'ИП Касымова'};Текущий ремонт автотранспортных средств УАЗ 390945;{'nameRu': 'Запрос ценовых предложений'};315000.00;520000.00;{'nameRu': 'Работа'}
110841005552/230059/00;{'nameRu': 'ИП ПАК Е.А.'};Эл.лампа светодиодная 100 Вт;{'nameRu': 'Запрос ценовых предложений'};40833.00;40833.00;{'nameRu': 'Товар'}
110841005552/230058/00;"{'nameRu': 'Коммунальное государственное предприятие ""Житикаринская районная больница"" Управления здравоохранения акимата Костанайской области'}";Услуги по ежегодному обязательному медицинскому осмотру Желкуарский участок;{'nameRu': 'Из одного источника по несостоявшимся закупкам'};81405.00;81405.00;{'nameRu': 'Услуга'}
110841005552/230057/00;{'nameRu': 'ИП ARSENAL'};ведро оцинкованное;{'nameRu': 'Запрос ценовых предложений'};16973.00;16973.00;{'nameRu': 'Товар'}
110841005552/230056/00;"{'nameRu': 'ТОО ""КСТ""'}";Текущий ремонт линии электроосвещения Каратамарского водохранилища;{'nameRu': 'Из одного источника по несостоявшимся закупкам'};3120000.00;3120000.00;{'nameRu': 'Работа'}
110841005552/230055/00;"{'nameRu': 'ТОО ""2х2""'}";Услуги по вывозу (сбору) опасных отходов/имущества/материалов;{'nameRu': 'Из одного источника по несостоявшимся закупкам'};2925.00;32760.00;{'nameRu': 'Услуга'}
110841005552/230052/01;"{'nameRu': 'ТОО ""КСТ""'}";Текущий ремонт задвижки d-1200мм №17 Каратомарского гидроузла;{'nameRu': 'Из одного источника по несостоявшимся закупкам'};2170000.00;2170000.00;{'nameRu': 'Работа'}
110841005552/230051/01;"{'nameRu': 'ТОО ""КСТ""'}";Текущий ремонт электроосвещения галереи, бокса Каратомарского гидроузла;{'nameRu': 'Из одного источника по несостоявшимся закупкам'};1026000.00;1026000.00;{'nameRu': 'Работа'}
110841005552/230050/01;"{'nameRu': 'ТОО ""КСТ""'}";Текущий ремонт сороудерживающей решетки Каратамарского гидроузла;{'nameRu': 'Из одного источника по несостоявшимся закупкам'};2344000.00;2344000.00;{'nameRu': 'Работа'}
110841005552/230054/00;"{'nameRu': 'ТОО ""Kst trade""'}";Топливо дизельное зимнее (талоны);{'nameRu': 'Из одного источника по несостоявшимся закупкам'};374107.14;819000.00;{'nameRu': 'Товар'}
110841005552/230053/00;{'nameRu': 'АСТАНА ЭЛЕКТРО СНАБ'};Светильник светодиодный;{'nameRu': 'Запрос ценовых предложений'};43805.00;49061.60;{'nameRu': 'Товар'}
110841005552/230052/00;"{'nameRu': 'ТОО ""КСТ""'}";Текущий ремонт задвижки d-1200мм №17 Каратомарского гидроузла;{'nameRu': 'Из одного источника по несостоявшимся закупкам'};0.00;2430400.00;{'nameRu': 'Работа'}
110841005552/230051/00;"{'nameRu': 'ТОО ""КСТ""'}";Текущий ремонт электроосвещения галереи, бокса Каратомарского гидроузла;{'nameRu': 'Из одного источника по несостоявшимся закупкам'};0.00;1149120.00;{'nameRu': 'Работа'}
110841005552/230050/00;"{'nameRu': 'ТОО ""КСТ""'}";Текущий ремонт сороудерживающей решетки Каратамарского гидроузла;{'nameRu': 'Из одного источника по несостоявшимся закупкам'};0.00;2625280.00;{'nameRu': 'Работа'}
110841005552/230049/00;"{'nameRu': 'Костанайский филиал АО ""Национальный центр экспертизы и сертификации""'}";Услуги по техническому контролю (осмотру) дорожных транспортных средств;{'nameRu': 'Из одного источника по несостоявшимся закупкам'};0.00;56000.00;{'nameRu': 'Услуга'}
110841005552/230048/00;{'nameRu': 'ИП Zhomartovna'};мешок;{'nameRu': 'Запрос ценовых предложений'};116000.00;129920.00;{'nameRu': 'Товар'}
110841005552/230047/00;{'nameRu': 'ИП Асем'};песок;{'nameRu': 'Запрос ценовых предложений'};0.00;28000.00;{'nameRu': 'Товар'}
110841005552/230046/00;"{'nameRu': 'ИП ""МАЗУРА""'}";щебень;{'nameRu': 'Запрос ценовых предложений'};120000.00;120000.00;{'nameRu': 'Товар'}
110841005552/230045/00;"{'nameRu': 'ТОО ""Kst trade""'}";Бензин для двигателей с искровым зажиганием;{'nameRu': 'Из одного источника по несостоявшимся закупкам'};1168750.00;1309000.00;{'nameRu': 'Товар'}
110841005552/230044/00;"{'nameRu': 'ТОО ""Kst trade""'}";Топливо дизельное летнее (талоны);{'nameRu': 'Из одного источника по несостоявшимся закупкам'};696428.57;780000.00;{'nameRu': 'Товар'}
110841005552/230043/00;"{'nameRu': 'ИП ""Bereke+""'}";Оповещатель;{'nameRu': 'Запрос ценовых предложений'};173900.00;173900.00;{'nameRu': 'Товар'}
110841005552/230042/00;"{'nameRu': 'Костанайский ОФ АО ""Казпочта""'}";Универсальные услуги почтовой связи;{'nameRu': 'Из одного источника по несостоявшимся закупкам'};8928.57;28000.00;{'nameRu': 'Услуга'}
110841005552/230041/00;"{'nameRu': 'ОЮЛ ""Ассоциация водного хозяйства Казахстана""'}";Услуги по подписке на печатные периодические издания;{'nameRu': 'Из одного источника по несостоявшимся закупкам'};0.00;120000.00;{'nameRu': 'Услуга'}
110841005552/230040/00;"{'nameRu': 'Товарищество с ограниченной ответственностью ""CLASSICS OF LIFE""'}";Вода бутилированная 19 л;{'nameRu': 'Запрос ценовых предложений'};22500.00;39200.00;{'nameRu': 'Товар'}
110841005552/230039/00;{'nameRu': 'ИП Магнит 2017'};Услуги по обслуживанию тревожной кнопки;{'nameRu': 'Из одного источника по несостоявшимся закупкам'};25000.00;25000.00;{'nameRu': 'Услуга'}
110841005552/230038/00;"{'nameRu': 'ТОО ""Евразия Пресс А""'}";Услуги по подписке на печатные периодические издания;{'nameRu': 'Из одного источника по несостоявшимся закупкам'};11360.00;25000.00;{'nameRu': 'Услуга'}
110841005552/230037/00;"{'nameRu': 'ТОО ""Костанайские новости""'}";Услуги по подписке на печатные периодические издания;{'nameRu': 'Из одного источника по несостоявшимся закупкам'};9000.00;16800.00;{'nameRu': 'Услуга'}
