contractNumberSys;Supplier;descriptionRu;FaktTradeMethods;faktSum;contractSumWnds;RefSubjectType
070140003882/230112/00;"{'nameRu': 'ТОО ""ТОО FORWARD STROY""'}";Приобретение краски белого цвета;{'nameRu': 'Запрос ценовых предложений'};233700.00;261744.00;{'nameRu': 'Товар'}
070140003882/230111/00;{'nameRu': 'ИП Кузьмина М.В.'};Приобретение краски разных цветов;{'nameRu': 'Запрос ценовых предложений'};132890.00;148836.80;{'nameRu': 'Товар'}
070140003882/230110/00;"{'nameRu': 'ТОО ""Эталон Авто Костанай""'}";Приобретение бензина АИ-92;{'nameRu': 'Второй этап конкурса с использованием рамочного соглашения'};549107.14;615000.00;{'nameRu': 'Товар'}
070140003882/230109/00;"{'nameRu': 'ИП ""i-tex""'}";Приобретение ноутбуков согласно технической спецификации;{'nameRu': 'Запрос ценовых предложений'};0.00;735000.00;{'nameRu': 'Товар'}
070140003882/230108/00;"{'nameRu': 'ТОО ""InterExpress""'}";Услуги по техническому осмотру микроавтобуса Mercedes-Benz согласно технической спецификации;{'nameRu': 'Запрос ценовых предложений'};3125.00;3500.00;{'nameRu': 'Услуга'}
070140003882/230107/00;{'nameRu': 'ИП Сарсенбаев'};Приобретение вытяжного вентилятора;{'nameRu': 'Запрос ценовых предложений'};186000.00;186000.00;{'nameRu': 'Товар'}
070140003882/230069/01;"{'nameRu': 'ТОО ""НасосСервис""'}";Работы по ремонту электродвигателя согласно технической спецификации;{'nameRu': 'Запрос ценовых предложений'};227500.00;254800.00;{'nameRu': 'Работа'}
070140003882/230086/01;"{'nameRu': 'ТОО ""KURAL TRADE""'}";Услуги по экспертизе освещенности;{'nameRu': 'Запрос ценовых предложений'};1000000.00;1000000.00;{'nameRu': 'Работа'}
070140003882/230091/01;{'nameRu': 'ИП Бакиров Б'};Приобретение мячей размер 5;{'nameRu': 'Запрос ценовых предложений'};474500.00;474500.00;{'nameRu': 'Товар'}
070140003882/230089/01;{'nameRu': 'Индивидуальный предприниматель ИнКа'};Сетка для футбольных ворот;{'nameRu': 'Запрос ценовых предложений'};129996.00;129996.00;{'nameRu': 'Товар'}
070140003882/230106/00;"{'nameRu': 'ИП ""НурХас""'}";Приобретение фертики газонной весна-лето;{'nameRu': 'Запрос ценовых предложений'};0.00;4275000.00;{'nameRu': 'Товар'}
070140003882/230082/01;{'nameRu': 'ИП Тарасов'};Приобретение хозяйственных товаров;{'nameRu': 'Запрос ценовых предложений'};203060.00;203060.00;{'nameRu': 'Товар'}
070140003882/230023/01;{'nameRu': 'ИП Кулманова'};Приобретение чистящих средств и хозяйственных материалов;{'nameRu': 'Запрос ценовых предложений'};554259.00;554259.00;{'nameRu': 'Товар'}
070140003882/230105/00;"{'nameRu': 'ТОО ""КостанайТехСервис+""'}";Техническое обслуживания контрольно-кассовой машины;{'nameRu': 'Из одного источника по несостоявшимся закупкам'};3080.36;10350.00;{'nameRu': 'Услуга'}
070140003882/230104/00;"{'nameRu': 'ТОО ""КостанайТехСервис+""'}";Контрольно-кассовая машина с функцией фиксации и передачи данных;{'nameRu': 'Из одного источника по несостоявшимся закупкам'};72321.43;81000.00;{'nameRu': 'Товар'}
070140003882/230103/00;{'nameRu': 'ИП ТАРНОВСКАЯ ЮЛИЯ НИКОЛАЕВНА'};Услуги по сервисному обслуживанию программы 1 С Бухгалтерии (консультации по ведению учета в программе) - 15 часов;{'nameRu': 'Запрос ценовых предложений'};0.00;150000.00;{'nameRu': 'Услуга'}
070140003882/230102/00;{'nameRu': 'ИП НАМ ЛЮДМИЛА ГРИГОРЬЕВНА'};Информационно- технологическое сопровождение БЮДЖЕТ ПРОФ на 12 месяцев согласно технической спецификации;{'nameRu': 'Запрос ценовых предложений'};98214.28;109999.99;{'nameRu': 'Услуга'}
070140003882/230101/00;{'nameRu': 'Oil Центр'};Услуги по техническому обслуживанию автотранспортного средства TOYOTA LAND CRUISER PRADO согласно технической спецификации;{'nameRu': 'Запрос ценовых предложений'};49550.00;55496.00;{'nameRu': 'Услуга'}
070140003882/230061/01;{'nameRu': 'ИП Айбек'};"Папка-скоросшиватель &quot;Дело №&quot; формата А4 изготовлена из белого немелованного картона (плотность 260 г/кв.м).";{'nameRu': 'Электронный магазин'};4017.50;4017.50;{'nameRu': 'Товар'}
070140003882/230100/00;"{'nameRu': 'ИП ""Даму""'}";Приобретение сантехнических материалов;{'nameRu': 'Запрос ценовых предложений'};1030074.00;1030074.00;{'nameRu': 'Товар'}
070140003882/230099/00;{'nameRu': 'ИП ИСМАГУЛОВА ГУЛМИРА БАЗАРОВНА'};Услуги по техническому обслуживанию автотранспортного средства KIA CERATO согласно технической спецификации;{'nameRu': 'Запрос ценовых предложений'};54000.00;54000.00;{'nameRu': 'Услуга'}
070140003882/230098/00;{'nameRu': 'ИП Мариям'};Клапан электромагнитный PGV 201 GB2, для поливочной системы.;{'nameRu': 'Из одного источника по несостоявшимся закупкам'};325000.00;325000.00;{'nameRu': 'Товар'}
070140003882/230097/00;"{'nameRu': 'Костанайский областной филиал №229900 Акционерного общества ""Народный сберегательный банк Казахстана""'}";Услуги банков второго уровня (финансовые услуги банка 0,25% на взнос наличных денег);{'nameRu': 'Из одного источника путем прямого заключения договора'};0.00;100000.00;{'nameRu': 'Услуга'}
070140003882/230096/00;"{'nameRu': 'ИП ""ТАБАРАН А.Г.""'}";Столовые приборы;{'nameRu': 'Запрос ценовых предложений'};10440.00;10440.00;{'nameRu': 'Товар'}
070140003882/230025/01;{'nameRu': 'ИП Тарасов'};Приобретение электрических материалов;{'nameRu': 'Запрос ценовых предложений'};125000.00;125000.00;{'nameRu': 'Товар'}
070140003882/230095/00;{'nameRu': 'ИП Ai Market'};Файл вкладыш прозрачный формата А4, 100 мкм, глянцевый;{'nameRu': 'Электронный магазин'};4000.00;4000.00;{'nameRu': 'Товар'}
070140003882/230094/00;{'nameRu': 'ИП Дутбаева'};Флеш-накопитель;{'nameRu': 'Электронный магазин'};6900.00;6900.00;{'nameRu': 'Товар'}
070140003882/230093/00;{'nameRu': 'ИП Кымбат'};Скотч двухсторонний. Длина скотча, м 8.Ширина скотча, мм 40.;{'nameRu': 'Электронный магазин'};9000.00;9000.00;{'nameRu': 'Товар'}
070140003882/230092/00;{'nameRu': 'ИП Запорожский Александр Владимирович'};Прибор управления речевым оповещением;{'nameRu': 'Из одного источника по несостоявшимся закупкам'};47777.00;47777.00;{'nameRu': 'Товар'}
070140003882/230048/02;{'nameRu': 'ИП Kausar'};Предохранитель плавкий на 400А;{'nameRu': 'Запрос ценовых предложений'};194400.00;217728.00;{'nameRu': 'Товар'}
070140003882/230048/01;{'nameRu': 'ИП Kausar'};Предохранитель плавкий на 400А;{'nameRu': 'Запрос ценовых предложений'};0.00;217728.00;{'nameRu': 'Товар'}
070140003882/230091/00;{'nameRu': 'ИП Бакиров Б'};Приобретение мячей размер 5;{'nameRu': 'Запрос ценовых предложений'};0.00;474500.00;{'nameRu': 'Товар'}
070140003882/230090/00;{'nameRu': 'ИП Нуржакиева'};Приобретение мячей размер 4;{'nameRu': 'Запрос ценовых предложений'};468000.00;468000.00;{'nameRu': 'Товар'}
070140003882/230089/00;{'nameRu': 'Индивидуальный предприниматель ИнКа'};Сетка для футбольных ворот;{'nameRu': 'Запрос ценовых предложений'};0.00;129996.00;{'nameRu': 'Товар'}
070140003882/230088/00;{'nameRu': 'Антураж'};Аккумулятор 12V/7 Ач;{'nameRu': 'Запрос ценовых предложений'};33136.00;33136.00;{'nameRu': 'Товар'}
070140003882/230087/00;{'nameRu': 'ИП Султангалиева'};Работы по монтажу натяжного потолка согласно технической спецификации;{'nameRu': 'Запрос ценовых предложений'};199999.00;199999.00;{'nameRu': 'Работа'}
070140003882/230086/00;"{'nameRu': 'ТОО ""KURAL TRADE""'}";Услуги по экспертизе освещенности;{'nameRu': 'Запрос ценовых предложений'};0.00;1000000.00;{'nameRu': 'Работа'}
070140003882/230085/00;{'nameRu': 'LABSPORT ИП Кечик'};Услуги по сертификации футбольного поля с искусственным покрытием по адресу: г.Костанай, мкр.Береке, участок 142 Крытый футбольный манеж Тобыл Арена;{'nameRu': 'Запрос ценовых предложений'};3490000.00;3490000.00;{'nameRu': 'Услуга'}
070140003882/230084/00;"{'nameRu': 'Товарищество с ограниченной ответственностью ""Kenpeil (Кенпейл)""'}";Общая тетрадь большая. 48 листов. Формат А5. Обложка твердая.;{'nameRu': 'Электронный магазин'};5142.60;5142.60;{'nameRu': 'Товар'}
070140003882/230083/00;"{'nameRu': 'ТОО ""Sollan""'}";Шнур для футбольных ворот;{'nameRu': 'Запрос ценовых предложений'};21000.00;21000.00;{'nameRu': 'Товар'}
070140003882/230082/00;{'nameRu': 'ИП Тарасов'};Приобретение хозяйственных товаров;{'nameRu': 'Запрос ценовых предложений'};0.00;203060.00;{'nameRu': 'Товар'}
070140003882/230081/00;{'nameRu': 'ИП НАУРУЗБАЕВА ДАРИЯ КУЛТАЕВНА'};Хозяйственные товары  (щетка для покраски, крючок на вешалку);{'nameRu': 'Запрос ценовых предложений'};48304.78;48304.78;{'nameRu': 'Товар'}
070140003882/230080/00;{'nameRu': 'Incom'};Эпоксидный клей: Клей эпоксидный, весом 50-80 гр;{'nameRu': 'Запрос ценовых предложений'};10850.00;10850.00;{'nameRu': 'Товар'}
070140003882/230045/01;{'nameRu': 'ИП Лю Елена'};Водоэмульсионная краска белая, по 25 кг., фасадная, моющая повышенная атмосферостойкая;{'nameRu': 'Из одного источника по несостоявшимся закупкам'};240000.00;240000.00;{'nameRu': 'Товар'}
070140003882/230079/00;{'nameRu': 'ИП Родничок'};Тетрадь 12 листов в клетку, листы белого цвета;{'nameRu': 'Электронный магазин'};982.20;982.20;{'nameRu': 'Товар'}
070140003882/230017/01;"{'nameRu': 'Общественное объединение ""Общество инвалидов ""Шектелме""'}";Приобретение спортивной экипировки;{'nameRu': 'Запрос ценовых предложений'};10410000.00;11659200.00;{'nameRu': 'Товар'}
070140003882/230078/00;"{'nameRu': 'ИП ""ШАҢЫРАҚ +""'}";Работы по оформлению холла помещений согласно технической спецификации;{'nameRu': 'Из одного источника по несостоявшимся закупкам'};697000.00;697000.00;{'nameRu': 'Работа'}
070140003882/230077/00;{'nameRu': 'ИП АйРус'};Аккумулятор 12V/7 Ач;{'nameRu': 'Из одного источника по несостоявшимся закупкам'};9099.00;9099.00;{'nameRu': 'Товар'}
070140003882/230076/00;{'nameRu': 'ИП Гальцова Анастасия Юрьевна'};Телевизор цветной, ширина – 90 см, высота – 50 см.;{'nameRu': 'Запрос ценовых предложений'};138000.00;154560.00;{'nameRu': 'Товар'}
070140003882/230075/00;"{'nameRu': 'ИП ""Феникс""'}";Труба гофрированная ПВХ 16 мм;{'nameRu': 'Запрос ценовых предложений'};14800.00;14800.00;{'nameRu': 'Товар'}
070140003882/230074/00;{'nameRu': 'Левченко А.Н.'};ВЭРС-ПК24П версия 3.2 прибор приёмно-контрольный;{'nameRu': 'Запрос ценовых предложений'};75500.00;84560.00;{'nameRu': 'Товар'}
070140003882/230073/00;{'nameRu': 'ИП ЖАГИПАРОВА АЛТЫН КОНКАЕВНА'};Водяной насос: 1) расход - 4,7 m3/h 2) рабочая температура (мак.) – 110 0С 3) напор –5,5 m 4) вид тока – 1 -230V/50hz 5) рабочее давление/номинальное давление - 10 bar 6) потребляемая мощность – 0,050…0,099 kW 7) частота вращения – 2700 1/min;{'nameRu': 'Запрос ценовых предложений'};79501.00;79501.00;{'nameRu': 'Товар'}
070140003882/230072/00;{'nameRu': 'ИП Сартаева И М'};Услуги шиномонтажа автотранспортных средств согласно технической спецификации;{'nameRu': 'Запрос ценовых предложений'};80000.00;80000.00;{'nameRu': 'Услуга'}
070140003882/230071/00;"{'nameRu': 'АО ""Нефтяная страховая компания""'}";Услуги по обязательному страхованию гражданско-правовой ответственности владельцев автомобильного транспорта согласно технической спецификации;{'nameRu': 'Запрос ценовых предложений'};35263.67;35263.67;{'nameRu': 'Услуга'}
070140003882/230070/00;"{'nameRu': 'ТОО ""InterExpress""'}";Услуги по техническому осмотру автотранспортного средства согласно технической спецификации;{'nameRu': 'Запрос ценовых предложений'};3125.00;3500.00;{'nameRu': 'Услуга'}
070140003882/230069/00;"{'nameRu': 'ТОО ""НасосСервис""'}";Работы по ремонту электродвигателя согласно технической спецификации;{'nameRu': 'Запрос ценовых предложений'};0.00;254800.00;{'nameRu': 'Работа'}
070140003882/230068/00;{'nameRu': 'Oil Центр'};Услуги по техническому обслуживанию трактора автотранспортного средства KIA CERATO согласно технической спецификации;{'nameRu': 'Запрос ценовых предложений'};8325.00;9324.00;{'nameRu': 'Услуга'}
070140003882/230067/00;"{'nameRu': 'Товарищество с ограниченной ответственностью ""Северный регион 2030 KZ""'}";Летние шины 285/65 R17 TOYOTA LAND CRUISER PRADO;{'nameRu': 'Запрос ценовых предложений'};196396.00;219963.52;{'nameRu': 'Товар'}
070140003882/230066/00;{'nameRu': 'Дизайн и Типография'};Работы по изготовлению штампа 58х22 мм на простом корпусе в количестве 1 штуки;{'nameRu': 'Запрос ценовых предложений'};10000.00;10000.00;{'nameRu': 'Работа'}
070140003882/230065/00;{'nameRu': 'ИП Ахметова'};Батарейки мизинчиковые. 40 штук. тип ААА, 1,5V, неперезаряжаемые, произведенные не ранее 2022 года. батарейки алкалиновая, рабочее напряжение 1,5В.;{'nameRu': 'Электронный магазин'};18131.60;18131.60;{'nameRu': 'Товар'}
070140003882/230064/00;"{'nameRu': 'ТОО ""Казах Кенсе""'}";Бумага для офисной техники, формат А4;{'nameRu': 'Электронный магазин'};91250.00;102200.00;{'nameRu': 'Товар'}
070140003882/230063/00;{'nameRu': 'ИП SAUDA'};Насадка из микрофибры для поверхностей (кафель, мрамор, плитка и ламинат). 42 см.;{'nameRu': 'Электронный магазин'};25409.92;25409.92;{'nameRu': 'Товар'}
070140003882/230062/00;"{'nameRu': 'ИП ""Гайнуллин Ж.М.""'}";Салфетка  для уборки (тряпка для удаления пыли) в тубе желтая.;{'nameRu': 'Электронный магазин'};3825.00;3825.00;{'nameRu': 'Товар'}
070140003882/230061/00;{'nameRu': 'ИП Айбек'};Папка-скоросшиватель Делоформата А4 изготовлена из белого немелованного картона (плотность 260 г/кв.м).;{'nameRu': 'Электронный магазин'};0.00;4017.50;{'nameRu': 'Товар'}
070140003882/230060/00;{'nameRu': 'ИП Родничок'};Общая тетрадь большая. 96 листов. Формат А4. Обложка твердая.;{'nameRu': 'Электронный магазин'};5616.10;5616.10;{'nameRu': 'Товар'}
070140003882/230059/00;{'nameRu': 'ИП Родничок'};Ручка канцелярская с синей пастой (стержнем).;{'nameRu': 'Электронный магазин'};2678.50;2678.50;{'nameRu': 'Товар'}
070140003882/230058/00;{'nameRu': 'ИП Кымбат'};Скотч прозрачный: Скотч прозрачный канцелярский. Ширина не менее 50 мм, намотка не менее 60мм .;{'nameRu': 'Электронный магазин'};15000.00;15000.00;{'nameRu': 'Товар'}
070140003882/230057/00;"{'nameRu': 'ТОО ""ИнфоТех & Сервис""'}";Услуги по предоставлению лицензий на право использования программного обеспечения ИС Параграф;{'nameRu': 'Из одного источника путем прямого заключения договора'};600000.00;600000.00;{'nameRu': 'Услуга'}
070140003882/230056/00;"{'nameRu': 'ТОО ""Kst trade""'}";Приобретение  дизельного топлива летнего согласно технической спецификации;{'nameRu': 'Из одного источника по несостоявшимся закупкам'};928571.43;1040000.00;{'nameRu': 'Товар'}
070140003882/230055/00;"{'nameRu': 'ИП ""ХОД КОНЕМ""'}";Полотно для ножовки по металлу;{'nameRu': 'Запрос ценовых предложений'};11700.00;11700.00;{'nameRu': 'Товар'}
070140003882/230054/00;{'nameRu': 'ИП Тасым'};Приобретение фертики газонной весна-лето;{'nameRu': 'Запрос ценовых предложений'};0.00;4275000.00;{'nameRu': 'Товар'}
070140003882/230053/00;"{'nameRu': 'Товарищество с ограниченной ответственностью ""Д и В - ART""'}";Приобретение настольной подушки и краски на спиртовой основе;{'nameRu': 'Из одного источника по несостоявшимся закупкам'};29400.00;29400.00;{'nameRu': 'Товар'}
070140003882/230052/00;"{'nameRu': 'филиал ""УМГ ""Костанай"" АО ""ИЦА""'}";"Услуги по техническому обслуживанию распределительных газопроводов и сооружений на них на объекте Заказчика: Костанайская область, г.Костанай, мкр. Береке, участок 142, Крытый футбольный манеж &quot;Тобыл-Арена&quot; согласно технической спецификации";{'nameRu': 'Из одного источника по несостоявшимся закупкам'};0.00;323397.95;{'nameRu': 'Услуга'}
070140003882/230051/00;{'nameRu': 'Oil Центр'};Услуги по техническому обслуживанию трактора LOVOL TB 604 согласно технической спецификации;{'nameRu': 'Запрос ценовых предложений'};43050.00;48216.00;{'nameRu': 'Услуга'}
070140003882/230050/00;"{'nameRu': 'ТОО ""Научно-производственное предприятие ""ИНВЕНТ-плюс""'}";Приобретение семян газонных трав;{'nameRu': 'Запрос ценовых предложений'};591640.00;2366560.00;{'nameRu': 'Товар'}
070140003882/230049/00;"{'nameRu': 'ТОО ""IT Supply""'}";Приобретение многофункционального  устройства;{'nameRu': 'Запрос ценовых предложений'};440000.00;492800.00;{'nameRu': 'Товар'}
070140003882/230048/00;{'nameRu': 'ИП Kausar'};Приобретение предохранителей  плавких;{'nameRu': 'Запрос ценовых предложений'};0.00;194400.00;{'nameRu': 'Товар'}
070140003882/230047/00;{'nameRu': 'ИП Karimova'};Приобретение хозяйственных  товаров;{'nameRu': 'Из одного источника по несостоявшимся закупкам'};0.00;128500.00;{'nameRu': 'Товар'}
070140003882/230046/00;"{'nameRu': 'ТОО ""ХимЭкспресс - 2004""'}";Приобретение калимагнезии;{'nameRu': 'Из одного источника по несостоявшимся закупкам'};420000.00;470400.00;{'nameRu': 'Товар'}
070140003882/230045/00;{'nameRu': 'ИП Лю Елена'};Водоэмульсионная краска белая, по 25 кг., фасадная, моющая повышенная атмосферостойкая;{'nameRu': 'Из одного источника по несостоявшимся закупкам'};0.00;240000.00;{'nameRu': 'Товар'}
070140003882/230044/00;{'nameRu': 'Некоммерческое акционерное общество «Государственная корпорация «Правительство для граждан»'};Изготовление и выдача актов на земельные участки, расположенные по адресу: г.Костанай, мкр. Береке, участок 142, Крытый футбольный манеж Тобыл Арена общей площадью 3,2213 га и 0,6115 га;{'nameRu': 'Из одного источника путем прямого заключения договора'};25392.00;28439.04;{'nameRu': 'Работа'}
070140003882/230043/00;"{'nameRu': 'ТОО ""Кен - Сауда LTD""'}";Приобретение речного песка;{'nameRu': 'Из одного источника по несостоявшимся закупкам'};0.00;91500.00;{'nameRu': 'Товар'}
070140003882/230042/00;"{'nameRu': 'ТОО ""Эталон Авто Костанай""'}";Приобретение дизельного топлива зимнего;{'nameRu': 'Второй этап конкурса с использованием рамочного соглашения'};1250000.00;1400000.00;{'nameRu': 'Товар'}
070140003882/230041/00;{'nameRu': 'ИП Zhekenov Company'};Приобретение саморезов;{'nameRu': 'Запрос ценовых предложений'};85056.00;85056.00;{'nameRu': 'Товар'}
