contractNumberSys;Supplier;descriptionRu;FaktTradeMethods;faktSum;contractSumWnds;RefSubjectType
970240002955/230008/00;"{'nameRu': 'ТОО ""Рудненские тепловые сети""'}";Горячая вода, теплоэнергия на отопление;{'nameRu': 'Из одного источника путем прямого заключения договора'};0.00;51000000.00;{'nameRu': 'Услуга'}
970240002955/230007/00;"{'nameRu': 'ТОО ""Рудненская дезинфекционная станция""'}";Услуги санитарные ( дератизация (от грызунов) 1000 кв.м );{'nameRu': 'Запрос ценовых предложений'};15392.00;18900.00;{'nameRu': 'Услуга'}
970240002955/230006/00;"{'nameRu': 'ТОО ""СанЭпидСервис Костанай""'}";Услуги санитарные ( дезинсекция (от тараканов) 1200 кв.м );{'nameRu': 'Запрос ценовых предложений'};10000.00;20000.00;{'nameRu': 'Услуга'}
970240002955/230005/00;"{'nameRu': 'ТОО ""КУЗЕТ-МОНТАЖ-СЕРВИС""'}";Услуги по Техническому обслуживанию тревожной сигнализации;{'nameRu': 'Запрос ценовых предложений'};45360.00;62376.00;{'nameRu': 'Услуга'}
970240002955/230004/00;"{'nameRu': 'ТОО ""КУЗЕТ-МОНТАЖ-СЕРВИС""'}";Техническое обслуживание охранной сигнализации оружейной комнаты и охрана пультом;{'nameRu': 'Запрос ценовых предложений'};51624.00;70992.00;{'nameRu': 'Услуга'}
970240002955/230003/00;"{'nameRu': 'ТОО ""Рудный-ТАЗАЛЫҚ-2006""'}";Услуги по Вывозу твердо-бытовых отходов;{'nameRu': 'Запрос ценовых предложений'};135000.00;135000.00;{'nameRu': 'Услуга'}
970240002955/230002/00;"{'nameRu': 'Товарищество с ограниченной ответственностью """"Bilim Land""""'}";Услуги по предоставлению доступа к комплексному виртуальному обучению по программе подготовки к ЕНТ – «iTest», мультимедийному курсу начальной школы «iMektep», «Образовательной платформе – «BilimLand», коллекция обучающих фильмов «Twig-bilim», OnlineMektep - информативный цифровой образовательный портал.;{'nameRu': 'Из одного источника путем прямого заключения договора'};580000.00;580000.00;{'nameRu': 'Услуга'}
970240002955/230001/00;"{'nameRu': 'Товарищество с ограниченной ответственностью ""ПРОИЗВОДСТВЕННОЕ ОБЪЕДИНЕНИЕ ""ЭКОС""'}";Затраты на обеспечение питания в школе для детей из малообеспеченных семей (комплексные обеды);{'nameRu': 'Из одного источника путем прямого заключения договора по питанию обучающихся'};0.00;1178831.73;{'nameRu': 'Услуга'}
