contractNumberSys;Supplier;descriptionRu;FaktTradeMethods;faktSum;contractSumWnds;RefSubjectType
050140012104/230064/00;{'nameRu': 'ИП ALMAMOUNT 2017'};Работы по ремонту/реконструкции электрического, электрораспределительного/регулирующего оборудования и аналогичной аппаратуры;{'nameRu': 'Запрос ценовых предложений'};0.00;10851680.00;{'nameRu': 'Работа'}
050140012104/230063/00;{'nameRu': 'MANCHESTER'};Светильники уличного освещения/;{'nameRu': 'Запрос ценовых предложений'};0.00;167400.00;{'nameRu': 'Товар'}
050140012104/230061/00;"{'nameRu': 'Товарищество с ограниченной ответственностью ""Учебный центр ""SGK KZ""'}";Услуги по организации/проведению конференций/семинаров/форумов/конкурсов/корпоративных/спортивных/культурных/праздничных и аналогичных мероприятий;{'nameRu': 'Из одного источника путем прямого заключения договора'};0.00;70000.00;{'nameRu': 'Услуга'}
050140012104/230059/00;{'nameRu': 'ИП Нуржанова Г С'};Услуги полиграфические по изготовлению/печатанию полиграфической продукции (кроме книг, фото, периодических изданий);{'nameRu': 'Запрос ценовых предложений'};0.00;85000.00;{'nameRu': 'Услуга'}
050140012104/230050/01;"{'nameRu': 'ТОО ""Dream Ways""'}";Работы по ремонту/благоустройству территории/;{'nameRu': 'Запрос ценовых предложений'};0.00;1624000.00;{'nameRu': 'Услуга'}
050140012104/230058/00;{'nameRu': 'ИП БРЕЙТЕНБЮХЕР ДМИТРИЙ ВИКТОРОВИЧ'};Услуги по техническому/сервисному обслуживанию двигателей автомобильных/;{'nameRu': 'Из одного источника по несостоявшимся закупкам'};0.00;109000.00;{'nameRu': 'Услуга'}
050140012104/230057/00;{'nameRu': 'ИП КУЛИКОВСКАЯ ИРИНА ПЕТРОВНА'};Лопата для уборки снега;{'nameRu': 'Из одного источника по несостоявшимся закупкам'};0.00;56770.00;{'nameRu': 'Товар'}
050140012104/230056/00;{'nameRu': 'ИП Мазкенова'};салфетка для уборки 30*30;{'nameRu': 'Из одного источника по несостоявшимся закупкам'};20688.00;20688.00;{'nameRu': 'Товар'}
050140012104/230055/00;"{'nameRu': 'ИП ""ИРГАСИМОВА АСЕМГУЛЬ МАРАТОВНА""'}";Работы по установке. нанесению знаков. стендов. табличек. надписей;{'nameRu': 'Запрос ценовых предложений'};0.00;348460.00;{'nameRu': 'Работа'}
050140012104/230054/00;{'nameRu': 'ИП УТЕПОВ Т.Х.'};Услуги по техническому обслуживанию компьютерной/периферийной оргтехники/оборудования и их частей;{'nameRu': 'Запрос ценовых предложений'};0.00;95000.00;{'nameRu': 'Услуга'}
050140012104/230053/00;{'nameRu': 'РГП на ПХВ «НЦКДА»'};Услуги по экспертизе/анализу/проверке документации;{'nameRu': 'Из одного источника путем прямого заключения договора'};0.00;516696.00;{'nameRu': 'Услуга'}
050140012104/230052/00;"{'nameRu': '""Алибекова""'}";Работы по ремонту/благоустройству территории/;{'nameRu': 'Из одного источника по несостоявшимся закупкам'};0.00;1329500.00;{'nameRu': 'Работа'}
050140012104/230051/00;"{'nameRu': 'ТОО ""ЭПК-forfait"" (ЭПК-форфайт)'}";Услуги по техническому обслуживанию электрического, электрораспределительного/регулирующего оборудования и аналогичной аппаратуры;{'nameRu': 'Из одного источника по несостоявшимся закупкам'};0.00;735000.00;{'nameRu': 'Работа'}
050140012104/230045/01;{'nameRu': 'ИП ARSENAL'};дихлофос для широкого спектра применения/;{'nameRu': 'Из одного источника по несостоявшимся закупкам'};0.00;44642.00;{'nameRu': 'Товар'}
050140012104/230050/00;"{'nameRu': 'ТОО ""Dream Ways""'}";Услуги по корректировке технической документации текущего ремонта уличного освещения;{'nameRu': 'Запрос ценовых предложений'};0.00;1450000.00;{'nameRu': 'Услуга'}
050140012104/230049/00;{'nameRu': 'ИП БРЕЙТЕНБЮХЕР ДМИТРИЙ ВИКТОРОВИЧ'};Услуги по техническому/сервисному обслуживанию двигателей автомобильных/;{'nameRu': 'Из одного источника по несостоявшимся закупкам'};0.00;422000.00;{'nameRu': 'Услуга'}
050140012104/230048/00;"{'nameRu': 'ТОО ""Мунай Трейд kst""'}";Бензин для двигателей с искровым зажиганием/;{'nameRu': 'Второй этап конкурса с использованием рамочного соглашения'};0.00;61488.00;{'nameRu': 'Товар'}
050140012104/230047/00;"{'nameRu': 'ТОО ""Мунай Трейд kst""'}";Бензин для двигателей с искровым зажиганием/;{'nameRu': 'Второй этап конкурса с использованием рамочного соглашения'};0.00;381288.10;{'nameRu': 'Товар'}
050140012104/230046/00;{'nameRu': 'ИП ИВАЩУК С.И.'};Услуги по вывозу (сбору) неопасных отходов/имущества/материалов;{'nameRu': 'Из одного источника по несостоявшимся закупкам'};0.00;142000.00;{'nameRu': 'Услуга'}
050140012104/230045/00;{'nameRu': 'ИП ARSENAL'};дихлофос для широкого спектра применения/;{'nameRu': 'Из одного источника по несостоявшимся закупкам'};0.00;44642.00;{'nameRu': 'Товар'}
050140012104/230044/00;"{'nameRu': 'ТОО ""Костанайская районная дезинфекционная станция""'}";Услуги санитарные (дезинфекция, дезинсекция, дератизация и аналогичные)/;{'nameRu': 'Запрос ценовых предложений'};0.00;87500.00;{'nameRu': 'Услуга'}
050140012104/230043/00;"{'nameRu': 'ТОО ""Центрум""'}";Услуги полиграфические по изготовлению/печатанию полиграфической продукции (кроме книг, фото, периодических изданий)/;{'nameRu': 'Запрос ценовых предложений'};0.00;11165.00;{'nameRu': 'Услуга'}
050140012104/230041/00;"{'nameRu': 'ИП ""ДАРХАН""'}";Услуги по корректировке проектной/технической документации/схем/паспортов и аналогичных документов;{'nameRu': 'Запрос ценовых предложений'};0.00;78000.00;{'nameRu': 'Услуга'}
050140012104/230040/00;"{'nameRu': 'ТОО ""КанцЦентр""'}";канцелярские товары;{'nameRu': 'Запрос ценовых предложений'};0.00;62429.92;{'nameRu': 'Товар'}
050140012104/230039/00;"{'nameRu': 'ТОО ""Казах Кенсе""'}";канцелярские товары;{'nameRu': 'Запрос ценовых предложений'};0.00;9154.04;{'nameRu': 'Товар'}
050140012104/230038/00;"{'nameRu': '""Zhansultan""'}";Принтер маркиратор;{'nameRu': 'Запрос ценовых предложений'};34179.00;34179.00;{'nameRu': 'Товар'}
050140012104/230036/00;"{'nameRu': 'ТОО ""Tender Consulting Compani""'}";Услуги по корректировке проектной/технической документации/схем/паспортов и аналогичных документов;{'nameRu': 'Из одного источника путем прямого заключения договора'};0.00;300000.00;{'nameRu': 'Услуга'}
050140012104/230027/01;{'nameRu': 'ИП Танар'};Работы по ремонту улиц;{'nameRu': 'Открытый конкурс'};55123956.25;130814874.00;{'nameRu': 'Работа'}
050140012104/230035/00;"{'nameRu': 'ТОО ""Горизонт-2012""'}";Услуги по размещению неопасных отходов/имущества/материалов;{'nameRu': 'Из одного источника по несостоявшимся закупкам'};0.00;7896.00;{'nameRu': 'Услуга'}
050140012104/230034/00;{'nameRu': 'ИП КУЛИКОВСКАЯ ИРИНА ПЕТРОВНА'};Известь;{'nameRu': 'Из одного источника по несостоявшимся закупкам'};39964.00;39964.00;{'nameRu': 'Товар'}
050140012104/230033/00;{'nameRu': 'ИП ЗАКАРИЯНОВ'};Планшет из пласмассы;{'nameRu': 'Запрос ценовых предложений'};105160.00;105160.00;{'nameRu': 'Товар'}
050140012104/230032/00;"{'nameRu': 'ТОО ""Есиль-Строй-Экспертиза""'}";Услуги по авторскому/техническому надзору;{'nameRu': 'Открытый конкурс'};1520472.32;3405858.62;{'nameRu': 'Услуга'}
050140012104/230031/00;"{'nameRu': 'ТОО ""Есиль-Строй-Экспертиза""'}";Услуги по авторскому/техническому надзору;{'nameRu': 'Открытый конкурс'};364558.93;816612.05;{'nameRu': 'Услуга'}
050140012104/230030/00;{'nameRu': 'РГП на ПХВ «НЦКДА»'};Работы по проведению экспертиз/испытаний/тестирований;{'nameRu': 'Из одного источника путем прямого заключения договора'};510608.38;780000.00;{'nameRu': 'Работа'}
050140012104/230029/00;{'nameRu': 'РГП на ПХВ «НЦКДА»'};Работы по проведению экспертиз/испытаний/тестирований;{'nameRu': 'Из одного источника путем прямого заключения договора'};1912266.14;2592000.00;{'nameRu': 'Работа'}
050140012104/230028/00;{'nameRu': 'ИП Танар'};Работы по ремонту улиц;{'nameRu': 'Открытый конкурс'};12816513.39;31359998.88;{'nameRu': 'Работа'}
050140012104/230027/00;{'nameRu': 'ИП Танар'};Работы по ремонту улиц;{'nameRu': 'Открытый конкурс'};0.00;131263998.88;{'nameRu': 'Работа'}
050140012104/230026/00;"{'nameRu': 'Товарищество с ограниченной ответственностью ""KAZOPTICLINK""'}";Услуги по техническому обслуживанию компьютерной/периферийной оргтехники/оборудования и их частей/;{'nameRu': 'Из одного источника по несостоявшимся закупкам'};0.00;50176.00;{'nameRu': 'Услуга'}
050140012104/230025/00;"{'nameRu': 'АО ""Информационно-учетный центр""'}";Услуги по обеспечению бесперебойного доступа к данным реестра государственного имущества;{'nameRu': 'Из одного источника путем прямого заключения договора'};41400.00;48300.00;{'nameRu': 'Услуга'}
050140012104/230008/01;"{'nameRu': 'АО ""Информационно-учетный центр""'}";Описание договора на русском языке Услуги по обеспечению бесперебойного доступа к данным реестра государственного имущества;{'nameRu': 'Из одного источника путем прямого заключения договора'};0.00;48300.00;{'nameRu': 'Услуга'}
050140012104/230024/00;"{'nameRu': 'АО ""Страховая компания ""Номад Иншуранс""'}";Услуги по страхованию гражданско-правовой ответственности владельцев автомобильного транспорта;{'nameRu': 'Запрос ценовых предложений'};0.00;28210.94;{'nameRu': 'Услуга'}
050140012104/230023/00;"{'nameRu': 'ТОО ""InterExpress""'}";Работы по техническому/сервисному обслуживанию технических средств/средств безопасности подвижного состава/;{'nameRu': 'Из одного источника по несостоявшимся закупкам'};0.00;5040.00;{'nameRu': 'Работа'}
050140012104/230022/00;"{'nameRu': 'ТОО ""Мунай Трейд kst""'}";бензин;{'nameRu': 'Второй этап конкурса с использованием рамочного соглашения'};0.00;134636.54;{'nameRu': 'Товар'}
050140012104/230021/00;{'nameRu': 'ИП ИВАЩУК С.И.'};Работы по содержанию автомобильных дорог;{'nameRu': 'Из одного источника по несостоявшимся закупкам'};656100.00;900000.00;{'nameRu': 'Работа'}
050140012104/230020/00;"{'nameRu': 'ТОО ""Казах Кенсе""'}";Бумага для офисного оборудования;{'nameRu': 'Электронный магазин'};0.00;51576.00;{'nameRu': 'Товар'}
050140012104/230019/00;"{'nameRu': 'АО ""КазТрансГаз Аймак""'}";Природный газ;{'nameRu': 'Из одного источника путем прямого заключения договора'};0.00;266580.88;{'nameRu': 'Товар'}
050140012104/230018/00;"{'nameRu': 'Товарищество с ограниченной ответственностью ""Редакция региональной общественно-политической газеты ARNA news""'}";Услуги по размещению информационных материалов в средствах массовой информации;{'nameRu': 'Из одного источника по несостоявшимся закупкам'};36360.00;63000.00;{'nameRu': 'Услуга'}
050140012104/230017/00;"{'nameRu': 'АО ""Казахтелеком""'}";Услуги по доступу к Интернету;{'nameRu': 'Второй этап конкурса с использованием рамочного соглашения'};0.00;346992.04;{'nameRu': 'Услуга'}
050140012104/230016/00;"{'nameRu': 'АО ""Казахтелеком""'}";Услуги телефонной связи;{'nameRu': 'Второй этап конкурса с использованием рамочного соглашения'};0.00;57000.00;{'nameRu': 'Услуга'}
050140012104/230015/00;"{'nameRu': 'ТОО ""Мунай Трейд kst""'}";бензин АИ-92;{'nameRu': 'Второй этап конкурса с использованием рамочного соглашения'};0.00;97237.50;{'nameRu': 'Товар'}
050140012104/230014/00;{'nameRu': 'ИП ИВАЩУК С.И.'};Работы по содержанию автомобильных дорог;{'nameRu': 'Из одного источника по несостоявшимся закупкам'};0.00;883930.00;{'nameRu': 'Работа'}
050140012104/230013/00;{'nameRu': 'ИП Кумискалиева Сауле Ахметовна'};Работы по ремонту/реконструкции электрического, электрораспределительного/регулирующего оборудования и аналогичной аппаратуры;{'nameRu': 'Запрос ценовых предложений'};0.00;14232000.00;{'nameRu': 'Работа'}
050140012104/230012/00;{'nameRu': 'ИП ЖИЕНБАЕВ Б.А.'};Услуги полиграфические по изготовлению/печатанию полиграфической продукции (кроме книг, фото, периодических изданий);{'nameRu': 'Из одного источника по несостоявшимся закупкам'};0.00;3500.00;{'nameRu': 'Услуга'}
050140012104/230011/00;{'nameRu': 'ИП УТЕПОВ Т.Х.'};Услуги по техническому обслуживанию компьютерной/периферийной оргтехники/оборудования и их частей/;{'nameRu': 'Из одного источника по несостоявшимся закупкам'};224000.00;336000.00;{'nameRu': 'Услуга'}
050140012104/230010/00;"{'nameRu': 'Товарищество с ограниченной ответственностью ""Парус-КАЗ""'}";Услуги по сопровождению и технической поддержке информационной системы;{'nameRu': 'Из одного источника путем прямого заключения договора'};152857.14;235400.00;{'nameRu': 'Услуга'}
050140012104/230009/00;"{'nameRu': 'Товарищество с ограниченной ответственностью ""Парус-КАЗ""'}";Услуги по установке/настройке программного обеспечения;{'nameRu': 'Из одного источника путем прямого заключения договора'};0.00;250000.00;{'nameRu': 'Услуга'}
050140012104/230008/00;"{'nameRu': 'АО ""Информационно-учетный центр""'}";Услуги по обеспечению  бесперебойного доступа к данным реестра государственного имущества;{'nameRu': 'Из одного источника путем прямого заключения договора'};0.00;48300.00;{'nameRu': 'Услуга'}
050140012104/230007/00;{'nameRu': 'Power'};Защищенный носитель ключевой информации Казтокен (Kaztoken);{'nameRu': 'Запрос ценовых предложений'};41697.00;46700.64;{'nameRu': 'Товар'}
050140012104/230006/00;{'nameRu': 'ИП ЖИЕНБАЕВ Б.А.'};Услуги полиграфические по изготовлению/печатанию полиграфической продукции (кроме книг, фото, периодических изданий;{'nameRu': 'Запрос ценовых предложений'};61425.00;94500.00;{'nameRu': 'Услуга'}
050140012104/230005/00;"{'nameRu': 'ИП""ДаКаР""'}";Услуги полиграфические по изготовлению/печатанию полиграфической продукции (кроме книг, фото, периодических изданий;{'nameRu': 'Запрос ценовых предложений'};0.00;114000.00;{'nameRu': 'Услуга'}
050140012104/230004/00;{'nameRu': 'ИП БУХАРОВ  ИЛЬЯ  ВЛАДИМИРОВИЧ'};Услуги по администрированию и техническому обслуживанию программно-аппаратного комплекса/;{'nameRu': 'Из одного источника по несостоявшимся закупкам'};234000.00;312000.00;{'nameRu': 'Услуга'}
050140012104/230003/00;"{'nameRu': 'ТОО ""Костанайский ЭнергоЦентр""'}";Электроэнергия;{'nameRu': 'Из одного источника путем прямого заключения договора'};0.00;191002.56;{'nameRu': 'Товар'}
050140012104/230002/00;"{'nameRu': 'ТОО ""Костанайский ЭнергоЦентр""'}";Электроэнергия;{'nameRu': 'Из одного источника путем прямого заключения договора'};0.00;1983016.90;{'nameRu': 'Товар'}
050140012104/230001/00;"{'nameRu': 'Товарищество с ограниченной ответственностью ""Парус-КАЗ""'}";"Обслуживание программного продукта &quot;Парус-КАЗ.Бюджет&quot; (Бюджетное финансирование МСУ)";{'nameRu': 'Из одного источника путем прямого заключения договора'};189891.96;283572.00;{'nameRu': 'Услуга'}
