contractNumberSys;Supplier;descriptionRu;FaktTradeMethods;faktSum;contractSumWnds;RefSubjectType
950340000067/230020/00;"{'nameRu': 'Кооператив собственников квартир ""УЮТ К""'}";Услуги по содержанию зданий/сооружений/помещений и прилегающих территорий (услуги ПКСК);{'nameRu': 'Из одного источника по несостоявшимся закупкам'};43380.00;57840.00;{'nameRu': 'Услуга'}
950340000067/230019/00;"{'nameRu': 'Государственное коммунальное предприятие ""Костанай-Су"" акимата города Костаная государственного учреждения ""Отдел жилищно-коммунального хозяйства, пассажирского транспорта и автомобильных дорог акимата города Костаная""'}";Услуги по подаче питьевой воды и удалению сточных вод;{'nameRu': 'Из одного источника путем прямого заключения договора'};7324.51;40416.46;{'nameRu': 'Услуга'}
950340000067/230018/00;{'nameRu': 'ИП Магнит 2017'};Комплекс работ по ремонту  с заменой запчастей  служебного автомобиля  Toyota Camry  052 RK10;{'nameRu': 'Запрос ценовых предложений'};241000.00;241000.00;{'nameRu': 'Работа'}
950340000067/230017/00;{'nameRu': 'ИП Магнит 2017'};Комплекс работ по ремонту с заменой запчастей служебного автомобиля Hyundai Elantra 267 BC 10;{'nameRu': 'Запрос ценовых предложений'};71900.00;71900.00;{'nameRu': 'Работа'}
950340000067/230016/00;"{'nameRu': 'ТОО ""ПиКом""'}";Услуги по заправке цветных картриджей;{'nameRu': 'Запрос ценовых предложений'};50000.00;96000.02;{'nameRu': 'Услуга'}
950340000067/230015/00;{'nameRu': 'ИП ЗОТОВ ЕВГЕНИЙ СЕРГЕЕВИЧ'};Услуги по заправке картриджей;{'nameRu': 'Запрос ценовых предложений'};123389.50;159220.00;{'nameRu': 'Услуга'}
950340000067/230014/00;"{'nameRu': 'ТОО ""Производственно-коммерческая фирма ""Теплосервис""'}";Услуги по техническому обслуживанию приборов учета тепловой энергии;{'nameRu': 'Из одного источника по несостоявшимся закупкам'};45000.00;88200.00;{'nameRu': 'Услуга'}
950340000067/230013/00;"{'nameRu': 'АО ""Нефтяная страховая компания""'}";Услуги по обязательному страхованию гражданско-правовой ответственности владельцев автотранспортных средств,2 единицы;{'nameRu': 'Запрос ценовых предложений'};70527.34;70527.34;{'nameRu': 'Услуга'}
950340000067/230012/00;"{'nameRu': 'ГКП ""Костанайская теплоэнергетическая компания"" акимата города Костаная государственного учреждения ""Отдел жилищно-коммунального хозяйства, пассажирского транспорта и автомобильных дорог акимата города Костаная""'}";Оказание услуг по снабжению тепловой энергией;{'nameRu': 'Из одного источника путем прямого заключения договора'};22318.35;127519.73;{'nameRu': 'Услуга'}
950340000067/230011/00;"{'nameRu': 'ТОО ""Костанайский ЭнергоЦентр""'}";электроэнергия;{'nameRu': 'Из одного источника путем прямого заключения договора'};0.00;17337.60;{'nameRu': 'Товар'}
950340000067/230010/00;{'nameRu': 'ИП Касымова'};Техническое обслуживание служебного автотранспорта;{'nameRu': 'Запрос ценовых предложений'};546500.00;645000.00;{'nameRu': 'Услуга'}
950340000067/230009/00;{'nameRu': 'ИП ТАРНОВСКАЯ ЮЛИЯ НИКОЛАЕВНА'};Услуги по сопровождению, обслуживанию  и  установки обновления на рабочее место пользователя программы 1C «Бухгалтерия 8,3»;{'nameRu': 'Запрос ценовых предложений'};260200.00;392000.00;{'nameRu': 'Услуга'}
950340000067/230008/00;"{'nameRu': 'ИП ""101""'}";Услуги по обслуживанию пожарной сигнализации;{'nameRu': 'Запрос ценовых предложений'};78993.00;105324.00;{'nameRu': 'Услуга'}
950340000067/230007/00;"{'nameRu': 'ГКП ""Костанайская теплоэнергетическая компания"" акимата города Костаная государственного учреждения ""Отдел жилищно-коммунального хозяйства, пассажирского транспорта и автомобильных дорог акимата города Костаная""'}";Оказание услуг по снабжению тепловой энергией;{'nameRu': 'Из одного источника путем прямого заключения договора'};3102858.31;7983005.16;{'nameRu': 'Услуга'}
950340000067/230006/00;"{'nameRu': 'АО ""Казахтелеком""'}";Услуги телефонной связи;{'nameRu': 'Второй этап конкурса с использованием рамочного соглашения'};6250.00;14083.08;{'nameRu': 'Услуга'}
950340000067/230005/00;"{'nameRu': 'АО ""Казахтелеком""'}";Услуги телефонной связи;{'nameRu': 'Второй этап конкурса с использованием рамочного соглашения'};634101.38;2355183.73;{'nameRu': 'Услуга'}
950340000067/230004/00;{'nameRu': 'АО «АлмаТел Казахстан»'};Услуги по доступу к Интернету;{'nameRu': 'Второй этап конкурса с использованием рамочного соглашения'};339112.90;504000.00;{'nameRu': 'Услуга'}
950340000067/230003/00;"{'nameRu': 'Государственное коммунальное предприятие ""Костанай-Су"" акимата города Костаная государственного учреждения ""Отдел жилищно-коммунального хозяйства, пассажирского транспорта и автомобильных дорог акимата города Костаная""'}";Услуги по подаче питьевой воды и удалению сточных вод;{'nameRu': 'Из одного источника путем прямого заключения договора'};0.00;193566.30;{'nameRu': 'Услуга'}
950340000067/230002/00;"{'nameRu': 'ТОО ""Костанайский ЭнергоЦентр""'}";электроэнергия;{'nameRu': 'Из одного источника путем прямого заключения договора'};1811314.80;2587643.16;{'nameRu': 'Товар'}
950340000067/230001/00;"{'nameRu': 'Товарищество с ограниченной ответственностью ""Парус-КАЗ""'}";Обслуживание программного продукта ''Парус-КАЗ.Бюджет'' (Бюджетное финансирование);{'nameRu': 'Из одного источника путем прямого заключения договора'};782607.14;1051824.00;{'nameRu': 'Услуга'}
