contractNumberSys;Supplier;descriptionRu;FaktTradeMethods;faktSum;contractSumWnds;RefSubjectType
020240000248/230026/00;"{'nameRu': 'АО ""Казахтелеком""'}";Услуги по передаче данных;{'nameRu': 'Из одного источника путем прямого заключения договора'};7593.61;18000.00;{'nameRu': 'Услуга'}
020240000248/230025/00;{'nameRu': 'ИП ИТКАРИНОВ СЕРИКБОЛ СЕРИКБАЕВИЧ'};Услуги по аренде спецтехники;{'nameRu': 'Из одного источника по несостоявшимся закупкам'};1500000.00;1680000.00;{'nameRu': 'Услуга'}
020240000248/230024/00;{'nameRu': 'ИП АГУНЬКИН ВИТАЛИЙ ВЛАДИМИРОВИЧ'};Услуги по обслуживанию программного обеспечения. компьютерной техники и заправке картриджей;{'nameRu': 'Из одного источника по несостоявшимся закупкам'};366000.00;590000.00;{'nameRu': 'Услуга'}
020240000248/230023/00;"{'nameRu': 'АО ""Страховая Компания ""Сентрас Иншуранс""'}";Услуги по обязательному и добровольному страхованию автотранспорта;{'nameRu': 'Запрос ценовых предложений'};269963.07;643976.24;{'nameRu': 'Услуга'}
020240000248/230022/00;{'nameRu': 'ИП ТЫЩЕНКО ЕЛЕНА БОРИСОВНА'};Приобретение молока;{'nameRu': 'Из одного источника по несостоявшимся закупкам'};15803.57;17700.00;{'nameRu': 'Товар'}
020240000248/230021/00;"{'nameRu': 'АО ""Казахтелеком""'}";Услуги телефонной связи;{'nameRu': 'Второй этап конкурса с использованием рамочного соглашения'};82630.69;168000.00;{'nameRu': 'Услуга'}
020240000248/230020/00;"{'nameRu': 'ТОО ""Uplink""'}";Услуги доступа Интернет;{'nameRu': 'Второй этап конкурса с использованием рамочного соглашения'};239085.00;357033.60;{'nameRu': 'Услуга'}
020240000248/230019/00;{'nameRu': 'ИП БАБЕНКО ПАВЕЛ ЮРЬЕВИЧ'};Приобретение канцелярских товаров;{'nameRu': 'Запрос ценовых предложений'};207540.00;207540.00;{'nameRu': 'Товар'}
020240000248/230018/00;{'nameRu': 'ГАУҺАР'};Приобретение хозяйственных товаров;{'nameRu': 'Запрос ценовых предложений'};206200.00;206200.00;{'nameRu': 'Товар'}
020240000248/230017/00;"{'nameRu': 'ТОО ""РЦПиПК ""КазПроф""""'}";Услуги по обучению должностных лиц и обслуживающего персонала.;{'nameRu': 'Запрос ценовых предложений'};0.00;89000.00;{'nameRu': 'Услуга'}
020240000248/230016/00;"{'nameRu': 'ТОО ""СПБ-Групп""'}";"Услуги по аттестации по &quot;ПТЭ при эксплуатации электроустановок потребителей&quot; и &quot;ПТБ при эксплуатации электроустановок  потребителей&quot; от 2 до 4 группы";{'nameRu': 'Запрос ценовых предложений'};10000.00;40000.00;{'nameRu': 'Услуга'}
020240000248/230015/00;"{'nameRu': 'ТОО ""Kst trade""'}";Приобретение талонов дизельного топлива;{'nameRu': 'Из одного источника по несостоявшимся закупкам'};1160714.29;1300000.00;{'nameRu': 'Товар'}
020240000248/230014/00;"{'nameRu': 'ГКП ПХО ""Лисаковскгоркоммунэнерго"" акимата города Лисаковска'}";Услуги по передаче/распределению электроэнергии;{'nameRu': 'Из одного источника путем прямого заключения договора'};875049.11;1683955.00;{'nameRu': 'Услуга'}
020240000248/230013/00;"{'nameRu': 'ГКП ПХО ""Лисаковскгоркоммунэнерго"" акимата города Лисаковска'}";Услуги водоснабжения и водоотведения;{'nameRu': 'Из одного источника путем прямого заключения договора'};66188.39;894540.00;{'nameRu': 'Услуга'}
020240000248/230012/00;"{'nameRu': 'ГКП ПХО ""Лисаковскгоркоммунэнерго"" акимата города Лисаковска'}";Услуги по распределению горячей воды (тепловой энергии) на коммунально-бытовые нужды;{'nameRu': 'Из одного источника путем прямого заключения договора'};469937.50;1610202.00;{'nameRu': 'Услуга'}
020240000248/230011/00;"{'nameRu': 'ТОО ""Беркут-2018""'}";Работы по ремонту ручных инструментов;{'nameRu': 'Из одного источника по несостоявшимся закупкам'};112930.00;200000.00;{'nameRu': 'Работа'}
020240000248/230010/00;{'nameRu': 'ИП  ШИПИЛКИН ВЛАДИМИР ГЕННАДЬЕВИЧ'};"Работы по ремонту ручных инструментов марки &quot;STIHL&quot;.";{'nameRu': 'Из одного источника по несостоявшимся закупкам'};394464.29;784000.00;{'nameRu': 'Работа'}
020240000248/230009/00;"{'nameRu': 'Товарищество с ограниченной ответственностью ""Investment solutions Astana""'}";Приобретение перчаток двойных полушерстяных для зимних работ;{'nameRu': 'Из одного источника по несостоявшимся закупкам'};200000.00;224000.00;{'nameRu': 'Товар'}
020240000248/230008/00;"{'nameRu': 'ТОО ""Сигнал""'}";Работы по ремонту и обслуживанию легковых автомобилей в количестве 5 единиц.;{'nameRu': 'Из одного источника по несостоявшимся закупкам'};998000.00;998000.00;{'nameRu': 'Работа'}
020240000248/230007/00;"{'nameRu': 'ТОО ""Servise Trade Company""'}";Работы по ремонту спецтехники (работы должны включать в себя предоставление запасных частей и смазочных материалов и аксессуаров);{'nameRu': 'Из одного источника по несостоявшимся закупкам'};1040178.57;1680000.00;{'nameRu': 'Работа'}
020240000248/230006/00;"{'nameRu': 'ТОО ""Жулдыз плюсс""'}";Внутридомовое обслуживание офиса;{'nameRu': 'Из одного источника по несостоявшимся закупкам'};24880.50;33174.00;{'nameRu': 'Услуга'}
020240000248/230005/00;"{'nameRu': 'Товарищество с ограниченной ответственностью ""Investment solutions Astana""'}";Приобретение перчаток рабочих трикотажных хб с ПВХ;{'nameRu': 'Запрос ценовых предложений'};78200.00;87584.00;{'nameRu': 'Товар'}
020240000248/230004/00;"{'nameRu': 'ТОО ""Бархатный путь""'}";Работы по ремонту металлических ограждений 200 штук и металлических урн 335 штуки.;{'nameRu': 'Запрос ценовых предложений'};86000.00;900000.00;{'nameRu': 'Работа'}
020240000248/230003/00;{'nameRu': 'Индивидуальный предприниматель Хизбулаева Эльмира Владимировна'};Ремонт светодиодных светильников уличного освещения;{'nameRu': 'Запрос ценовых предложений'};1123000.00;1123000.00;{'nameRu': 'Работа'}
020240000248/230002/00;"{'nameRu': 'ТОО ""Avto Servis 2018""'}";Работы по ремонту и обслуживанию двигателей автомобильных;{'nameRu': 'Запрос ценовых предложений'};177850.00;999000.00;{'nameRu': 'Услуга'}
020240000248/230001/00;"{'nameRu': 'ИП ""L.Zh group""'}";Работы по пошиву зимней спецодежды.;{'nameRu': 'Запрос ценовых предложений'};0.00;1870000.00;{'nameRu': 'Работа'}
020240000248/A0E9IL/00;"{'nameRu': 'АО ""ЦЭФ""'}";;{'nameRu': 'Из одного источника путем прямого заключения договора'};184821.43;207000.00;{'nameRu': 'Услуга'}
020240000248/220084/01;"{'nameRu': 'Товарищество с ограниченной ответственностью ""БСК Transcompany""'}";Услуги по аренде спецтехники;{'nameRu': 'Из одного источника по несостоявшимся закупкам'};2160000.00;2419200.00;{'nameRu': 'Услуга'}
020240000248/220077/01;"{'nameRu': 'Товарищество с ограниченной ответственностью ""БСК Transcompany""'}";Услуги по аренде спецтехники;{'nameRu': 'Открытый конкурс'};1560000.00;1747200.00;{'nameRu': 'Услуга'}
020240000248/220083/02;"{'nameRu': 'ТОО ""Услуга-17""'}";Услуги по аренде спецтехники;{'nameRu': 'Из одного источника по несостоявшимся закупкам'};4109000.00;4109000.00;{'nameRu': 'Услуга'}
020240000248/220075/01;{'nameRu': 'ИП ЯНДУЛОВА ЛЮБОВЬ АЛЕКСАНДРОВНА'};Услуги по аренде спецтехники;{'nameRu': 'Открытый конкурс'};1800000.00;1800000.00;{'nameRu': 'Услуга'}
020240000248/220094/01;"{'nameRu': 'ТОО ""ИЛИН""'}";Услуги по размещению неопасных ТБО, а также сухостоя, веток, листьев, травы;{'nameRu': 'Из одного источника по несостоявшимся закупкам'};2904731.08;3105600.00;{'nameRu': 'Услуга'}
020240000248/220069/02;"{'nameRu': 'КХ ""Остапюк""'}";Услуги по аренде спецтехники;{'nameRu': 'Открытый конкурс'};1580000.00;1580000.00;{'nameRu': 'Услуга'}
020240000248/220076/02;"{'nameRu': 'КХ ""Остапюк""'}";Услуги по аренде спецтехники;{'nameRu': 'Открытый конкурс'};1550000.00;1550000.00;{'nameRu': 'Услуга'}
