contractNumberSys;Supplier;descriptionRu;FaktTradeMethods;faktSum;contractSumWnds;RefSubjectType
020240000248/230115/00;"{'nameRu': 'ТОО ""Костанай-МБИ""'}";Приобретение бортового камня (бордюр);{'nameRu': 'Из одного источника по несостоявшимся закупкам'};110571.43;258000.00;{'nameRu': 'Товар'}
020240000248/230114/00;"{'nameRu': 'ИП  ""BESTCOPY""'}";Приобретение светодиодных ламп;{'nameRu': 'Запрос ценовых предложений'};337500.00;448560.00;{'nameRu': 'Товар'}
020240000248/230113/00;"{'nameRu': 'ТОО ""Kst trade""'}";Приобретение талонов (номинал по 10 литров) бензина и дизельного топлива;{'nameRu': 'Из одного источника по несостоявшимся закупкам'};4464196.43;4999900.00;{'nameRu': 'Товар'}
020240000248/230079/01;{'nameRu': 'ИП Оразбекова'};Приобретение семян цветов и газонной травы;{'nameRu': 'Запрос ценовых предложений'};1141000.00;1565050.00;{'nameRu': 'Товар'}
020240000248/230112/00;{'nameRu': 'ИП Еспосынова'};Приобретение инструментов и сменных ножей на кусторез.;{'nameRu': 'Запрос ценовых предложений'};64730.00;64730.00;{'nameRu': 'Товар'}
020240000248/230111/00;"{'nameRu': 'ИП ""EXPERT"" ПРАВДИВЕЦ М.С.'}";Приобретение ручных инструментов для обрезки веток.;{'nameRu': 'Запрос ценовых предложений'};53792.00;53792.00;{'nameRu': 'Товар'}
020240000248/230110/00;"{'nameRu': 'Товарищество с ограниченной ответственностью ""Dias Profit""'}";Приобретение хомутов (стяжек) кабельных нейлоновых размером 3,6*300мм;{'nameRu': 'Запрос ценовых предложений'};21560.00;24147.20;{'nameRu': 'Товар'}
020240000248/230109/00;{'nameRu': 'АШГАЛИЕВ НУРБОЛ АДИЛЬЕВИЧ'};Приобретение вазон для уличных цветов белого цвета на съемной ножке, емкостью 9 литров.;{'nameRu': 'Запрос ценовых предложений'};83820.00;83820.00;{'nameRu': 'Товар'}
020240000248/230108/00;"{'nameRu': 'ИП ""АКМА-Снаб""'}";Приобретение кругов шлифовальных 400*40*127;{'nameRu': 'Запрос ценовых предложений'};59900.00;59900.00;{'nameRu': 'Товар'}
020240000248/230107/00;{'nameRu': 'ИП Zhekenov Company'};Приобретение болтов анкерных с гайкой М10 12*150;{'nameRu': 'Запрос ценовых предложений'};69776.00;69776.00;{'nameRu': 'Товар'}
020240000248/230106/00;{'nameRu': 'АБДУРАХИМОВ ЕЛЖАН'};Приобретение водяного насоса GRINDA GFP-50-3.4-U;{'nameRu': 'Электронный магазин'};119694.00;119694.00;{'nameRu': 'Товар'}
020240000248/230105/00;"{'nameRu': 'Акционерное общество ""Дочерняя компания Народного Банка Казахстана по страхованию жизни ""Халык-Life""'}";Услуги по страхованию жизни;{'nameRu': 'Запрос ценовых предложений'};297373.44;297373.44;{'nameRu': 'Услуга'}
020240000248/230104/00;"{'nameRu': 'Товарищество с ограниченной ответственностью ""ОТВЕРТКА.KZ""'}";Приобретение Мотоблока Ресанта МБ-13000-12;{'nameRu': 'Электронный магазин'};388392.85;434999.99;{'nameRu': 'Товар'}
020240000248/230103/00;{'nameRu': 'ИП NOOR'};Приобретение лестницы-стремянки алюминиевой раскладывающейся, с количеством ступеней 10 штук.;{'nameRu': 'Запрос ценовых предложений'};90000.00;90000.00;{'nameRu': 'Товар'}
020240000248/230102/00;{'nameRu': 'Марат'};Приобретение ножниц садовых, прямых, 200 мм.;{'nameRu': 'Запрос ценовых предложений'};47948.00;47948.00;{'nameRu': 'Товар'}
020240000248/230101/00;{'nameRu': 'ИП Медина'};Приобретение пластиковых круглых кашпо с поддоном объемом 45л.;{'nameRu': 'Запрос ценовых предложений'};145000.00;145000.00;{'nameRu': 'Товар'}
020240000248/230100/00;"{'nameRu': 'ТОО ""Servise Trade Company""'}";Приобретение запчастей на спецтехнику;{'nameRu': 'Из одного источника по несостоявшимся закупкам'};450002.14;504002.40;{'nameRu': 'Товар'}
020240000248/230099/00;"{'nameRu': 'Товарищество с ограниченной ответственностью ""ОТВЕРТКА.KZ""'}";Приобретение набора инструментов Forsage 38841 216 предметов.;{'nameRu': 'Электронный магазин'};71428.57;80000.00;{'nameRu': 'Товар'}
020240000248/230098/00;{'nameRu': 'ИП Дутбаева'};Приобретение шуруповерта;{'nameRu': 'Электронный магазин'};49500.00;49500.00;{'nameRu': 'Товар'}
020240000248/230097/00;"{'nameRu': 'ИП""Есебаев А.А""'}";Приобретение материалов озеленения.;{'nameRu': 'Из одного источника по несостоявшимся закупкам'};453205.00;453205.00;{'nameRu': 'Товар'}
020240000248/230096/00;"{'nameRu': 'Товарищество с ограниченной ответственностью ""ОТВЕРТКА.KZ""'}";Приобретение мойки высокого давления;{'nameRu': 'Электронный магазин'};84998.21;95198.00;{'nameRu': 'Товар'}
020240000248/230095/00;{'nameRu': 'ЛЕЕР ИРИНА ВИКТОРОВНА'};Приобретение растений - рассада петуньи и бархатцев;{'nameRu': 'Из одного источника по несостоявшимся закупкам'};0.00;12250000.00;{'nameRu': 'Товар'}
020240000248/230094/00;"{'nameRu': 'ТОО ""Orda Structure""'}";Приобретение цемента;{'nameRu': 'Запрос ценовых предложений'};0.00;80640.00;{'nameRu': 'Товар'}
020240000248/230093/00;{'nameRu': 'ИП ТЫЩЕНКО ЕЛЕНА БОРИСОВНА'};Приобретение молока;{'nameRu': 'Из одного источника по несостоявшимся закупкам'};25714.29;28800.00;{'nameRu': 'Товар'}
020240000248/230092/00;"{'nameRu': 'ТОО ""Авто-Выбор""'}";Приобретение ГСМ;{'nameRu': 'Из одного источника по несостоявшимся закупкам'};773214.29;866000.00;{'nameRu': 'Товар'}
020240000248/230091/00;{'nameRu': 'ИП Кожуров С.М.'};Приобретение шин на автомобиль Нива;{'nameRu': 'Запрос ценовых предложений'};123948.00;138821.76;{'nameRu': 'Товар'}
020240000248/230090/00;{'nameRu': 'ИП Кузнецов'};Работы по нанесению дорожной разметки;{'nameRu': 'Запрос ценовых предложений'};1700000.00;1700000.00;{'nameRu': 'Работа'}
020240000248/230089/00;"{'nameRu': 'ТОО ""Алаш2020""'}";Приобретение шин на легковой автомобиль;{'nameRu': 'Электронный магазин'};155600.00;155600.00;{'nameRu': 'Товар'}
020240000248/230088/00;{'nameRu': 'УСЕМБАЕВ'};Приобретение скотча;{'nameRu': 'Запрос ценовых предложений'};21000.00;21000.00;{'nameRu': 'Товар'}
020240000248/230087/00;"{'nameRu': 'ТОО ""АЗУРИТ"" - промышленно-торговая фирма'}";Работы по пошиву брезентовых пологов;{'nameRu': 'Из одного источника по несостоявшимся закупкам'};180000.00;201600.00;{'nameRu': 'Работа'}
020240000248/230086/00;{'nameRu': 'ИП ЕЭС'};Приобретение хозяйственных товаров;{'nameRu': 'Запрос ценовых предложений'};250552.00;250552.00;{'nameRu': 'Товар'}
020240000248/230085/00;{'nameRu': 'ИП Мырзабай'};Приобретение масла трансмиссионного ATF III H;{'nameRu': 'Электронный магазин'};462500.00;462500.00;{'nameRu': 'Товар'}
020240000248/230084/00;"{'nameRu': 'ТОО ""ПожароТехника-А""'}";Обслуживание, перезарядка, мелкий ремонт, переосвидетельствование, дефектовка и паспортизация огнетушителей;{'nameRu': 'Запрос ценовых предложений'};87999.00;98558.88;{'nameRu': 'Услуга'}
020240000248/230083/00;{'nameRu': 'ИП Иманкулов'};Приобретение расходных материалов для бензопил и кусторезов;{'nameRu': 'Из одного источника по несостоявшимся закупкам'};143000.00;143000.00;{'nameRu': 'Товар'}
020240000248/230082/00;{'nameRu': 'ИП Dinur'};Приобретение саженцев роз, с обязательным предоставлением карантинного сертификата;{'nameRu': 'Запрос ценовых предложений'};89000.00;89000.00;{'nameRu': 'Товар'}
020240000248/230081/00;{'nameRu': 'ИП Старков Сергей Сергеевич'};Приобретение автозапчастей;{'nameRu': 'Из одного источника по несостоявшимся закупкам'};99094.00;110985.28;{'nameRu': 'Товар'}
020240000248/230080/00;"{'nameRu': 'ТОО ""Центр Профессиональных Услуг ""Медина""""'}";Обслуживание, перезарядка, мелкий ремонт, переосвидетельствование, дефектовка и паспортизация огнетушителей;{'nameRu': 'Запрос ценовых предложений'};0.00;83444.00;{'nameRu': 'Услуга'}
020240000248/230079/00;{'nameRu': 'ИП Оразбекова'};Приобретение семян цветов и газонной травы;{'nameRu': 'Запрос ценовых предложений'};0.00;1565050.00;{'nameRu': 'Товар'}
020240000248/230078/00;"{'nameRu': 'КХ ""Остапюк""'}";Услуги по аренде спецтехники с водителем;{'nameRu': 'Из одного источника по несостоявшимся закупкам'};1500000.00;1500000.00;{'nameRu': 'Услуга'}
020240000248/230077/00;"{'nameRu': 'ТОО ""Беркут-2018""'}";Приобретение товаров;{'nameRu': 'Из одного источника по несостоявшимся закупкам'};30000.00;30000.00;{'nameRu': 'Товар'}
020240000248/230076/00;{'nameRu': 'ИП ЯНДУЛОВА ЛЮБОВЬ АЛЕКСАНДРОВНА'};Услуги по аренде спецтехники;{'nameRu': 'Из одного источника по несостоявшимся закупкам'};1042500.00;1700000.00;{'nameRu': 'Услуга'}
020240000248/230075/00;"{'nameRu': 'Товарищество с ограниченной ответственностью ""БСК Transcompany""'}";Услуги по аренде спецтехники;{'nameRu': 'Из одного источника по несостоявшимся закупкам'};0.00;1904000.00;{'nameRu': 'Услуга'}
020240000248/230074/00;"{'nameRu': 'ТОО ""Servise Trade Company""'}";Приобретение автозапчастей;{'nameRu': 'Из одного источника по несостоявшимся закупкам'};191060.00;213987.20;{'nameRu': 'Товар'}
020240000248/230073/00;"{'nameRu': 'ТОО ""Kst trade""'}";Приобретение талонов дизельного топлива номиналом 10 литров;{'nameRu': 'Из одного источника по несостоявшимся закупкам'};2321428.57;2600000.00;{'nameRu': 'Товар'}
020240000248/230072/00;{'nameRu': 'Incom'};Приобретение товаров;{'nameRu': 'Запрос ценовых предложений'};3800.00;3800.00;{'nameRu': 'Товар'}
020240000248/230071/00;"{'nameRu': 'ИП "" МУХАТОВ ""'}";Приобретение товаров;{'nameRu': 'Запрос ценовых предложений'};224910.00;224910.00;{'nameRu': 'Товар'}
020240000248/230070/00;{'nameRu': 'ИП БОНДАРЕНКО'};Приобретение товаров;{'nameRu': 'Запрос ценовых предложений'};8250.00;9240.00;{'nameRu': 'Товар'}
020240000248/230069/00;{'nameRu': 'ИП ЖАГИПАРОВА АЛТЫН КОНКАЕВНА'};Приобретение расходных материалов;{'nameRu': 'Запрос ценовых предложений'};99200.00;99200.00;{'nameRu': 'Товар'}
020240000248/230068/00;"{'nameRu': 'АО ""Информационно-учетный центр""'}";Услуги по предоставлению доступа к информационному сервису «Электронные отчеты» на веб-портале opi.dfo.kz»;{'nameRu': 'Из одного источника путем прямого заключения договора'};58650.00;58650.00;{'nameRu': 'Услуга'}
020240000248/230067/00;"{'nameRu': 'КХ ""Остапюк""'}";Услуги по аренде спецтехники с водителем;{'nameRu': 'Из одного источника по несостоявшимся закупкам'};730000.00;730000.00;{'nameRu': 'Услуга'}
020240000248/230066/00;{'nameRu': 'ИП ВАБИЩЕВИЧ АЛЕКСАНДР ЯКОВЛЕВИЧ'};Услуги по техническому контролю (осмотру) дорожных транспортных средств;{'nameRu': 'Запрос ценовых предложений'};0.00;56900.00;{'nameRu': 'Услуга'}
020240000248/230065/00;"{'nameRu': 'ТОО ""ИЛИН""'}";Услуги по размещению неопасных ТБО, а также сухостоя, веток, листьев, травы;{'nameRu': 'Из одного источника по несостоявшимся закупкам'};903601.29;1248758.00;{'nameRu': 'Услуга'}
020240000248/230064/00;"{'nameRu': 'ТОО ""Bastau Group LTD""'}";Приобретение знаков безопасности;{'nameRu': 'Запрос ценовых предложений'};194500.00;194500.00;{'nameRu': 'Товар'}
020240000248/230063/00;"{'nameRu': 'ИП ""УНАЕВ Т. Ж.""'}";Приобретение ручных инструментов (грабли веерные, раскладные);{'nameRu': 'Запрос ценовых предложений'};70420.00;70420.00;{'nameRu': 'Товар'}
020240000248/230062/00;{'nameRu': 'ИП АХМЕТ ӘМІРБЕК ӘНУАРБЕКҰЛЫ'};Приобретение плащей-дождевиков универсальных.;{'nameRu': 'Запрос ценовых предложений'};79800.00;79800.00;{'nameRu': 'Товар'}
020240000248/230061/00;{'nameRu': 'ИП КУЛИКОВСКАЯ ИРИНА ПЕТРОВНА'};Приобретение цемента;{'nameRu': 'Из одного источника по несостоявшимся закупкам'};9400.00;9400.00;{'nameRu': 'Товар'}
020240000248/230060/00;"{'nameRu': 'ТОО ""ДПЭ Инжиниринг""'}";Приобретение поясов предохранительных, страховочных;{'nameRu': 'Из одного источника по несостоявшимся закупкам'};25700.00;28784.00;{'nameRu': 'Товар'}
020240000248/230059/00;"{'nameRu': 'ТОО ""AP""'}";Приобретение эмалей, олифы и растворителя;{'nameRu': 'Из одного источника по несостоявшимся закупкам'};5943450.00;6656664.00;{'nameRu': 'Товар'}
020240000248/230058/00;"{'nameRu': 'Товарищество с ограниченной ответственностью ""МЕДФАРМИМПОРТ""'}";Приобретение аптечек медицинских универсальных;{'nameRu': 'Электронный магазин'};25004.00;25004.00;{'nameRu': 'Товар'}
020240000248/230057/00;{'nameRu': 'АЛДАНАЗАРОВ САБИТ ТУЛЕГЕНОВИЧ'};Приобретение расходных материалов на триммеры STIHL (мононить - леска);{'nameRu': 'Запрос ценовых предложений'};0.00;277760.00;{'nameRu': 'Товар'}
020240000248/230056/00;{'nameRu': 'ИП DM corp'};Приобретение расходных материалов на триммеры STIHL (свечи зажигания);{'nameRu': 'Запрос ценовых предложений'};0.00;58500.00;{'nameRu': 'Товар'}
020240000248/230055/00;{'nameRu': 'ИП Төлеу Ғасырбек Амашаұлы'};Шаруашылық тауарларын сатып алу;{'nameRu': 'Запрос ценовых предложений'};18230.00;18230.00;{'nameRu': 'Товар'}
020240000248/230054/00;"{'nameRu': 'ИП ""УНАЕВ Т. Ж.""'}";Шаруашылық тауарларын сатып алу;{'nameRu': 'Запрос ценовых предложений'};13875.00;13875.00;{'nameRu': 'Товар'}
020240000248/230053/00;{'nameRu': 'ИП Тарасов'};Приобретение хозяйственных товаров;{'nameRu': 'Запрос ценовых предложений'};0.00;19000.00;{'nameRu': 'Товар'}
020240000248/230052/00;{'nameRu': 'ИП Karimova'};Приобретение расходных материалов;{'nameRu': 'Запрос ценовых предложений'};0.00;314000.00;{'nameRu': 'Товар'}
020240000248/230051/00;"{'nameRu': 'Общественное объединение ""Организация инвалидов Belief""'}";Приобретение лакокрасочных изделий;{'nameRu': 'Запрос ценовых предложений'};0.00;1515500.00;{'nameRu': 'Товар'}
020240000248/230050/00;{'nameRu': 'Oil Центр'};Приобретение масла для двухтактных двигателей;{'nameRu': 'Запрос ценовых предложений'};84420.00;94550.40;{'nameRu': 'Товар'}
020240000248/230049/00;{'nameRu': 'ИП Тарасов'};Приобретение инструментов для малярных работ;{'nameRu': 'Запрос ценовых предложений'};223200.00;446400.00;{'nameRu': 'Товар'}
020240000248/230048/00;{'nameRu': 'ЖК Таласов А.Ш.'};Приобретение извести негашеной;{'nameRu': 'Запрос ценовых предложений'};279000.00;279000.00;{'nameRu': 'Товар'}
020240000248/230047/00;"{'nameRu': 'ТОО ""Кен - Сауда LTD""'}";Приобретение деревянного бруса;{'nameRu': 'Из одного источника по несостоявшимся закупкам'};77800.00;77800.00;{'nameRu': 'Товар'}
020240000248/230046/00;"{'nameRu': 'ТОО ""Kst trade""'}";Приобретение талонов бензина АИ-92;{'nameRu': 'Из одного источника по несостоявшимся закупкам'};1669464.29;1869800.00;{'nameRu': 'Товар'}
020240000248/230045/00;"{'nameRu': 'Товарищество с ограниченной ответственностью ""БСК Transcompany""'}";Услуги по аренде спецтехники;{'nameRu': 'Из одного источника по несостоявшимся закупкам'};2150000.00;2408000.00;{'nameRu': 'Услуга'}
020240000248/230043/00;"{'nameRu': 'ТОО ""Услуга-17""'}";Услуги по аренде спецтехники;{'nameRu': 'Из одного источника по несостоявшимся закупкам'};2150000.00;2150000.00;{'nameRu': 'Услуга'}
020240000248/230042/00;{'nameRu': 'ИП ЖУСУПОВ РУСЛАН САРСЕНБАЕВИЧ'};Услуги по аренде спецтехники;{'nameRu': 'Из одного источника по несостоявшимся закупкам'};1426000.00;1426000.00;{'nameRu': 'Услуга'}
020240000248/230041/00;{'nameRu': 'ИП ЯНДУЛОВА ЛЮБОВЬ АЛЕКСАНДРОВНА'};Услуги по аренде спецтехники;{'nameRu': 'Из одного источника по несостоявшимся закупкам'};2150000.00;2150000.00;{'nameRu': 'Услуга'}
020240000248/230040/00;{'nameRu': 'ИП Тарасов'};Приобретение электрических товаров;{'nameRu': 'Запрос ценовых предложений'};16840.00;16840.00;{'nameRu': 'Товар'}
020240000248/230039/00;{'nameRu': 'ИП Miradj'};Приобретение электрических товаров;{'nameRu': 'Запрос ценовых предложений'};61800.00;401856.00;{'nameRu': 'Товар'}
020240000248/230038/00;{'nameRu': 'Куанышбаев Е.О.'};Приобретение электрических товаров;{'nameRu': 'Запрос ценовых предложений'};299250.00;299250.00;{'nameRu': 'Товар'}
020240000248/230037/00;{'nameRu': 'ИП Шайманова'};Приобретение электрических товаров;{'nameRu': 'Запрос ценовых предложений'};244000.00;244000.00;{'nameRu': 'Товар'}
020240000248/230036/00;"{'nameRu': 'КХ ""Остапюк""'}";Услуги по аренде спецтехники;{'nameRu': 'Из одного источника по несостоявшимся закупкам'};1430000.00;1430000.00;{'nameRu': 'Услуга'}
020240000248/230035/00;{'nameRu': 'ИП ИТКАРИНОВ СЕРИКБОЛ СЕРИКБАЕВИЧ'};Услуги по аренде спецтехники;{'nameRu': 'Из одного источника по несостоявшимся закупкам'};750000.00;840000.00;{'nameRu': 'Услуга'}
020240000248/230034/00;"{'nameRu': 'ТОО ""Kst trade""'}";Приобретение талонов дизельного топлива;{'nameRu': 'Из одного источника по несостоявшимся закупкам'};2321428.57;2600000.00;{'nameRu': 'Товар'}
020240000248/230033/00;"{'nameRu': 'ИНДИВИДУАЛЬНЫЙ ПРЕДПРИНИМАТЕЛЬ ""КАЗАРИН СЕРГЕЙ ВЛАДИМИРОВИЧ""'}";Работы по содержанию автодорог по городу Лисаковску - посыпка дорог песчано-соляной смесью пескоразбрасывателем на базе а/м КАМАЗ;{'nameRu': 'Из одного источника по несостоявшимся закупкам'};300000.00;300000.00;{'nameRu': 'Работа'}
020240000248/230032/00;{'nameRu': 'Everest KZ'};Приобретение расходных материалов;{'nameRu': 'Запрос ценовых предложений'};316000.00;353920.00;{'nameRu': 'Товар'}
020240000248/230031/00;{'nameRu': 'ИП БУТ ЕВГЕНИЙ АЛЕКСАНДРОВИЧ'};Приобретение расходных материалов;{'nameRu': 'Запрос ценовых предложений'};70000.00;78400.00;{'nameRu': 'Товар'}
020240000248/230030/00;"{'nameRu': 'ИП ""Bereke+""'}";Приобретение расходных материалов;{'nameRu': 'Запрос ценовых предложений'};108960.00;108960.00;{'nameRu': 'Товар'}
020240000248/230029/00;"{'nameRu': 'ТОО ""РМЗ Лисаковск""'}";Работы токарно-фрезерные по восстановлению и реставрации запасных частей для спецтехники;{'nameRu': 'Из одного источника по несостоявшимся закупкам'};403910.00;700000.00;{'nameRu': 'Работа'}
020240000248/230028/00;{'nameRu': 'ИП МУСИН Р.Б'};Приобретение сменных ножей на отвал автогрейдера;{'nameRu': 'Из одного источника по несостоявшимся закупкам'};1330000.00;1330000.00;{'nameRu': 'Товар'}
020240000248/230027/00;"{'nameRu': 'ИП ""Казына""'}";Приобретение соли технической;{'nameRu': 'Из одного источника по несостоявшимся закупкам'};436000.00;436000.00;{'nameRu': 'Товар'}
020240000248/230001/01;"{'nameRu': 'ИП ""L.Zh group""'}";Работы по пошиву зимней спецодежды.;{'nameRu': 'Запрос ценовых предложений'};2024000.00;2024000.00;{'nameRu': 'Работа'}
