contractNumberSys;Supplier;descriptionRu;FaktTradeMethods;faktSum;contractSumWnds;RefSubjectType
930140000343/230041/00;{'nameRu': 'ОРАЗБЕКОВА ГУЛЬЗАДА БАЯНБАЕВНА'};Уксусная кислота 70%, 180 мл;{'nameRu': 'Электронный магазин'};101964.29;114200.00;{'nameRu': 'Товар'}
930140000343/230040/00;"{'nameRu': 'ТОО ""ProCommunity Astana Orleu""'}";Государственные закупки с учетом актуальных изменений в 2023 году: новации в нормативно-правовом регулировании и способах закупок. Эффективная организация государственных закупок;{'nameRu': 'Из одного источника путем прямого заключения договора'};0.00;60000.00;{'nameRu': 'Услуга'}
930140000343/230039/00;"{'nameRu': 'ТОО ""ИнфоТех & Сервис""'}";Комплекс нормативной и справочной информации ,для работы бухгалтера;{'nameRu': 'Из одного источника путем прямого заключения договора'};0.00;148600.00;{'nameRu': 'Услуга'}
930140000343/230038/00;{'nameRu': 'ИП Webman Studio'};Услуги по информационной поддержке сайтов;{'nameRu': 'Из одного источника путем прямого заключения договора'};0.00;140000.00;{'nameRu': 'Услуга'}
930140000343/230037/00;"{'nameRu': 'Костанайский ОФ АО ""Казпочта""'}";Услуги по пересылке почтовых отправлений;{'nameRu': 'Из одного источника путем прямого заключения договора'};15000.00;16800.00;{'nameRu': 'Услуга'}
930140000343/230036/00;"{'nameRu': 'ТОО ""ИнфоТех & Сервис""'}";Услуги по предоставлению лицензий на право использования программного обеспечения;{'nameRu': 'Из одного источника путем прямого заключения договора'};210400.00;210400.00;{'nameRu': 'Услуга'}
930140000343/230035/00;"{'nameRu': 'Костанайский областной филиал ТОО ""РМА""'}";Услуги по обучению (обучению/тренинги/подготовке/переподготовке/повышению квалификации);{'nameRu': 'Из одного источника по несостоявшимся закупкам'};0.00;300000.00;{'nameRu': 'Услуга'}
930140000343/230034/00;"{'nameRu': 'Общественный фонд ""Фонд поддержки больных фенилкетонурией (ФКУ) ""Демеу""'}";Добавка биологически активная;{'nameRu': 'Запрос ценовых предложений'};0.00;21975800.00;{'nameRu': 'Товар'}
930140000343/230033/00;"{'nameRu': 'ТОО ""Компания Первый БИТ""'}";Сопровождения в программе 1С:Предприятие 8. Обновление Платформы и типовых конфигураций. Линия консультаций Первый БИТ.;{'nameRu': 'Из одного источника по несостоявшимся закупкам'};0.00;300000.00;{'nameRu': 'Услуга'}
930140000343/230032/00;"{'nameRu': 'Коммунальное государственное предприятие ""Костанайский областной центр психического здоровья"" Управления здравоохранения акимата Костанайской области'}";Исследование химико-токсикологического анализа крови и мочи;{'nameRu': 'Из одного источника по несостоявшимся закупкам'};0.00;26000.00;{'nameRu': 'Услуга'}
930140000343/230031/00;{'nameRu': 'ШЕФЕР ЗИНАИДА'};Услуги по техническому обслуживанию системы видеонаблюдения;{'nameRu': 'Запрос ценовых предложений'};0.00;280000.00;{'nameRu': 'Услуга'}
930140000343/230030/00;{'nameRu': 'ИП Омельяненко Виталий Алексеевич'};Заправка картриджей;{'nameRu': 'Запрос ценовых предложений'};0.00;950000.00;{'nameRu': 'Услуга'}
930140000343/230029/00;"{'nameRu': 'ТОО ""ҢҰР-Сақшы""'}";Услуги по охранному мониторингу и техническому обслуживанию охранной сигнализации в служебном помещении (помещение для хранения наркотических средств и прекурсоров);{'nameRu': 'Запрос ценовых предложений'};0.00;380688.00;{'nameRu': 'Услуга'}
930140000343/230028/00;{'nameRu': 'ШЕФЕР ЗИНАИДА'};Услуги по техническому обслуживанию компьютерной/периферийной оргтехники/оборудования и их частей;{'nameRu': 'Запрос ценовых предложений'};0.00;480000.00;{'nameRu': 'Услуга'}
930140000343/230027/00;"{'nameRu': 'АО ""Страховая компания ""Номад Иншуранс""'}";Обязательное страхование гражданско-правовой ответственности владельцев транспортных средств;{'nameRu': 'Запрос ценовых предложений'};0.00;437517.70;{'nameRu': 'Услуга'}
930140000343/230026/00;{'nameRu': 'МАНТУЛЕНКО ЛЮБОВЬ'};Электроэнергия;{'nameRu': 'Из одного источника по несостоявшимся закупкам'};0.00;10992000.00;{'nameRu': 'Товар'}
930140000343/230025/00;{'nameRu': 'ШЕФЕР ЗИНАИДА'};Услуги по опорожнению/очищению отходов выгребных ям/отстойников/септиков/туалетов;{'nameRu': 'Запрос ценовых предложений'};0.00;500000.00;{'nameRu': 'Услуга'}
930140000343/230024/00;"{'nameRu': '""ОПТТОРГ"" 2030'}";Спортивные товары;{'nameRu': 'Запрос ценовых предложений'};21552.00;21552.00;{'nameRu': 'Товар'}
930140000343/230023/00;{'nameRu': 'ИП Кожуров С.М.'};Масло моторное,синтетическое ,все сезонное 10W 40, тара бочка, объем 200 - 209 литров.;{'nameRu': 'Запрос ценовых предложений'};197000.00;220640.00;{'nameRu': 'Товар'}
930140000343/230022/00;"{'nameRu': 'ТОО ""Kst trade""'}";Кислород для поликлиник ГОСТ 5583-78;{'nameRu': 'Из одного источника по несостоявшимся закупкам'};71428.57;80000.00;{'nameRu': 'Товар'}
930140000343/230021/00;{'nameRu': 'ИП ГУДИАЛ'};"Услуги по обеспечению питанием пациентов КГП &quot;Камыстинская РБ&quot; - стационарного отделения";{'nameRu': 'Из одного источника по несостоявшимся закупкам'};0.00;10500000.00;{'nameRu': 'Услуга'}
930140000343/230020/00;"{'nameRu': 'Товарищество с ограниченной ответственностью ""Berеnt Asia""'}";Дрель - Шуроповерт;{'nameRu': 'Запрос ценовых предложений'};35000.00;35000.00;{'nameRu': 'Товар'}
930140000343/230019/00;"{'nameRu': 'ТОО ""АУДИТОРСКАЯ КОМПАНИЯ ""КАЗФИНАУДИТ""'}";Услуги по проведению аудита финансовой отчетности;{'nameRu': 'Запрос ценовых предложений'};0.00;167997.00;{'nameRu': 'Услуга'}
930140000343/230018/00;{'nameRu': 'ИП   ИВАНОВ ВИКТОР АНАТОЛЬЕВИЧ'};Работы по ремонту автотранспортных средств УАЗ;{'nameRu': 'Запрос ценовых предложений'};799900.00;799900.00;{'nameRu': 'Работа'}
930140000343/230017/00;"{'nameRu': 'АО ""Казахтелеком""'}";Услуги, направленные на предоставление доступа к Интернету широкополосному по сетям проводным;{'nameRu': 'Второй этап конкурса с использованием рамочного соглашения'};0.00;2800000.00;{'nameRu': 'Услуга'}
930140000343/230016/00;{'nameRu': 'ИП VICTORY'};Медицинская карта больного туберкулезом.;{'nameRu': 'Запрос ценовых предложений'};66000.00;66000.00;{'nameRu': 'Товар'}
930140000343/230015/00;{'nameRu': 'ИП Сабурбаев'};Узкая чек бумага (ширина-57 мм.,длина -100 мм);{'nameRu': 'Запрос ценовых предложений'};104500.00;104500.00;{'nameRu': 'Товар'}
930140000343/230014/00;{'nameRu': 'ИП Miradj'};Кабельный канал 70x16 ,2 м напольный;{'nameRu': 'Запрос ценовых предложений'};275400.00;308448.00;{'nameRu': 'Товар'}
930140000343/230013/00;{'nameRu': 'Qazmedtorg'};Сумки-укладки врача скорой медицинской помощи (согласно технической спецификации);{'nameRu': 'Запрос ценовых предложений'};255000.00;255000.00;{'nameRu': 'Товар'}
930140000343/230012/00;{'nameRu': 'ИП ГУДИАЛ'};"Услуги по обеспечению питанием пациентов КГП &quot;Камыстинская РБ&quot; - стационарного отделения";{'nameRu': 'Из одного источника путем прямого заключения договора'};2780300.00;3000000.00;{'nameRu': 'Услуга'}
930140000343/230011/00;"{'nameRu': 'АО ""Казахтелеком""'}";Услуги по доступу к Интернету;{'nameRu': 'Второй этап конкурса с использованием рамочного соглашения'};0.00;3696000.00;{'nameRu': 'Услуга'}
930140000343/230010/00;{'nameRu': 'ИП Жаканов А.Т.'};Работы по уборке (удалению) снега;{'nameRu': 'Запрос ценовых предложений'};0.00;525000.00;{'nameRu': 'Работа'}
930140000343/230009/00;{'nameRu': 'ИП ГУЦАЛО АНДРЕЙ ПЕТРОВИЧ'};Журнал регистрации;{'nameRu': 'Запрос ценовых предложений'};27300.00;27300.00;{'nameRu': 'Товар'}
930140000343/230008/00;"{'nameRu': 'ТОО ""Центр Информационных Технологий ""ДАМУ""'}";Техническое сопровождение и онлайн сервис программно-аппаратного комплекса Dmed;{'nameRu': 'Из одного источника путем прямого заключения договора'};0.00;1647347.00;{'nameRu': 'Услуга'}
930140000343/230007/00;"{'nameRu': 'ТОО ""Центр Информационных Технологий ""ДАМУ""'}";Услуги по пользованию программными продуктами, находящимся в удаленном доступе;{'nameRu': 'Из одного источника путем прямого заключения договора'};0.00;240000.00;{'nameRu': 'Услуга'}
930140000343/230006/00;{'nameRu': 'Филиал РГП на ПХВ «Национальный центр экспертизы» КСЭК МЗ РК по Костанайской области'};Услуги по проведению лабораторных/лабораторно-инструментальных исследований/анализов;{'nameRu': 'Из одного источника путем прямого заключения договора'};0.00;4110330.00;{'nameRu': 'Услуга'}
930140000343/230005/00;"{'nameRu': 'АО ""Казахтелеком""'}";Услуги телефонной связи;{'nameRu': 'Второй этап конкурса с использованием рамочного соглашения'};0.00;896000.00;{'nameRu': 'Услуга'}
930140000343/230004/00;"{'nameRu': 'ТОО ""Kst trade""'}";Бензин двигателей с искровым зажиганием АИ-92 по талонам через АЗС ГОСТ 32513-2013;{'nameRu': 'Второй этап конкурса с использованием рамочного соглашения'};0.00;11220000.00;{'nameRu': 'Товар'}
930140000343/230003/00;"{'nameRu': 'ТОО ""Камысты""'}";Вода;{'nameRu': 'Из одного источника по несостоявшимся закупкам'};0.00;1800000.00;{'nameRu': 'Услуга'}
930140000343/A0FGA2/00;"{'nameRu': 'АО ""ЦЭФ""'}";;{'nameRu': 'Из одного источника путем прямого заключения договора'};30803.57;34500.00;{'nameRu': 'Услуга'}
930140000343/230002/00;"{'nameRu': 'ТОО ""Катэп- АЭ""'}";индивидуальный дозиметрический контроль;{'nameRu': 'Из одного источника путем прямого заключения договора'};90000.00;100800.00;{'nameRu': 'Услуга'}
930140000343/230001/00;"{'nameRu': 'ТОО ""Казах Кенсе""'}";Бумага для офисного оборудования (пачка 500 листов);{'nameRu': 'Электронный магазин'};1024500.00;1147440.00;{'nameRu': 'Товар'}
