contractNumberSys;Supplier;descriptionRu;FaktTradeMethods;faktSum;contractSumWnds;RefSubjectType
030940002023/230014/00;{'nameRu': 'ИП Бурмистров В.В'};Услуги по заправке картриджей;{'nameRu': 'Запрос ценовых предложений'};70000.00;70000.00;{'nameRu': 'Услуга'}
030940002023/230013/00;"{'nameRu': 'ИП ""СпецЗащита""'}";Услуги по техническому обслуживанию пожарной/охранной сигнализации/систем тушения/видеонаблюдения и аналогичного оборудования (Одна услуга);{'nameRu': 'Запрос ценовых предложений'};495000.00;495000.00;{'nameRu': 'Услуга'}
030940002023/230012/00;"{'nameRu': 'ТОО ""Приоритет-Безопасность""'}";текущий ремонт системы видеонаблюдения установка/настройка/замена видеорегистратора в комплекте с жестким диском HDD;{'nameRu': 'Запрос ценовых предложений'};111111.00;111111.00;{'nameRu': 'Услуга'}
030940002023/230011/00;"{'nameRu': 'ТОО ""Рудненская дезинфекционная станция""'}";Услуги санитарные (дезинфекция, дезинсекция, дератизация и аналогичные) (Одна услуга);{'nameRu': 'Запрос ценовых предложений'};23985.00;31980.00;{'nameRu': 'Услуга'}
030940002023/230008/00;"{'nameRu': 'ТОО ""Рудненская ЭнергоКомпания""'}";Услуги по общему энергоснабжению;{'nameRu': 'Из одного источника путем прямого заключения договора'};0.00;1344000.00;{'nameRu': 'Услуга'}
030940002023/230007/00;"{'nameRu': 'ТОО ""Рудненские тепловые сети""'}";Услуги по передаче, распределению горячей воды (тепловой энергии) на  коммунально-бытовые нужды;{'nameRu': 'Из одного источника путем прямого заключения договора'};0.00;15000000.00;{'nameRu': 'Услуга'}
030940002023/230005/00;"{'nameRu': 'ТОО ""Казах Кенсе""'}";Бумага для офисного оборудования А4;{'nameRu': 'Запрос ценовых предложений'};84825.00;95004.00;{'nameRu': 'Товар'}
030940002023/230003/00;"{'nameRu': 'Товарищество с ограниченной ответственностью ""Парус-КАЗ""'}";"Обслуживание программного продукта &quot;Парус-Каз.Бюджет&quot; (Бюджетная заявка. Тарификация в образовании)";{'nameRu': 'Из одного источника путем прямого заключения договора'};445467.86;665232.00;{'nameRu': 'Услуга'}
030940002023/230001/00;"{'nameRu': 'ТОО ""Seven Hills of Kazakhstan""'}";Обслуживание программного обеспечения 1 С бухгалтерия;{'nameRu': 'Из одного источника путем прямого заключения договора'};200892.86;300000.00;{'nameRu': 'Услуга'}
