contractNumberSys;Supplier;descriptionRu;FaktTradeMethods;faktSum;contractSumWnds;RefSubjectType
000340002918/230025/00;"{'nameRu': 'ТОО ""Редакция районной газеты ""АЙНА""'}";Услуги по размещению информационных материалов в средствах массовой информации;{'nameRu': 'Из одного источника по несостоявшимся закупкам'};0.00;50000.00;{'nameRu': 'Услуга'}
000340002918/230024/00;"{'nameRu': 'Костанайский ОФ АО ""Казпочта""'}";Услуги по выпуску государственного знака почтовой оплаты (почтовые марки, блоки, маркированные конверты и (или) почтовые карточки);{'nameRu': 'Из одного источника по несостоявшимся закупкам'};44642.86;50000.00;{'nameRu': 'Услуга'}
000340002918/230023/00;{'nameRu': 'Исеноманова А.М.'};Работы по ремонту автотранспортных средств/систем/узлов/агрегатов;{'nameRu': 'Запрос ценовых предложений'};21300.00;355000.00;{'nameRu': 'Работа'}
000340002918/230022/00;"{'nameRu': 'ТОО ""Центрум""'}";Полиграфиялық өнімдерді әзірлеу/басу бойынша полиграфиялық қызметтер (книг, фото, баспалардан басқа);{'nameRu': 'Запрос ценовых предложений'};3100.00;3100.00;{'nameRu': 'Услуга'}
000340002918/230021/00;"{'nameRu': 'ИП ""Кинсфатор Е.Г.""'}";Работы по ремонту/модернизации компьютерной/периферийной оргтехники/оборудования и их частей;{'nameRu': 'Из одного источника по несостоявшимся закупкам'};70000.00;70000.00;{'nameRu': 'Работа'}
000340002918/230020/00;"{'nameRu': 'ТОО ""Kst trade""'}";Бензин АИ 92 в талонах;{'nameRu': 'Из одного источника по несостоявшимся закупкам'};148258.93;166050.00;{'nameRu': 'Товар'}
000340002918/230019/00;{'nameRu': 'Исеноманова А.М.'};Работы по ремонту автотранспортных средств;{'nameRu': 'Запрос ценовых предложений'};333333.00;333333.00;{'nameRu': 'Работа'}
000340002918/230018/00;"{'nameRu': 'ТОО ""Центрум""'}";Работы по изготовлению табличек/надписей;{'nameRu': 'Из одного источника по несостоявшимся закупкам'};8500.00;8500.00;{'nameRu': 'Работа'}
000340002918/230017/00;"{'nameRu': 'ТОО ""Kst trade""'}";бензин АИ-92 в талонах;{'nameRu': 'Из одного источника по несостоявшимся закупкам'};118973.21;133250.00;{'nameRu': 'Товар'}
000340002918/230016/00;{'nameRu': 'ИП ЛЕЩУК ЕЛЕНА ВАСИЛЬЕВНА'};Работы по изготовлению полиграфической/печатанию полиграфической продукции;{'nameRu': 'Из одного источника по несостоявшимся закупкам'};7740.00;7740.00;{'nameRu': 'Работа'}
000340002918/230015/00;"{'nameRu': 'ТОО ""MTC Consulting""'}";Бумага для офисного оборудования формат А4;{'nameRu': 'Запрос ценовых предложений'};51080.36;57210.00;{'nameRu': 'Товар'}
000340002918/230014/00;"{'nameRu': 'ИП ""Ulytau Energy ""'}";Работы по изготовлению печатных форм/печатей/трафаретов и аналогичных изделий;{'nameRu': 'Запрос ценовых предложений'};7300.00;7300.00;{'nameRu': 'Работа'}
000340002918/230013/00;"{'nameRu': 'Костанайский филиал Акционерного общества ""Страховая компания ""Виктория""'}";Услуги по страхованию гражданско-правовой ответственности владельцев автомобильного транспорта;{'nameRu': 'Из одного источника по несостоявшимся закупкам'};25646.00;25646.00;{'nameRu': 'Услуга'}
000340002918/230012/00;"{'nameRu': 'ИП  ""Алтын қыран""'}";Герб РК 50 см;{'nameRu': 'Электронный магазин'};44990.00;44990.00;{'nameRu': 'Товар'}
000340002918/230011/00;{'nameRu': 'Исеноманова А.М.'};Услуги по техническому обслуживанию автотранспорта/специальной техники;{'nameRu': 'Из одного источника по несостоявшимся закупкам'};487000.00;487000.00;{'nameRu': 'Услуга'}
000340002918/230010/00;"{'nameRu': 'ИП ""Кинсфатор Е.Г.""'}";Услуги по заправке картриджей;{'nameRu': 'Из одного источника по несостоявшимся закупкам'};45000.00;45000.00;{'nameRu': 'Услуга'}
000340002918/230009/00;{'nameRu': 'ИП Салмина Т.А.'};Услуги по удалению неопасных отходов/имущества/материалов;{'nameRu': 'Из одного источника по несостоявшимся закупкам'};10234.00;10234.00;{'nameRu': 'Услуга'}
000340002918/230008/00;"{'nameRu': 'ТОО ""Kst trade""'}";Бензин АИ 92 в талонах;{'nameRu': 'Из одного источника по несостоявшимся закупкам'};83482.14;93500.00;{'nameRu': 'Товар'}
000340002918/230007/00;"{'nameRu': 'АО ""Казахтелеком""'}";Услуги телефонной связи;{'nameRu': 'Второй этап конкурса с использованием рамочного соглашения'};0.00;200000.00;{'nameRu': 'Услуга'}
000340002918/230006/00;"{'nameRu': 'АО ""Казахтелеком""'}";Услуги по доступу к Интернету;{'nameRu': 'Второй этап конкурса с использованием рамочного соглашения'};0.00;603888.00;{'nameRu': 'Услуга'}
000340002918/230005/00;"{'nameRu': 'ТОО ""Костанайский ЭнергоЦентр""'}";Электрорэнергия для снабжения потребителей;{'nameRu': 'Из одного источника путем прямого заключения договора'};0.00;255000.00;{'nameRu': 'Товар'}
000340002918/230004/00;"{'nameRu': 'КГП ""Жылу"" акимата Карабалыкского района'}";Услуги по передаче, распределению горячей воды (тепловой энергии) на  коммунально-бытовые нужды;{'nameRu': 'Из одного источника путем прямого заключения договора'};0.00;320000.00;{'nameRu': 'Услуга'}
000340002918/230003/00;"{'nameRu': 'КГП ""Жылу"" акимата Карабалыкского района'}";Услуги по передаче, распределению и холодному водоснабжению с использованием систем централизованного водоснабжения;{'nameRu': 'Из одного источника путем прямого заключения договора'};0.00;6000.00;{'nameRu': 'Услуга'}
000340002918/230002/00;"{'nameRu': 'РГП на ПХВ ""ИЗПИ""'}";Услуги по сопровождению и технической поддержке информационной системы;{'nameRu': 'Из одного источника путем прямого заключения договора'};46607.14;104400.00;{'nameRu': 'Услуга'}
000340002918/230001/00;"{'nameRu': 'КГП ""Жылу"" акимата Карабалыкского района'}";Услуги по удалению сточных вод (отведение);{'nameRu': 'Из одного источника путем прямого заключения договора'};0.00;94000.00;{'nameRu': 'Услуга'}
