contractNumberSys;Supplier;descriptionRu;FaktTradeMethods;faktSum;contractSumWnds;RefSubjectType
961240000583/230111/00;"{'nameRu': 'ТОО ""Green Кост""'}";Кабель сетевой UTP cat 5e (Единица измерения БУХТА в бухте 305 метров);{'nameRu': 'Запрос ценовых предложений'};0.00;58606.00;{'nameRu': 'Товар'}
961240000583/230001/02;{'nameRu': 'ИП Хоменко Лариса Васильевна'};Услуги по организации обеспечения питания детей;{'nameRu': 'Из одного источника путем прямого заключения договора по питанию обучающихся'};2703972.43;17274000.00;{'nameRu': 'Услуга'}
961240000583/230109/00;"{'nameRu': 'ТОО ""Кен - Сауда LTD""'}";Услуга по установке питьевых фонтанчиков с фильтром для воды согласно технической спецификации;{'nameRu': 'Запрос ценовых предложений'};0.00;397000.00;{'nameRu': 'Услуга'}
961240000583/230108/00;"{'nameRu': 'Частное учреждение ""Учебно-консультационный центр ""Отан""'}";Услуги по обучению (обучению/тренинги/подготовке/переподготовке/повышению квалификации);{'nameRu': 'Запрос ценовых предложений'};0.00;5999.00;{'nameRu': 'Услуга'}
961240000583/230107/00;{'nameRu': 'ИП NOVA'};Работы по изготовлению и установке защитных деревянных решеток из фанеры для радиаторов отопления, подробная характеристика и объем выполняемых работ указаны в технической спецификации;{'nameRu': 'Запрос ценовых предложений'};0.00;549000.00;{'nameRu': 'Работа'}
961240000583/230106/00;"{'nameRu': 'ТОО ""Производственно-коммерческая фирма ""Теплосервис""'}";Услуги по поверке средств измерений;{'nameRu': 'Из одного источника по несостоявшимся закупкам'};0.00;10864.00;{'nameRu': 'Услуга'}
961240000583/230105/00;"{'nameRu': 'Товарищество с ограниченной ответственностью ""TenderPro Solutions""'}";Линия для раздачи питания;{'nameRu': 'Запрос ценовых предложений'};0.00;1370668.32;{'nameRu': 'Товар'}
961240000583/230104/00;"{'nameRu': 'Товарищество с ограниченной ответственностью ""Asia bastau parts""'}";Линия для раздачи питания;{'nameRu': 'Запрос ценовых предложений'};0.00;1220000.00;{'nameRu': 'Товар'}
961240000583/230103/00;"{'nameRu': 'Товарищество с ограниченной ответственностью ""ASB Stars""'}";Приобретение линии для раздачи питания в столовую(Согласно дополнительных характеристик);{'nameRu': 'Запрос ценовых предложений'};0.00;1258470.08;{'nameRu': 'Товар'}
961240000583/230102/00;"{'nameRu': 'ТОО ""GUL""'}";Приобретение линии для раздачи питания в столовую(Согласно дополнительных характеристик);{'nameRu': 'Запрос ценовых предложений'};0.00;1122969.00;{'nameRu': 'Товар'}
961240000583/230001/01;{'nameRu': 'ИП Хоменко Лариса Васильевна'};Организация питания обучающихся в организациях среднего образования для детей-сирот и детей, оставшихся без попечения родителей;{'nameRu': 'Из одного источника путем прямого заключения договора по питанию обучающихся'};2476157.50;4668906.16;{'nameRu': 'Услуга'}
961240000583/230101/00;{'nameRu': 'ИП УРМАНОВ А.К.'};Услуга по установке питьевого фонтанчика с фильтром для воды;{'nameRu': 'Запрос ценовых предложений'};0.00;850000.00;{'nameRu': 'Услуга'}
961240000583/230100/00;"{'nameRu': 'ТОО ""Gard-M""'}";Услуги охраны школы-гимназии согласно технической спецификации, наличие лицензии на охранную деятельность, в том числе УТО;{'nameRu': 'Открытый конкурс'};1399999.98;3136000.00;{'nameRu': 'Услуга'}
961240000583/230099/00;{'nameRu': 'ИП Емельянов Илья Сергеевич'};Работы по модернизации установленной системы видеонаблюдения согласно технической спецификации;{'nameRu': 'Запрос ценовых предложений'};0.00;990000.00;{'nameRu': 'Работа'}
961240000583/230098/00;{'nameRu': 'Stroy Smes'};Клей цементный для керамического кафеля 25кг;{'nameRu': 'Запрос ценовых предложений'};0.00;10600.00;{'nameRu': 'Товар'}
961240000583/230097/00;{'nameRu': 'ИП Барс'};Количество элементов питания 2 Время работы в режиме разговора, ч 14 Время работы в режиме ожидания, ч 250 Комплектация база + трубка Количество трубок в комплекте 2 Рабочая частота, МГц 1880 Функциональные возможности АОН, Caller ID , Автодозвон, Спикерфон Тип аккумулятора NiMH Количество трубок, подключаемых к одной базе 6 Дальность действия в помещении,м 50 Дальность действия на открытой местности, м 300 Количество мелодий звонка 40 Клавиатура для набора номера Да Возможность настенного крепления Да Журнал вызовов (АОН/Caller ID) 50 Количество номеров телефонной книги 200 Стандарт DECT Особенности будильник, ночной режим работы, радио-няня, функция резервного питания Цвет черный Гарантия производителя 12 месяцев;{'nameRu': 'Запрос ценовых предложений'};39999.00;39999.00;{'nameRu': 'Товар'}
961240000583/230096/00;{'nameRu': 'ИП ARSENAL'};шпатлевка 25кг белая;{'nameRu': 'Запрос ценовых предложений'};0.00;21160.00;{'nameRu': 'Товар'}
961240000583/230095/00;"{'nameRu': 'ИП ""ТАБАРАН А.Г.""'}";Кисть малярная, плоская, универсальная (размер 50мм) ворс кисти-щетина натуральная светлая, расщеплена на концах. Щетина кисти надежно закреплена металлическим бандажом с антикоррозийным покрытием, деревянная ручка утолщена в зоне охвата. Кисть предназначена для работ с эмалевыми, масляными красками и лаками.;{'nameRu': 'Запрос ценовых предложений'};0.00;3375.00;{'nameRu': 'Товар'}
961240000583/230094/00;{'nameRu': 'ИП НАУРУЗБАЕВА ДАРИЯ КУЛТАЕВНА'};Кисть малярная, плоская, универсальная (размер 25мм) ворс кисти-щетина натуральная светлая, расщеплена на концах. Щетина кисти надежно закреплена металлическим бандажом с антикоррозийным покрытием, деревянная ручка утолщена в зоне охвата. Кисть предназначена для работ с эмалевыми, масляными красками и лаками.;{'nameRu': 'Запрос ценовых предложений'};0.00;1530.00;{'nameRu': 'Товар'}
961240000583/230093/00;"{'nameRu': 'ИП ""ТАБАРАН А.Г.""'}";Кисть малярная, плоская, универсальная (размер 75мм) ворс кисти-щетина натуральная светлая, расщеплена на концах. Щетина кисти надежно закреплена металлическим бандажом с антикоррозийным покрытием, деревянная ручка утолщена в зоне охвата. Кисть предназначена для работ с эмалевыми, масляными красками и лаками.;{'nameRu': 'Запрос ценовых предложений'};0.00;5100.00;{'nameRu': 'Товар'}
961240000583/230092/00;"{'nameRu': 'ТОО ""Kostanay Business Services""'}";Услуга по приобретению и установке антивирусного программного обеспечения на 250 user.;{'nameRu': 'Из одного источника по несостоявшимся закупкам'};0.00;1199430.40;{'nameRu': 'Услуга'}
961240000583/230091/00;{'nameRu': 'ИП Рыжов Е.Л.'};Архивтік және бухгалтерлік құжаттарды түптеуге арналған электр бұрғылау-түптеу машинасы. Машина қалыңдығы 8 см-ге дейін құжаттар (және картон) пакеттерін бұрғылайды. (80g/m2 тығыздығы шамамен 750 А4 Парақ) ілмек тәрізді ойығы бар қауырсынды бұрғымен, содан кейін жіпті тесік арқылы өткізеді, станок операторы жіптің ұштарын түйінмен байлау үшін қалады. Құрылғыдағы тесіктерді бұрғылау үшін кәдімгі бұрғылау ұшын да қолдануға болады, ал құжаттарды тігу сығанның инесі мен жіпімен жүзеге асырылады;{'nameRu': 'Из одного источника по несостоявшимся закупкам'};0.00;55000.00;{'nameRu': 'Товар'}
961240000583/230090/00;"{'nameRu': 'Товарищество с ограниченной ответственностью ""Оценочная Компания ""ФениксКоммерц""""'}";Қызмет көрсету бойынша техникалық куәландыруға электр желілік және ұқсас объектілер;{'nameRu': 'Запрос ценовых предложений'};0.00;85600.00;{'nameRu': 'Услуга'}
961240000583/230056/01;{'nameRu': 'ИП АБДРАХМАНОВА'};Цемент М-500, 50кг;{'nameRu': 'Электронный магазин'};0.00;12000.00;{'nameRu': 'Товар'}
961240000583/230089/00;"{'nameRu': 'Товарищество с ограниченной ответственностью ""МСБ ПРОФИТ""'}";Установка программного комплекса ICCardTelebot с интеграцией в контрольно-пропускные системы.;{'nameRu': 'Из одного источника путем прямого заключения договора'};1990000.00;1990000.00;{'nameRu': 'Услуга'}
961240000583/230088/00;"{'nameRu': 'ТОО ""RS Solutions""'}";Услуги доступа к единой интегрированной образовательной платформе EDU.KZ;{'nameRu': 'Из одного источника путем прямого заключения договора'};0.00;36500.00;{'nameRu': 'Услуга'}
961240000583/230087/00;"{'nameRu': 'ТОО ""EkoLabRecycling""'}";Услуги по демеркуризации ртутьсодержащих ламп;{'nameRu': 'Из одного источника по несостоявшимся закупкам'};0.00;22400.00;{'nameRu': 'Услуга'}
961240000583/230086/00;{'nameRu': 'ИП Жандарбекова'};Приобретение прочих запасов (Тряпка для мытья пола, большая, 80х100 см);{'nameRu': 'Запрос ценовых предложений'};0.00;31450.00;{'nameRu': 'Товар'}
961240000583/230085/00;{'nameRu': 'ИП ОСИПОВ ГЛЕБ ВАЛЕРЬЕВИЧ'};Переосвидетельствование, перезарядка огнетушителей;{'nameRu': 'Запрос ценовых предложений'};0.00;42000.00;{'nameRu': 'Услуга'}
961240000583/230084/00;{'nameRu': 'ИП КУЖАХМЕТОВ ГАБИТ СЕРЕКБАЕВИЧ'};Услуги по проведению энергоэкспертизы;{'nameRu': 'Запрос ценовых предложений'};111111.00;111111.00;{'nameRu': 'Услуга'}
961240000583/230083/00;{'nameRu': 'ИП Нурсултан'};Приобретение прочих запасов (Шпатлевка гипсовая, универсальная, 25кг);{'nameRu': 'Электронный магазин'};0.00;20000.00;{'nameRu': 'Товар'}
961240000583/230003/01;{'nameRu': 'ИП Емельянов Илья Сергеевич'};Заправка и ремонт картриджей, замена фотобарабана;{'nameRu': 'Запрос ценовых предложений'};156400.00;198000.00;{'nameRu': 'Услуга'}
961240000583/230082/00;{'nameRu': 'ИП ЕЭС'};Валик малярный термоплавленный 250мм;{'nameRu': 'Запрос ценовых предложений'};0.00;6450.00;{'nameRu': 'Товар'}
961240000583/230081/00;{'nameRu': 'ИП КУЛИКОВСКАЯ ИРИНА ПЕТРОВНА'};Водоэмульсионная краска матовая для наружных работ (фасадная) (ведро 25кг);{'nameRu': 'Запрос ценовых предложений'};0.00;18986.00;{'nameRu': 'Товар'}
961240000583/230080/00;"{'nameRu': 'Товарищество с ограниченной ответственностью ""Dias Profit""'}";Приобретение прочих запасов (Скотч 48*100);{'nameRu': 'Запрос ценовых предложений'};0.00;7705.60;{'nameRu': 'Товар'}
961240000583/230079/00;"{'nameRu': 'ИП ""ХОД КОНЕМ""'}";Приобретение прочих запасов (Скотч 20*40);{'nameRu': 'Запрос ценовых предложений'};0.00;4400.00;{'nameRu': 'Товар'}
961240000583/230078/00;{'nameRu': 'ИП ЕЭС'};Растворитель для ПФ эмалей 5л;{'nameRu': 'Из одного источника по несостоявшимся закупкам'};4900.00;4900.00;{'nameRu': 'Товар'}
961240000583/230077/00;"{'nameRu': 'Товарищество с ограниченной ответственностью ""Мегаэнергоэкспертиза""'}";Восстановление молниезащиты с установкой молниеприемника;{'nameRu': 'Из одного источника по несостоявшимся закупкам'};98200.00;109984.00;{'nameRu': 'Работа'}
961240000583/230076/00;"{'nameRu': 'ТОО ""Медицинский центр A’dam""'}";Услуги по медицинскому осмотру персонала (Поверхностный медицинский осмотр 140 человек, глубокий медосмотр 6 человек);{'nameRu': 'Из одного источника по несостоявшимся закупкам'};276000.00;276785.00;{'nameRu': 'Услуга'}
961240000583/230075/00;{'nameRu': 'ИП НАУРУЗБАЕВА ДАРИЯ КУЛТАЕВНА'};Приобретение прочих запасов (хозяйственные товары);{'nameRu': 'Из одного источника по несостоявшимся закупкам'};9358.00;9358.00;{'nameRu': 'Товар'}
961240000583/230074/00;"{'nameRu': 'ТОО ""БН-Энерго""'}";Приобретение прочих запасов (Лампа люминисцентная 18W/765, длина 60см);{'nameRu': 'Из одного источника по несостоявшимся закупкам'};30600.00;34272.00;{'nameRu': 'Товар'}
961240000583/230073/00;{'nameRu': 'ИП Асыл'};Приобретение многофункционального лазерного устройства.;{'nameRu': 'Электронный магазин'};594800.00;594800.00;{'nameRu': 'Товар'}
961240000583/230072/00;"{'nameRu': 'ИП  ""Посудно -скобяная лавка""'}";Приобретение прочих запасов (хозяйственные товары);{'nameRu': 'Из одного источника по несостоявшимся закупкам'};33800.00;33800.00;{'nameRu': 'Товар'}
961240000583/230071/00;"{'nameRu': 'ИП ""ХОД КОНЕМ""'}";Приобретение прочих запасов (Кисть макловица АА (деревянная ручка) 50*150);{'nameRu': 'Из одного источника по несостоявшимся закупкам'};6200.00;6200.00;{'nameRu': 'Товар'}
961240000583/230070/00;"{'nameRu': 'ТОО ""ViSorto""'}";Приобретение прочих запасов (Герметик силиконовый белый, 280мл);{'nameRu': 'Запрос ценовых предложений'};6429.00;7200.48;{'nameRu': 'Товар'}
961240000583/230069/00;{'nameRu': 'ИП НАУРУЗБАЕВА ДАРИЯ КУЛТАЕВНА'};Приобретение прочих запасов (Шпательная лопатка из нержавеющей стали 80мм);{'nameRu': 'Запрос ценовых предложений'};1179.00;1179.00;{'nameRu': 'Товар'}
961240000583/230068/00;"{'nameRu': 'ИП ""ХОД КОНЕМ""'}";Приобретение прочих запасов (хозяйственные товары);{'nameRu': 'Запрос ценовых предложений'};3800.00;3800.00;{'nameRu': 'Товар'}
961240000583/230067/00;{'nameRu': 'ИП БУТ ЕВГЕНИЙ АЛЕКСАНДРОВИЧ'};Приобретение прочих запасов (Краска);{'nameRu': 'Запрос ценовых предложений'};148000.00;165760.00;{'nameRu': 'Товар'}
961240000583/230066/00;"{'nameRu': 'ИП  ""Посудно -скобяная лавка""'}";Приобретение прочих запасов (хозяйственные товары);{'nameRu': 'Запрос ценовых предложений'};7650.00;7650.00;{'nameRu': 'Товар'}
961240000583/230065/00;"{'nameRu': 'ИП ""ХОД КОНЕМ""'}";Приобретение прочих запасов (Ключ трубный рычажной);{'nameRu': 'Запрос ценовых предложений'};3500.00;3500.00;{'nameRu': 'Товар'}
961240000583/230064/00;"{'nameRu': 'ТОО ""Республиканский Радиологический Центр""'}";Услуги по проведению лабораторно-инструментальных исследований, анализов, согласно перечня заказчика;{'nameRu': 'Запрос ценовых предложений'};0.00;145600.00;{'nameRu': 'Услуга'}
961240000583/230062/00;{'nameRu': 'ИП КУЛИКОВСКАЯ ИРИНА ПЕТРОВНА'};Приобретение прочих запасов (водоэмульсионная краска);{'nameRu': 'Электронный магазин'};466032.00;466032.00;{'nameRu': 'Товар'}
961240000583/230061/00;"{'nameRu': 'ТОО ""KGS Group & Co""'}";Ветошь трикотажная для мытья пола, содержание х/б волокна 100%, прочная;{'nameRu': 'Электронный магазин'};50000.00;56000.00;{'nameRu': 'Товар'}
961240000583/230060/00;"{'nameRu': 'ИП ""Ерсайын""'}";Текущий ремонт окон (замена оконных блоков);{'nameRu': 'Запрос ценовых предложений'};1489000.00;1489000.00;{'nameRu': 'Работа'}
961240000583/230059/00;"{'nameRu': 'ТОО ""Центр Реабилитации - Адал""'}";Изготовление регулируемой ученической мебели в комплекте;{'nameRu': 'Запрос ценовых предложений'};3780000.00;4233600.00;{'nameRu': 'Работа'}
961240000583/230058/00;"{'nameRu': 'ИП ""СТУСЬ А.С.""'}";Текущий ремонт входной группы;{'nameRu': 'Запрос ценовых предложений'};0.00;1125000.00;{'nameRu': 'Работа'}
961240000583/230057/00;{'nameRu': 'ИП Емельянов Илья Сергеевич'};Текущий ремонт системы видеонаблюдения;{'nameRu': 'Запрос ценовых предложений'};2980000.00;2980000.00;{'nameRu': 'Работа'}
961240000583/230056/00;{'nameRu': 'ИП АБДРАХМАНОВА'};Цемент М-500, 50кг;{'nameRu': 'Электронный магазин'};0.00;12000.00;{'nameRu': 'Товар'}
961240000583/230055/00;"{'nameRu': 'ТОО ""Казах Кенсе""'}";Бумага А4, белоснежная, в пачке 500 листов;{'nameRu': 'Электронный магазин'};123900.00;138768.00;{'nameRu': 'Товар'}
961240000583/230054/00;{'nameRu': 'КНАУС АНТОН'};Приобретение радиомикрофона.;{'nameRu': 'Электронный магазин'};284550.00;284550.00;{'nameRu': 'Товар'}
961240000583/230053/00;"{'nameRu': 'ООИ ""Аманат-Тараз""'}";Работы по изготовлению металлических шкафчиков для одежды;{'nameRu': 'Запрос ценовых предложений'};4489999.00;4489999.00;{'nameRu': 'Работа'}
961240000583/230052/00;{'nameRu': 'ИП Кабылбеков'};Работы по текущему ремонту перегородок в санитарном узле;{'nameRu': 'Запрос ценовых предложений'};1199999.00;1199999.00;{'nameRu': 'Работа'}
961240000583/230051/00;"{'nameRu': 'ТОО ""Зеленое яблоко""'}";Подписка на газету Зеленое Яблоко на 2023 год;{'nameRu': 'Из одного источника путем прямого заключения договора'};122705.00;122705.00;{'nameRu': 'Услуга'}
961240000583/230050/00;"{'nameRu': 'ТОО ""HABEKA""'}";Проверка 50 вентиляционных каналов;{'nameRu': 'Запрос ценовых предложений'};0.00;43934.00;{'nameRu': 'Услуга'}
961240000583/230049/00;{'nameRu': 'ИП Медеуп Куралай Испандияровна'};Приобретение прочих запасов (Средство для дезинфекции в таблетках, в упаковке 300шт.);{'nameRu': 'Запрос ценовых предложений'};33780.00;33780.00;{'nameRu': 'Товар'}
961240000583/230048/00;{'nameRu': 'ИП Мазкенова'};Приобретение прочих запасов (Жидкое дезинфицирующее средство для сантехники 1л);{'nameRu': 'Запрос ценовых предложений'};16400.00;16400.00;{'nameRu': 'Товар'}
961240000583/230047/00;{'nameRu': 'ИП ФЕДИН СЕРГЕЙ НИКОЛАЕВИЧ'};Приобретение прочих запасов (Мыло жидкое хозяйственное антибактериальное 72%, объем 1л);{'nameRu': 'Запрос ценовых предложений'};19200.00;19200.00;{'nameRu': 'Товар'}
961240000583/230046/00;"{'nameRu': 'Товарищество с ограниченной ответственностью """"Bilim Land""""'}";Услуги по предоставлению доступа к Продукту образовательной системы, к обучающему порталу пользователям (учителя, ученики) образовательного учреждения на 7 месяцев;{'nameRu': 'Запрос ценовых предложений'};70393.00;70393.00;{'nameRu': 'Услуга'}
961240000583/230045/00;"{'nameRu': 'ТОО ""Теплокомплект-2006БКБ""'}";Услуги по промывке и опрессовке системы отопления;{'nameRu': 'Запрос ценовых предложений'};21890.00;21890.00;{'nameRu': 'Услуга'}
961240000583/230044/00;"{'nameRu': 'ТОО """"ТДС Костанай""""'}";Приобретение прочих запасов (Муфта Д-20, клипса Д-20);{'nameRu': 'Из одного источника по несостоявшимся закупкам'};4720.00;5286.40;{'nameRu': 'Товар'}
