contractNumberSys;Supplier;descriptionRu;FaktTradeMethods;faktSum;contractSumWnds;RefSubjectType
950140000476/230026/00;{'nameRu': 'Государственное коммунальное предприятие “Кушмурунская теплоэнергетическая компания” акимата Аулиекольского района государственного учреждения “Отдел жилищно – коммунального хозяйства, пассажирского транспорта и автомобильных дорог акимата Аулиекольского района”'};холодная вода;{'nameRu': 'Из одного источника путем прямого заключения договора'};0.00;35000.00;{'nameRu': 'Услуга'}
950140000476/230025/00;{'nameRu': 'ИП Гальцова Анастасия Юрьевна'};картридж;{'nameRu': 'Запрос ценовых предложений'};75570.00;84638.40;{'nameRu': 'Товар'}
950140000476/230024/00;"{'nameRu': 'ТОО ""ТТ-Сервис""'}";картридж;{'nameRu': 'Запрос ценовых предложений'};79050.00;88536.00;{'nameRu': 'Товар'}
950140000476/230023/00;{'nameRu': 'ИП СОКОЛОВ ОЛЕГ ВЛАДИМИРОВИЧ'};Обслуживание пожарной сигнализации (Житикаринский район);{'nameRu': 'Запрос ценовых предложений'};33498.00;44642.00;{'nameRu': 'Услуга'}
950140000476/230022/00;"{'nameRu': 'ТОО ""Производственно-коммерческая фирма ""Теплосервис""'}";Обслуживание прибора учета тепла;{'nameRu': 'Из одного источника по несостоявшимся закупкам'};64285.71;168000.00;{'nameRu': 'Услуга'}
950140000476/230021/00;"{'nameRu': 'АО ""Казахтелеком""'}";Услуги телефонной связи г.Костанай;{'nameRu': 'Из одного источника по несостоявшимся закупкам'};509783.98;840000.00;{'nameRu': 'Услуга'}
950140000476/230020/00;{'nameRu': 'ИП СОКОЛОВ ОЛЕГ ВЛАДИМИРОВИЧ'};Обслуживание пожарной сигнализации (Б.Майлина район);{'nameRu': 'Запрос ценовых предложений'};26784.16;35714.00;{'nameRu': 'Услуга'}
950140000476/230019/00;"{'nameRu': 'АО ""Казахтелеком""'}";Услуги телефонной связи Аулиекольский район;{'nameRu': 'Второй этап конкурса с использованием рамочного соглашения'};0.00;12773.76;{'nameRu': 'Услуга'}
950140000476/230018/00;"{'nameRu': 'АО ""Казахтелеком""'}";Услуги телефонной связи район Б. Майлин;{'nameRu': 'Второй этап конкурса с использованием рамочного соглашения'};9218.86;12773.76;{'nameRu': 'Услуга'}
950140000476/230017/00;"{'nameRu': 'Государственное коммунальное предприятие ""Костанай-Су"" акимата города Костаная государственного учреждения ""Отдел жилищно-коммунального хозяйства, пассажирского транспорта и автомобильных дорог акимата города Костаная""'}";холодная вода, канализация;{'nameRu': 'Из одного источника путем прямого заключения договора'};1428562.52;1600000.00;{'nameRu': 'Услуга'}
950140000476/230015/00;{'nameRu': 'ГКП «Житикаракоммунэнерго» ГУ «Отдел жилищно-коммунального хозяйства, пассажирского транспорта, автомобильных дорог и жилищной инспекции акимата Житикаринского района»'};водоснабжение и/или отведение сточных вод;{'nameRu': 'Из одного источника путем прямого заключения договора'};0.00;70000.00;{'nameRu': 'Услуга'}
950140000476/230014/00;{'nameRu': 'ГКП «Житикаракоммунэнерго» ГУ «Отдел жилищно-коммунального хозяйства, пассажирского транспорта, автомобильных дорог и жилищной инспекции акимата Житикаринского района»'};электроэнергия;{'nameRu': 'Из одного источника путем прямого заключения договора'};662630.79;1300000.00;{'nameRu': 'Услуга'}
950140000476/230013/00;"{'nameRu': 'Филиал АО ""Казпочта"" - ""РССС""'}";Услуги специальной почтовой связи;{'nameRu': 'Из одного источника путем прямого заключения договора'};167211.61;814000.00;{'nameRu': 'Услуга'}
950140000476/230012/00;{'nameRu': 'ГКП «Житикаракоммунэнерго» ГУ «Отдел жилищно-коммунального хозяйства, пассажирского транспорта, автомобильных дорог и жилищной инспекции акимата Житикаринского района»'};теплоэнергия;{'nameRu': 'Из одного источника путем прямого заключения договора'};2684533.28;4038725.77;{'nameRu': 'Услуга'}
950140000476/230011/00;"{'nameRu': 'ГКП ""Костанайская теплоэнергетическая компания"" акимата города Костаная государственного учреждения ""Отдел жилищно-коммунального хозяйства, пассажирского транспорта и автомобильных дорог акимата города Костаная""'}";плата за теплоэнергию и горячее водоснабжение;{'nameRu': 'Из одного источника путем прямого заключения договора'};3152434.03;7450000.00;{'nameRu': 'Услуга'}
950140000476/230010/00;"{'nameRu': 'ТОО ""Костанайский ЭнергоЦентр""'}";плата за электроэнергию;{'nameRu': 'Из одного источника путем прямого заключения договора'};0.00;400036.22;{'nameRu': 'Товар'}
950140000476/230009/00;"{'nameRu': 'ТОО ""Костанайский ЭнергоЦентр""'}";плата за электроэнергию;{'nameRu': 'Из одного источника путем прямого заключения договора'};0.00;1300088.83;{'nameRu': 'Товар'}
950140000476/230008/00;"{'nameRu': 'АО ""Казахтелеком""'}";Услуги по доступу к Интернету;{'nameRu': 'Второй этап конкурса с использованием рамочного соглашения'};0.00;2172624.00;{'nameRu': 'Услуга'}
950140000476/230007/00;"{'nameRu': 'ТОО ""Костанайский ЭнергоЦентр""'}";плата за электроэнергию;{'nameRu': 'Из одного источника путем прямого заключения договора'};0.00;4200149.18;{'nameRu': 'Товар'}
950140000476/230006/00;"{'nameRu': 'Индивидуальный предприниматель ""НАТАЛЬЯ""'}";Услуги по вывозу и утилизации твердо-бытовых отходов ( район Беимбета Майлина);{'nameRu': 'Из одного источника по несостоявшимся закупкам'};0.00;63700.00;{'nameRu': 'Услуга'}
950140000476/230005/00;"{'nameRu': 'ТОО ""СОЦСЕРВИС""'}";Вывоз и размещение ТБО (Житикаринский р-н);{'nameRu': 'Из одного источника по несостоявшимся закупкам'};0.00;24640.00;{'nameRu': 'Услуга'}
950140000476/230004/00;{'nameRu': 'Достар'};Обслуживание пожарной сигнализации (г.Аркалык);{'nameRu': 'Из одного источника по несостоявшимся закупкам'};28872.00;38500.00;{'nameRu': 'Услуга'}
950140000476/230003/00;"{'nameRu': 'ИП ""Сункар""'}";Обслуживание пожарной сигнализации (Аулиекольский район);{'nameRu': 'Запрос ценовых предложений'};27407.28;41111.00;{'nameRu': 'Услуга'}
950140000476/230002/00;"{'nameRu': 'ТОО ""Охранная Компания Арыстан""'}";Обслуживание пожарной сигнализации (г. Костанай);{'nameRu': 'Запрос ценовых предложений'};46944.00;62600.00;{'nameRu': 'Услуга'}
950140000476/230001/00;"{'nameRu': 'АО ""Казахтелеком""'}";Услуги телефонной связи Мендыкаринский район;{'nameRu': 'Второй этап конкурса с использованием рамочного соглашения'};10063.64;11400.00;{'nameRu': 'Услуга'}
