contractNumberSys;Supplier;descriptionRu;FaktTradeMethods;faktSum;contractSumWnds;RefSubjectType
070140003882/230050/01;"{'nameRu': 'ТОО ""Научно-производственное предприятие ""ИНВЕНТ-плюс""'}";Приобретение семян газонных трав;{'nameRu': 'Запрос ценовых предложений'};591640.00;662636.80;{'nameRu': 'Товар'}
070140003882/230024/01;"{'nameRu': 'ИП ""ISIDA""'}";Приобретение грунта растительного (земля).;{'nameRu': 'Запрос ценовых предложений'};0.00;64995.00;{'nameRu': 'Товар'}
070140003882/230043/01;"{'nameRu': 'ТОО ""Кен - Сауда LTD""'}";Приобретение речного песка;{'nameRu': 'Из одного источника по несостоявшимся закупкам'};0.00;91500.00;{'nameRu': 'Товар'}
070140003882/230177/00;"{'nameRu': 'Костанайский филиал АО ""Национальный центр экспертизы и сертификации""'}";Услуги по техническому осмотру микроавтобуса Mercedes-Benz согласно технической спецификации;{'nameRu': 'Из одного источника по несостоявшимся закупкам'};0.00;5600.00;{'nameRu': 'Услуга'}
070140003882/230176/00;"{'nameRu': 'Товарищество с ограниченной ответственностью ""Парус-КАЗ""'}";Обслуживание программного продукта  Парус-КАЗ.Бюджет (Тарификация);{'nameRu': 'Из одного источника путем прямого заключения договора'};0.00;60684.00;{'nameRu': 'Услуга'}
070140003882/230175/00;"{'nameRu': 'Товарищество с ограниченной ответственностью ""Парус-КАЗ""'}";Установка программного продукта Парус-КАЗ.Бюджет (Тарификация);{'nameRu': 'Из одного источника путем прямого заключения договора'};0.00;150000.00;{'nameRu': 'Услуга'}
070140003882/230146/03;"{'nameRu': 'ТОО ""ЭкоСтройСити""'}";Работы по текущему ремонту подтрибунных помещений восточной трибуны объекта Центральный стадион;{'nameRu': 'Открытый конкурс'};65839483.85;73740221.91;{'nameRu': 'Работа'}
070140003882/230146/02;"{'nameRu': 'ТОО ""ЭкоСтройСити""'}";Работы по текущему ремонту подтрибунных помещений восточной трибуны объекта Центральный стадион;{'nameRu': 'Открытый конкурс'};43703654.47;71518821.92;{'nameRu': 'Работа'}
070140003882/230174/00;{'nameRu': 'Oil Центр'};Услуги по техническому обслуживанию автотранспортного средства TOYOTA LAND CRUISER PRADO согласно технической спецификации;{'nameRu': 'Запрос ценовых предложений'};47750.00;53480.00;{'nameRu': 'Услуга'}
070140003882/230173/00;{'nameRu': 'ИП Арнай'};Приобретение двигателя нового на автотранспортное средство KIA CERATO;{'nameRu': 'Запрос ценовых предложений'};0.00;590000.00;{'nameRu': 'Товар'}
070140003882/230171/00;"{'nameRu': 'ТОО ""КНР""'}";Работы по техническому обследованию строительных конструкций восточной трибуны по адресу г.Костанай, ул. 1 Мая, 153 Центральный стадион согласно технической спецификации;{'nameRu': 'Из одного источника по несостоявшимся закупкам'};0.00;1160714.28;{'nameRu': 'Работа'}
070140003882/230170/00;{'nameRu': 'Oil Центр'};Услуга по техническому обслуживанию автотранспортного средства KIA CERATO согласно технической спецификации;{'nameRu': 'Запрос ценовых предложений'};47850.00;53592.00;{'nameRu': 'Услуга'}
070140003882/230169/00;"{'nameRu': 'Товарищество с ограниченной ответственностью ""Elite Tender Management""'}";Приобретение ноутбуков согласно технической спецификации;{'nameRu': 'Запрос ценовых предложений'};0.00;563133.00;{'nameRu': 'Товар'}
070140003882/230168/00;{'nameRu': 'ИП АйРус'};Приобретение аккумулятора согласно технической спецификации;{'nameRu': 'Из одного источника по несостоявшимся закупкам'};14200.00;14200.00;{'nameRu': 'Товар'}
070140003882/230167/00;"{'nameRu': 'Костанайский филиал АО ""Национальный центр экспертизы и сертификации""'}";Услуга по техническому осмотру автомашины TOYOTA LAND CRUISER PRADO согласно технической спецификации;{'nameRu': 'Из одного источника по несостоявшимся закупкам'};4017.86;4500.00;{'nameRu': 'Услуга'}
070140003882/230166/00;{'nameRu': 'ИП НАУРУЗБАЕВА ДАРИЯ КУЛТАЕВНА'};Приобретение кабеля согласно технической спецификации;{'nameRu': 'Запрос ценовых предложений'};16650.00;16650.00;{'nameRu': 'Товар'}
070140003882/230165/00;"{'nameRu': 'АО ""Страховая компания ""АСКО""'}";Услуги по обязательному страхованию гражданско-правовой ответственности владельцев автомобильного транспорта согласно технической спецификации;{'nameRu': 'Запрос ценовых предложений'};35263.67;35263.67;{'nameRu': 'Услуга'}
070140003882/230164/00;"{'nameRu': 'ТОО ""SKA Technologies""'}";Приобретение ноутбуков согласно технической спецификации;{'nameRu': 'Запрос ценовых предложений'};0.00;630000.00;{'nameRu': 'Товар'}
070140003882/230152/02;"{'nameRu': 'ТОО ""Белый Аист Company""'}";Работы по покраске Восточной и Западной трибун футбольного стадиона;{'nameRu': 'Открытый конкурс'};23314314.00;26112031.68;{'nameRu': 'Работа'}
070140003882/230163/00;"{'nameRu': 'ТОО ""RUBICON.KZ""'}";Приобретение корректора объёма газа;{'nameRu': 'Из одного источника по несостоявшимся закупкам'};707000.00;707000.00;{'nameRu': 'Товар'}
070140003882/230162/00;"{'nameRu': 'ТОО ""RUBICON.KZ""'}";Услуга по поверке счётчика газа согласно технической спецификации;{'nameRu': 'Из одного источника по несостоявшимся закупкам'};156000.00;156000.00;{'nameRu': 'Услуга'}
070140003882/230161/00;"{'nameRu': '""SUNRISE""'}";Шуруповёрт аккумуляторный;{'nameRu': 'Запрос ценовых предложений'};0.00;27900.00;{'nameRu': 'Товар'}
070140003882/230160/00;{'nameRu': 'ИП ЛУКУТИН ВЛАДИМИР ВЛАДИМИРОВИЧ'};Работы по ремонту электродвигателей;{'nameRu': 'Из одного источника по несостоявшимся закупкам'};367920.00;367920.00;{'nameRu': 'Работа'}
070140003882/230159/00;{'nameRu': 'Oil Центр'};Услуги по техническому обслуживанию микроавтобуса Mersedes Bens Sprinter согласно технической спецификации;{'nameRu': 'Запрос ценовых предложений'};104600.00;117152.00;{'nameRu': 'Услуга'}
070140003882/230158/00;{'nameRu': 'ИП Савина'};Услуги по изготовлению журнала учебно-тренировочных занятий в количестве 60 штук согласно технической спецификации;{'nameRu': 'Запрос ценовых предложений'};28680.00;28680.00;{'nameRu': 'Услуга'}
070140003882/230157/00;{'nameRu': 'ИП СанСара'};Услуги шиномонтажа автотранспортных средств согласно технической спецификации;{'nameRu': 'Запрос ценовых предложений'};0.00;58000.00;{'nameRu': 'Услуга'}
070140003882/230146/01;"{'nameRu': 'ТОО ""ЭкоСтройСити""'}";Работы по текущему ремонту подтрибунных помещений восточной трибуны объекта Центральный стадион;{'nameRu': 'Открытый конкурс'};38997020.54;57288000.00;{'nameRu': 'Работа'}
070140003882/230156/00;"{'nameRu': 'ТОО ""Эталон Авто Костанай""'}";Приобретение бензина АИ-92;{'nameRu': 'Второй этап конкурса с использованием рамочного соглашения'};366071.43;410000.00;{'nameRu': 'Товар'}
070140003882/230144/01;{'nameRu': 'ИП АМИНА'};Переносные футбольные ворота с сеткой согласно технической спецификации;{'nameRu': 'Запрос ценовых предложений'};1733328.00;1733328.00;{'nameRu': 'Товар'}
070140003882/230152/01;"{'nameRu': 'ТОО ""Белый Аист Company""'}";Работы по покраске Восточной и Западной трибун футбольного стадиона;{'nameRu': 'Открытый конкурс'};0.00;20720000.00;{'nameRu': 'Работа'}
070140003882/230155/00;{'nameRu': 'Oil Центр'};Приобретение солидола на погрузчик LG 940;{'nameRu': 'Запрос ценовых предложений'};9792.00;10967.04;{'nameRu': 'Товар'}
070140003882/230154/00;{'nameRu': 'ИП Тайшев'};Приобретение лески на триммер согласно технической спецификации;{'nameRu': 'Запрос ценовых предложений'};19800.00;19800.00;{'nameRu': 'Товар'}
070140003882/230143/01;{'nameRu': 'ИП Утегенов Т.Е.'};Работы по текущему ремонту ограждения Центрального стадиона;{'nameRu': 'Запрос ценовых предложений'};878000.00;878000.00;{'nameRu': 'Работа'}
070140003882/230153/00;"{'nameRu': 'ТОО ""ХимЭкспресс - 2004""'}";Приобретение фертики газонной весна-лето согласно технической спецификации;{'nameRu': 'Запрос ценовых предложений'};1505680.00;3215520.00;{'nameRu': 'Товар'}
070140003882/230122/01;"{'nameRu': 'ТОО ""SattiRich""'}";Приобретение хозяйственных товаров;{'nameRu': 'Запрос ценовых предложений'};301932.90;301932.90;{'nameRu': 'Товар'}
070140003882/230118/01;{'nameRu': 'ИП Кырхан'};Работы по текущему ремонту подтрибунного помещения согласно технической спецификации;{'nameRu': 'Запрос ценовых предложений'};1920000.00;1920000.00;{'nameRu': 'Работа'}
070140003882/230152/00;"{'nameRu': 'ТОО ""Белый Аист Company""'}";Работы по покраске Восточной и Западной трибун футбольного стадиона;{'nameRu': 'Открытый конкурс'};0.00;20720000.00;{'nameRu': 'Работа'}
070140003882/230151/00;"{'nameRu': 'Костанайский филиал АО ""Национальный центр экспертизы и сертификации""'}";Услуги по поверке средств измерений (манометр, термометр, сигнализаторы загазованности);{'nameRu': 'Из одного источника по несостоявшимся закупкам'};32492.86;36392.00;{'nameRu': 'Услуга'}
070140003882/230150/00;{'nameRu': 'Oil Центр'};слуги по техническому обслуживанию автотранспортного средства Kia Cerato согласно технической спецификации;{'nameRu': 'Запрос ценовых предложений'};8500.00;9520.00;{'nameRu': 'Услуга'}
070140003882/230149/00;"{'nameRu': 'Товарищество с ограниченной ответственностью ""Парус-КАЗ""'}";Обслуживание программного продукта Парус-КАЗ.Бюджет (Бюджетное финансирование);{'nameRu': 'Из одного источника путем прямого заключения договора'};26785.71;30000.00;{'nameRu': 'Услуга'}
070140003882/230148/00;"{'nameRu': 'Товарищество с ограниченной ответственностью ""Asia bastau parts""'}";Приобретение фертики газонной весна-лето;{'nameRu': 'Запрос ценовых предложений'};0.00;3729600.00;{'nameRu': 'Товар'}
070140003882/230147/00;{'nameRu': 'ИП КУНЦ ЕВГЕНИЙ АЛЕКСАНДРОВИЧ'};Услуга по ремонту и заправке картриджей согласно технической спецификации;{'nameRu': 'Запрос ценовых предложений'};0.00;98000.00;{'nameRu': 'Услуга'}
070140003882/230146/00;"{'nameRu': 'ТОО ""ЭкоСтройСити""'}";Работы по текущему ремонту подтрибунных помещений восточной трибуны объекта Центральный стадион;{'nameRu': 'Открытый конкурс'};0.00;57288000.00;{'nameRu': 'Работа'}
070140003882/230145/00;{'nameRu': 'Oil Центр'};Приобретение тормозной жидкости на погрузчик;{'nameRu': 'Запрос ценовых предложений'};1575.00;1764.00;{'nameRu': 'Товар'}
070140003882/230144/00;{'nameRu': 'ИП АМИНА'};Переносные футбольные ворота с сеткой  согласно технической спецификации;{'nameRu': 'Запрос ценовых предложений'};0.00;1733328.00;{'nameRu': 'Товар'}
070140003882/230143/00;{'nameRu': 'ИП Утегенов Т.Е.'};Работы по текущему ремонту ограждения Центрального стадиона;{'nameRu': 'Запрос ценовых предложений'};0.00;878000.00;{'nameRu': 'Работа'}
070140003882/230120/01;"{'nameRu': 'ТОО ""ADOS-TRADING""'}";Приобретение кондиционеров;{'nameRu': 'Запрос ценовых предложений'};0.00;760972.80;{'nameRu': 'Товар'}
070140003882/230142/00;"{'nameRu': 'Товарищество с ограниченной ответственностью ""ASB Stars""'}";Приобретение мембраны ветрозащитной;{'nameRu': 'Запрос ценовых предложений'};0.00;1472640.00;{'nameRu': 'Товар'}
070140003882/230141/00;"{'nameRu': 'Товарищество с ограниченной ответственностью ""NBO plus""'}";Приобретение мембраны ветрозащитной;{'nameRu': 'Запрос ценовых предложений'};0.00;1634304.00;{'nameRu': 'Товар'}
070140003882/230140/00;"{'nameRu': '""Костанайский Дом печати"" ТОО'}";Услуга по изготовлению грамот;{'nameRu': 'Запрос ценовых предложений'};75000.00;84000.00;{'nameRu': 'Услуга'}
070140003882/230139/00;{'nameRu': 'Некоммерческое акционерное общество «Государственная корпорация «Правительство для граждан»'};Изготовление земельно-кадастрового плана земельного участка - 2 участка;{'nameRu': 'Из одного источника путем прямого заключения договора'};30907.93;34616.88;{'nameRu': 'Работа'}
070140003882/230138/00;{'nameRu': 'Некоммерческое акционерное общество «Государственная корпорация «Правительство для граждан»'};Расчёт определения кадастровой (оценочной стоимости) земельного участка - 2 участка;{'nameRu': 'Из одного источника путем прямого заключения договора'};41226.62;46173.81;{'nameRu': 'Работа'}
070140003882/230137/00;{'nameRu': 'Некоммерческое акционерное общество «Государственная корпорация «Правительство для граждан»'};Составление проектов межхозяйственного землеустройства по образованию новых и упорядочиванию существующих землепользований, Установление границ на местности - 2,6098 га, Установление границ на местности - 0,6115 га;{'nameRu': 'Из одного источника путем прямого заключения договора'};214828.90;240608.37;{'nameRu': 'Работа'}
070140003882/230136/00;"{'nameRu': 'ТОО ""Samruk Tekstil""'}";Приобретение Государственного Флага РК ( Флаг уличный);{'nameRu': 'Электронный магазин'};15000.00;16800.00;{'nameRu': 'Товар'}
070140003882/230135/00;"{'nameRu': 'ТОО ""Производственно-коммерческая фирма ""Теплосервис""'}";Услуга по поверке счётчика воды ду-20 в количестве 1 штуки и ду-15 в количестве 1 штуки согласно технической спецификации;{'nameRu': 'Из одного источника по несостоявшимся закупкам'};7232.14;8100.00;{'nameRu': 'Услуга'}
070140003882/230134/00;{'nameRu': 'ИП Мухамедиева'};Приобретение медалей спортивных за 3 место;{'nameRu': 'Запрос ценовых предложений'};179640.00;179640.00;{'nameRu': 'Товар'}
070140003882/230133/00;{'nameRu': 'ИП Мухамедиева'};Приобретение медалей спортивных за 2 место;{'nameRu': 'Запрос ценовых предложений'};179640.00;179640.00;{'nameRu': 'Товар'}
070140003882/230132/00;{'nameRu': 'ИП Мухамедиева'};Приобретение медалей спортивных за 1 место;{'nameRu': 'Запрос ценовых предложений'};179640.00;179640.00;{'nameRu': 'Товар'}
070140003882/230131/00;"{'nameRu': 'КГП ""Поликлиника № 3 города Костанай"" Управления здравоохранения акимата Костанайской области'}";Услуги по периодическому медицинскому осмотру персонала согласно технической спецификации;{'nameRu': 'Запрос ценовых предложений'};0.00;33250.00;{'nameRu': 'Услуга'}
070140003882/230130/00;"{'nameRu': 'АО ""Страховая компания ""Номад Иншуранс""'}";Услуги по страхованию гражданско-правовой ответственности перевозчиков (кроме владельцев автотранспортных средств) согласно технической спецификации;{'nameRu': 'Запрос ценовых предложений'};49680.00;49680.00;{'nameRu': 'Услуга'}
070140003882/230129/00;"{'nameRu': 'АО ""Нефтяная страховая компания""'}";Услуги по страхованию гражданско-правовой ответственности владельцев автомобильного транспорта согласно технической спецификации;{'nameRu': 'Запрос ценовых предложений'};52918.52;52918.52;{'nameRu': 'Услуга'}
070140003882/230128/00;{'nameRu': 'ИП Үміт'};Электромонтажные работы;{'nameRu': 'Запрос ценовых предложений'};1333333.00;1333333.00;{'nameRu': 'Работа'}
070140003882/230127/00;"{'nameRu': 'ТОО ""ПрофТехГрупп""'}";Приобретение звукового оборудования;{'nameRu': 'Запрос ценовых предложений'};26717806.00;29923942.72;{'nameRu': 'Товар'}
070140003882/230126/00;{'nameRu': 'Incom'};Приобретение стяжек (хомуты), в упаковке;{'nameRu': 'Запрос ценовых предложений'};13300.00;13300.00;{'nameRu': 'Товар'}
070140003882/230125/00;"{'nameRu': 'ТОО ""Lion\'s PriDe""'}";Приобретение нождака сверлильного;{'nameRu': 'Запрос ценовых предложений'};59850.00;67032.00;{'nameRu': 'Товар'}
070140003882/230124/00;{'nameRu': 'ИП ДанЭль'};Приобретение стола пластикового;{'nameRu': 'Запрос ценовых предложений'};154000.00;154000.00;{'nameRu': 'Товар'}
070140003882/230123/00;"{'nameRu': 'ИП ""ХОД КОНЕМ""'}";Приобретение ручного фонаря;{'nameRu': 'Запрос ценовых предложений'};20700.00;20700.00;{'nameRu': 'Товар'}
070140003882/230122/00;"{'nameRu': 'ТОО ""SattiRich""'}";Приобретение хозяйственных товаров;{'nameRu': 'Запрос ценовых предложений'};0.00;301932.90;{'nameRu': 'Товар'}
070140003882/230121/00;{'nameRu': 'ИП НАУРУЗБАЕВА ДАРИЯ КУЛТАЕВНА'};Приобретение скребка для уборки снега;{'nameRu': 'Запрос ценовых предложений'};23709.00;23709.00;{'nameRu': 'Товар'}
070140003882/230120/00;"{'nameRu': 'ТОО ""ADOS-TRADING""'}";Приобретение кондиционеров;{'nameRu': 'Запрос ценовых предложений'};0.00;679440.00;{'nameRu': 'Товар'}
070140003882/230119/00;{'nameRu': 'КОЧЕРГА ВЛАДИМИР ФЁДОРОВИЧ'};Приобретение антифриза;{'nameRu': 'Запрос ценовых предложений'};30000.00;33600.00;{'nameRu': 'Товар'}
070140003882/230118/00;{'nameRu': 'ИП Кырхан'};Работы по текущему ремонту подтрибунного помещения согласно технической спецификации;{'nameRu': 'Запрос ценовых предложений'};0.00;1920000.00;{'nameRu': 'Работа'}
070140003882/230117/00;"{'nameRu': 'ТОО ""Восход""'}";Услуги по промывке и опрессовке системы отопления согласно технической спецификации;{'nameRu': 'Запрос ценовых предложений'};98888.00;110754.56;{'nameRu': 'Услуга'}
070140003882/230116/00;"{'nameRu': 'ТОО ""Ekomed.kz""'}";Батарейки пальчиковые. 40 штук. Емкость аккумулятора не менее 1300 мАч, тип аккумулятора батарейки алкалиновая, рабочее напряжение 1,5В.;{'nameRu': 'Электронный магазин'};18571.20;20799.74;{'nameRu': 'Товар'}
070140003882/230115/00;"{'nameRu': 'ТОО ""GSE (ДжиЭсЕ)""'}";Приобретение компьютеров в комплекте согласно технической спецификации;{'nameRu': 'Конкурс с предварительным квалификационным отбором'};1325000.00;1484000.00;{'nameRu': 'Товар'}
070140003882/230114/00;"{'nameRu': 'Товарищество с ограниченной ответственностью ""NBO plus""'}";Приобретение фертики газонной весна-лето;{'nameRu': 'Запрос ценовых предложений'};0.00;3720427.20;{'nameRu': 'Товар'}
070140003882/230113/00;{'nameRu': 'ИП АйРус'};КСВВнг (А) 2х0.5 кабель пониженной пожарной опасности;{'nameRu': 'Из одного источника по несостоявшимся закупкам'};20980.00;20980.00;{'nameRu': 'Товар'}
