contractNumberSys;Supplier;descriptionRu;FaktTradeMethods;faktSum;contractSumWnds;RefSubjectType
200140020613/230064/00;"{'nameRu': 'ТОО ""ASTIC GROUP""'}";Разработка технической документации на средний ремонт улицы 60 Лет Октября,Ряжский с.о., с. Ряжское, Узункольского района Костанайской области;{'nameRu': 'Запрос ценовых предложений'};0.00;311111.00;{'nameRu': 'Услуга'}
200140020613/230062/00;{'nameRu': 'Некоммерческое акционерное общество «Государственная корпорация «Правительство для граждан»'};Изготовлению идентификационного документа (гос.акта) на земельный участок;{'nameRu': 'Из одного источника путем прямого заключения договора'};0.00;15453.72;{'nameRu': 'Работа'}
200140020613/230061/00;"{'nameRu': 'ИП ""Хантарбай Буркит""'}";услуги по изготовлению баннера;{'nameRu': 'Запрос ценовых предложений'};0.00;45600.00;{'nameRu': 'Услуга'}
200140020613/230060/00;{'nameRu': 'ИП Аманжолов А.Е.'};Работы по изготовлению жалюзи;{'nameRu': 'Запрос ценовых предложений'};0.00;98000.00;{'nameRu': 'Работа'}
200140020613/230059/00;{'nameRu': 'ИП ЕЭС'};приобретение хозяйственных товаров (линолеум);{'nameRu': 'Запрос ценовых предложений'};0.00;117675.00;{'nameRu': 'Товар'}
200140020613/230058/00;{'nameRu': 'IG-Service'};планшет бюджетный с сим картой;{'nameRu': 'Запрос ценовых предложений'};0.00;123900.00;{'nameRu': 'Товар'}
200140020613/230057/00;"{'nameRu': 'ТОО ""Жасыл Узунколь""'}";Зимнее содержание дорог в с.Речное;{'nameRu': 'Из одного источника по несостоявшимся закупкам'};0.00;431696.43;{'nameRu': 'Работа'}
200140020613/230002/02;"{'nameRu': 'ТОО ""Костанайский ЭнергоЦентр""'}";Электроэнергия;{'nameRu': 'Из одного источника путем прямого заключения договора'};0.00;593581.63;{'nameRu': 'Товар'}
200140020613/230056/00;"{'nameRu': 'Товарищество с ограниченной ответственностью ""Учебный центр ""SGK KZ""'}";участие в семинаре;{'nameRu': 'Из одного источника путем прямого заключения договора'};50000.00;50000.00;{'nameRu': 'Услуга'}
200140020613/230055/00;"{'nameRu': 'Товарищество с ограниченной ответственностью ""Олжа Ряжское""'}";Зимнее содержание дорог в с.Ряжское;{'nameRu': 'Из одного источника по несостоявшимся закупкам'};0.00;483500.00;{'nameRu': 'Работа'}
200140020613/230054/00;"{'nameRu': 'ИП ""Дом Торговли""'}";строительные материалы;{'nameRu': 'Из одного источника по несостоявшимся закупкам'};19000.00;19000.00;{'nameRu': 'Товар'}
200140020613/230053/00;{'nameRu': 'ИП ЕЭС'};приобретение строительных материалов (известь);{'nameRu': 'Запрос ценовых предложений'};5850.00;5850.00;{'nameRu': 'Товар'}
200140020613/230052/00;"{'nameRu': 'Индивидуальный предприниматель "" Пашкин Павел Николаевич""'}";установка антивирусной программы;{'nameRu': 'Из одного источника по несостоявшимся закупкам'};8482.15;9500.01;{'nameRu': 'Услуга'}
200140020613/230051/00;"{'nameRu': 'ТОО ""Жасыл Узунколь""'}";Грейдирование дорог в с.Ряжское;{'nameRu': 'Из одного источника по несостоявшимся закупкам'};520000.00;520000.00;{'nameRu': 'Работа'}
200140020613/230050/00;{'nameRu': 'ИП ГАЛКИНА СВЕТЛАНА ВАСИЛЬЕВНА'};услуги по изготовлению баннера;{'nameRu': 'Запрос ценовых предложений'};30100.00;30100.00;{'nameRu': 'Услуга'}
200140020613/230049/00;"{'nameRu': 'ИП ""Перевозщик""'}";приобретение угля каменного;{'nameRu': 'Из одного источника по несостоявшимся закупкам'};133000.00;133000.00;{'nameRu': 'Товар'}
200140020613/230048/00;"{'nameRu': 'Индивидуальный предприниматель ""Любич Владимир Иванович""'}";работа по ремонту принтера;{'nameRu': 'Из одного источника по несостоявшимся закупкам'};25000.00;25000.00;{'nameRu': 'Работа'}
200140020613/230047/00;"{'nameRu': 'Местное ОО инвалидов ""Байконыр кайсарлары""'}";Услуги по изготовлению фирменных  бланков;{'nameRu': 'Запрос ценовых предложений'};7000.00;7000.00;{'nameRu': 'Услуга'}
200140020613/230046/00;{'nameRu': 'ИП БУТ ЕВГЕНИЙ АЛЕКСАНДРОВИЧ'};приобретение строительных материалов (Эмаль);{'nameRu': 'Запрос ценовых предложений'};74200.00;83104.00;{'nameRu': 'Товар'}
200140020613/230045/00;{'nameRu': 'МОЛДАХМЕТ НҰРЛЫБЕК'};приобретение хозяйственных товаров (перчатки);{'nameRu': 'Запрос ценовых предложений'};9900.00;9900.00;{'nameRu': 'Товар'}
200140020613/230044/00;{'nameRu': 'ИП ЕЭС'};приобретение строительных материалов (водоэмульсия фасадная);{'nameRu': 'Запрос ценовых предложений'};23175.00;23175.00;{'nameRu': 'Товар'}
200140020613/230043/00;"{'nameRu': 'ИП ""ШУСТИКОВ""'}";Изготовление и установка мини-футбольного поля размером 20х40 м. общей площадью 800 м2;{'nameRu': 'Запрос ценовых предложений'};7500000.00;7500000.00;{'nameRu': 'Работа'}
200140020613/230042/00;"{'nameRu': 'ИП ""Kst-Trade""'}";"Приобретение котла  отопительного &quot;Неделька&quot;";{'nameRu': 'Из одного источника по несостоявшимся закупкам'};450000.00;450000.00;{'nameRu': 'Товар'}
200140020613/230041/00;"{'nameRu': 'ИП ""Ергазиев Н.Т.""'}";приобретение дров;{'nameRu': 'Из одного источника по несостоявшимся закупкам'};180000.00;180000.00;{'nameRu': 'Товар'}
200140020613/230040/00;"{'nameRu': 'ИП ""STATUS PLAST""'}";изготовление и установка пластиковых окон;{'nameRu': 'Запрос ценовых предложений'};420000.00;420000.00;{'nameRu': 'Работа'}
200140020613/230039/00;{'nameRu': 'Некоммерческое акционерное общество «Государственная корпорация «Правительство для граждан»'};изготовление идентификационного документа на земельный участок;{'nameRu': 'Из одного источника путем прямого заключения договора'};70857.19;79360.05;{'nameRu': 'Работа'}
200140020613/230038/00;"{'nameRu': 'ТОО ""ПЛЮСМИКРО ПЕТРОПАВЛОВСК""'}";Компьютер офисный (универсальный) в комплекте;{'nameRu': 'Конкурс с предварительным квалификационным отбором'};212500.00;238000.00;{'nameRu': 'Товар'}
200140020613/230037/00;{'nameRu': 'ИП DOS'};Текущий ремонт кровли крыши ГУ Аппарат акима Ряжского сельского округа Узункольского района;{'nameRu': 'Из одного источника по несостоявшимся закупкам'};3599999.00;3599999.00;{'nameRu': 'Работа'}
200140020613/230036/00;"{'nameRu': 'ТОО ""Kst trade""'}";Бензин АИ-92;{'nameRu': 'Второй этап конкурса с использованием рамочного соглашения'};0.00;190640.70;{'nameRu': 'Товар'}
200140020613/230035/00;"{'nameRu': 'Индивидуальный предприниматель "" Пашкин Павел Николаевич""'}";Заправка картриджа;{'nameRu': 'Из одного источника по несостоявшимся закупкам'};4500.00;5040.00;{'nameRu': 'Услуга'}
200140020613/230034/00;"{'nameRu': 'Индивидуальный предприниматель "" Пашкин Павел Николаевич""'}";установка антивирусной программы;{'nameRu': 'Из одного источника по несостоявшимся закупкам'};9200.00;10304.00;{'nameRu': 'Услуга'}
200140020613/230002/01;"{'nameRu': 'ТОО ""Костанайский ЭнергоЦентр""'}";Электроэнергия;{'nameRu': 'Из одного источника путем прямого заключения договора'};0.00;1022918.40;{'nameRu': 'Товар'}
200140020613/230032/00;"{'nameRu': 'ИП ""БАРАКАТ""'}";Услуги шиномонтажа;{'nameRu': 'Из одного источника по несостоявшимся закупкам'};20000.00;20000.00;{'nameRu': 'Услуга'}
200140020613/230031/00;{'nameRu': 'ИП Агитаев Н.С.'};текущий ремонт автомобиля Lada Granta;{'nameRu': 'Из одного источника по несостоявшимся закупкам'};100000.00;100000.00;{'nameRu': 'Работа'}
200140020613/230030/00;"{'nameRu': 'ТОО ""PROFIL-KZ""'}";"Услуги по обучению ( семинар &quot;Безопасность и охрана труда&quot; и &quot;Пожарная безопасность&quot;)";{'nameRu': 'Запрос ценовых предложений'};14500.00;14500.00;{'nameRu': 'Услуга'}
200140020613/230029/00;{'nameRu': 'ИП ГАЛКИНА СВЕТЛАНА ВАСИЛЬЕВНА'};услуги по изготовлению баннера;{'nameRu': 'Запрос ценовых предложений'};40000.00;40000.00;{'nameRu': 'Услуга'}
200140020613/230028/00;"{'nameRu': 'ИП ""Дом Торговли""'}";хозяйственные товары;{'nameRu': 'Из одного источника по несостоявшимся закупкам'};52320.00;52320.00;{'nameRu': 'Товар'}
200140020613/230027/00;"{'nameRu': 'индивидуальный предприниматель ""ГОЛУБИЦКАЯ ЛЮБОВЬ БОPИСОВНА""'}";канцелярские товары;{'nameRu': 'Запрос ценовых предложений'};17130.00;17130.00;{'nameRu': 'Товар'}
200140020613/230026/00;"{'nameRu': 'ИП ""Дом Торговли""'}";строительные материалы;{'nameRu': 'Из одного источника по несостоявшимся закупкам'};93350.00;93350.00;{'nameRu': 'Товар'}
200140020613/230025/00;"{'nameRu': 'ИП ""Дом Торговли""'}";строительные материалы;{'nameRu': 'Из одного источника по несостоявшимся закупкам'};32600.00;32600.00;{'nameRu': 'Товар'}
200140020613/230024/00;"{'nameRu': 'ГКП ""Таза Ұзынкөл"" акимата Узункольского района""'}";Услуги по приему и захоронению ТБО;{'nameRu': 'Из одного источника по несостоявшимся закупкам'};29846.00;29846.00;{'nameRu': 'Услуга'}
200140020613/230023/00;"{'nameRu': 'Индивидуальный предприниматель ""Любич Владимир Иванович""'}";жүйелік блокты жөндеу бойынша жұмыс;{'nameRu': 'Запрос ценовых предложений'};19500.00;19500.00;{'nameRu': 'Работа'}
200140020613/230022/00;"{'nameRu': 'АО ""Информационно-учетный центр""'}";Услуги по обеспечению бесперебойного доступа к данным реестра государственного имущества;{'nameRu': 'Из одного источника путем прямого заключения договора'};41400.00;48300.00;{'nameRu': 'Услуга'}
200140020613/230006/01;"{'nameRu': 'АО ""Информационно-учетный центр""'}";Услуги по обеспечению бесперебойного доступа к данным реестра государственного имущества;{'nameRu': 'Из одного источника путем прямого заключения договора'};0.00;48300.00;{'nameRu': 'Услуга'}
200140020613/230021/00;"{'nameRu': 'ОО ""Костанайское районное общество инвалидов""'}";Изготовление фирменных бланков;{'nameRu': 'Из одного источника по несостоявшимся закупкам'};9000.00;9000.00;{'nameRu': 'Услуга'}
200140020613/230020/00;{'nameRu': 'ИП  САЙМАНОВА  САНДУҒАШ'};услуги по изготовлению баннера;{'nameRu': 'Запрос ценовых предложений'};25000.00;25000.00;{'nameRu': 'Услуга'}
200140020613/230009/01;"{'nameRu': 'ТОО ""ЭПК-forfait"" (ЭПК-форфайт)'}";Обслуживание уличного освещения;{'nameRu': 'Из одного источника по несостоявшимся закупкам'};0.00;300000.01;{'nameRu': 'Услуга'}
200140020613/230019/00;"{'nameRu': 'РГП на ПХВ ""ИЗПИ""'}";Услуги по сопровождению и технической поддержке информационной системы;{'nameRu': 'Из одного источника по несостоявшимся закупкам'};54375.00;87000.00;{'nameRu': 'Услуга'}
200140020613/230018/00;"{'nameRu': 'ТОО ""Kst trade""'}";Бензин АИ-92;{'nameRu': 'Второй этап конкурса с использованием рамочного соглашения'};155276.79;173910.00;{'nameRu': 'Товар'}
200140020613/230017/00;"{'nameRu': 'ИП ""Адильбеков Н.Е.""'}";Услуги по подготовке/верификации/сопровождению/составлению в области экологии отчетов и аналогичных документов;{'nameRu': 'Запрос ценовых предложений'};32950.00;32950.00;{'nameRu': 'Услуга'}
200140020613/230016/00;{'nameRu': 'Антураж'};Аккумулятор;{'nameRu': 'Из одного источника по несостоявшимся закупкам'};31694.00;31694.00;{'nameRu': 'Товар'}
200140020613/230015/00;"{'nameRu': 'Костанайский ОФ АО ""Казпочта""'}";подписка на печатные периодические издания;{'nameRu': 'Из одного источника по несостоявшимся закупкам'};0.00;53675.30;{'nameRu': 'Товар'}
200140020613/230014/00;"{'nameRu': 'Костанайский ОФ АО ""Казпочта""'}";подписка на печатные периодические издания;{'nameRu': 'Из одного источника по несостоявшимся закупкам'};0.00;7500.00;{'nameRu': 'Товар'}
200140020613/230013/00;{'nameRu': 'ИП НАМ ЛЮДМИЛА ГРИГОРЬЕВНА'};Услуги по сопровождению и технической поддержке информационной системы;{'nameRu': 'Запрос ценовых предложений'};98214.29;178640.00;{'nameRu': 'Услуга'}
200140020613/230012/00;"{'nameRu': 'Индивидуальный предприниматель "" Пашкин Павел Николаевич""'}";Заправка картриджа;{'nameRu': 'Из одного источника по несостоявшимся закупкам'};4800.00;5376.00;{'nameRu': 'Услуга'}
200140020613/230011/00;"{'nameRu': 'Товарищество с ограниченной ответственностью ""KAZOPTICLINK""'}";Услуги спутниковой связи;{'nameRu': 'Из одного источника по несостоявшимся закупкам'};544727.21;838880.00;{'nameRu': 'Услуга'}
200140020613/230010/00;{'nameRu': 'ИП Асека'};канцелярские товары (Бумага А4);{'nameRu': 'Запрос ценовых предложений'};35168.00;35168.00;{'nameRu': 'Товар'}
200140020613/230009/00;"{'nameRu': 'ТОО ""ЭПК-forfait"" (ЭПК-форфайт)'}";Обслуживание уличного освещения;{'nameRu': 'Из одного источника по несостоявшимся закупкам'};0.00;300000.01;{'nameRu': 'Услуга'}
200140020613/230008/00;"{'nameRu': 'ТОО ""Редакция Узункольской районной газеты ""Нұрлы жол""'}";Размещения объявления в газете график приема, телефон доверия;{'nameRu': 'Из одного источника по несостоявшимся закупкам'};42000.00;56000.00;{'nameRu': 'Услуга'}
200140020613/230007/00;"{'nameRu': 'Костанайский областной филиал №229900 Акционерного общества ""Народный сберегательный банк Казахстана""'}";Услуги банков по перечислению/переводу денежных средств;{'nameRu': 'Из одного источника путем прямого заключения договора'};0.00;44000.00;{'nameRu': 'Услуга'}
200140020613/230006/00;"{'nameRu': 'АО ""Информационно-учетный центр""'}";Услуги по обеспечению бесперебойного доступа к данным реестра государственного имущества;{'nameRu': 'Из одного источника путем прямого заключения договора'};0.00;48300.00;{'nameRu': 'Услуга'}
200140020613/230005/00;"{'nameRu': 'АО ""Казахтелеком""'}";Услуги доступа к сети интернет;{'nameRu': 'Второй этап конкурса с использованием рамочного соглашения'};79048.29;119000.00;{'nameRu': 'Услуга'}
200140020613/230004/00;"{'nameRu': 'АО ""Казахтелеком""'}";Услуги телефонной связи;{'nameRu': 'Второй этап конкурса с использованием рамочного соглашения'};10271.93;13000.00;{'nameRu': 'Услуга'}
200140020613/230003/00;"{'nameRu': 'Товарищество с ограниченной ответственностью ""Парус-КАЗ""'}";"Обслуживание программного продукта &quot;Парус-КАЗ.Бюджет&quot; (Бюджетное финансирование МСУ)";{'nameRu': 'Из одного источника путем прямого заключения договора'};189891.96;283572.00;{'nameRu': 'Услуга'}
200140020613/230002/00;"{'nameRu': 'ТОО ""Костанайский ЭнергоЦентр""'}";Электроэнергия;{'nameRu': 'Из одного источника путем прямого заключения договора'};0.00;2142927.36;{'nameRu': 'Товар'}
200140020613/230001/00;"{'nameRu': 'ТОО ""Костанайский ЭнергоЦентр""'}";электроэнергия;{'nameRu': 'Из одного источника путем прямого заключения договора'};0.00;298958.02;{'nameRu': 'Товар'}
