contractNumberSys;Supplier;descriptionRu;FaktTradeMethods;faktSum;contractSumWnds;RefSubjectType
930140000343/230120/00;"{'nameRu': 'ТОО ""СемАЗ""'}";Автомобиль скорой медицинской помощи;{'nameRu': 'Из одного источника по несостоявшимся закупкам'};0.00;22100000.00;{'nameRu': 'Товар'}
930140000343/230119/00;"{'nameRu': 'Товарищество с ограниченной ответственностью ""Eldes med""'}";Телевизор жидкокристаллический, цифровой, LED, диагональ экрана: 32.0 дюйма - 81 см, разрешение: 1920x1080, входы: AV, компонентный, HDMI, Ethernet (RJ-45), USB цвет -черный (согласно технической спецификации);{'nameRu': 'Электронный магазин'};0.00;60667.00;{'nameRu': 'Товар'}
930140000343/230118/00;"{'nameRu': 'ИП ""Smart House""'}";холодильник однокамерный(согласно технической спецификации);{'nameRu': 'Электронный магазин'};0.00;77274.40;{'nameRu': 'Товар'}
930140000343/230117/00;"{'nameRu': 'РГП на ПХВ ""НЦЭЛС и МИ"" КМ и ФК МЗ РК'}";Экспертная оценка клинико-технического обоснования медицинского изделия, согласно технической спецификации;{'nameRu': 'Из одного источника путем прямого заключения договора'};0.00;155680.00;{'nameRu': 'Услуга'}
930140000343/230116/00;"{'nameRu': 'АО ""ННЦЧ им. А.Н.Сызганова""'}";"Обучение по теме&quot; Эндоскопическая диагностика и лечение заболеваний желудочно-кишечного тракта с курсом ЭРХПГ&quot;";{'nameRu': 'Из одного источника по несостоявшимся закупкам'};0.00;81300.00;{'nameRu': 'Услуга'}
930140000343/230115/00;{'nameRu': 'ИП СЕЛЬХАНОВА ТАТЬЯНА АНАТОЛЬЕВНА'};Заправка кондиционера двигателя ,заправка доп. кондиционера, Диагностика;{'nameRu': 'Запрос ценовых предложений'};0.00;430000.00;{'nameRu': 'Работа'}
930140000343/230114/00;"{'nameRu': 'Товарищество с ограниченной ответственностью ""PSG""'}";"Разработка сервисов по обмену между 1С:Предприятие 8 и КМИС Дамумед (&quot;ЦИТ &quot;Даму&quot;), настройка обмена справочной информации между 1С: Предприятие 8 и КМИС Дамумед (&quot;ЦИТ &quot;Даму&quot;)";{'nameRu': 'Запрос ценовых предложений'};0.00;2750000.00;{'nameRu': 'Услуга'}
930140000343/230113/00;"{'nameRu': 'ТОО ""RUBICON.KZ""'}";Техническое обслуживание газовых котлов, поверка сигнализаторов ,поверка венканалов, поверка дымоходов, поверка напоромеров, поверка газоанализаторов, поверка манометров.;{'nameRu': 'Запрос ценовых предложений'};0.00;147000.00;{'nameRu': 'Услуга'}
930140000343/230112/00;"{'nameRu': 'ТОО ""ИЛЬМУР""'}";"Услуги по приёму ,захоронению ТБО с КГП &quot;Камыстинская РБ&quot;";{'nameRu': 'Запрос ценовых предложений'};0.00;4190000.00;{'nameRu': 'Услуга'}
930140000343/230111/00;"{'nameRu': 'Костанайский ОФ АО ""Казпочта""'}";Услуги по пересылке почтовых отправлений;{'nameRu': 'Из одного источника путем прямого заключения договора'};0.00;28000.00;{'nameRu': 'Услуга'}
930140000343/230110/00;{'nameRu': 'Garant KZ'};Планшет для электронной цифровой подписи со стилусом;{'nameRu': 'Запрос ценовых предложений'};0.00;176246.00;{'nameRu': 'Товар'}
930140000343/230108/00;{'nameRu': 'ИП Данияр'};Техническое /сервисное обслуживание электродвигателей автомобильных;{'nameRu': 'Из одного источника по несостоявшимся закупкам'};0.00;150000.00;{'nameRu': 'Услуга'}
930140000343/230107/00;"{'nameRu': 'ТОО ""Синтегра""'}";"Внедрение централизованной виртуальной IP ATC на базе программы для ЭВМ &quot;CallBox&quot;";{'nameRu': 'Из одного источника путем прямого заключения договора'};0.00;2844147.00;{'nameRu': 'Услуга'}
930140000343/230105/00;"{'nameRu': 'Товарищество с ограниченной ответственностью ""Bus Service Kst""'}";Гарантийное Техническое обслуживание автотранспортных средств с заменой запасных частей;{'nameRu': 'Запрос ценовых предложений'};0.00;991000.00;{'nameRu': 'Услуга'}
930140000343/230104/00;{'nameRu': 'ИП МУХИН ВЛАДИМИР АЛЕКСАНДРОВИЧ'};Флагшток уличный металлический с механизмом для снятия и подъема флага;{'nameRu': 'Запрос ценовых предложений'};0.00;74140.00;{'nameRu': 'Товар'}
930140000343/230103/00;"{'nameRu': 'ИП ""УНАЕВ Т. Ж.""'}";Краска эмаль. ЦВЕТ: белый (Банка 1,8 л) СТ РК 3262-2018;{'nameRu': 'Электронный магазин'};0.00;13075.00;{'nameRu': 'Товар'}
930140000343/230102/00;"{'nameRu': 'Товарищество с ограниченной ответственностью ""TenderPro Solutions""'}";"Услуги по приёму ,захоронению ТБО с КГП &amp;quot;Камыстинская РБ&amp;quot;";{'nameRu': 'Запрос ценовых предложений'};0.00;3724061.60;{'nameRu': 'Услуга'}
930140000343/230101/00;"{'nameRu': 'ТОО ""CIFRTECH""'}";офисный (универсальный) компьютер;{'nameRu': 'Конкурс с предварительным квалификационным отбором'};0.00;560448.00;{'nameRu': 'Товар'}
930140000343/230100/00;"{'nameRu': 'Филиал АО ""Казпочта"" - ""РССС""'}";Услуги специальной почтовой связи;{'nameRu': 'Из одного источника путем прямого заключения договора'};0.00;224000.00;{'nameRu': 'Услуга'}
930140000343/230099/00;"{'nameRu': 'ТОО ""Диалог-Сервис""'}";"Разработка сервисов по обмену между 1С:Предприятие 8 и КМИС Дамумед (&amp;quot;ЦИТ &amp;quot;Даму&amp;quot;), настройка обмена справочной информации между 1С: Предприятие 8 и КМИС Дамумед (&amp;quot;ЦИТ &amp;quot;Даму&amp;quot;)";{'nameRu': 'Из одного источника путем прямого заключения договора'};0.00;5996000.00;{'nameRu': 'Услуга'}
930140000343/230098/00;"{'nameRu': 'Товарищество с ограниченной ответственностью ""Тендерная элита""'}";"Услуги по приёму ,захоронению ТБО с КГП &quot;Камыстинская РБ&quot;";{'nameRu': 'Запрос ценовых предложений'};0.00;3724015.68;{'nameRu': 'Услуга'}
930140000343/230097/00;{'nameRu': 'ИП Мусагалиев'};Краска эмаль. ЦВЕТ : коричневый (половая краска банка по 2,6 л) цвет и товар перед поставкой согласовать с Заказчиком. в жестяных банках. СТ РК 3262-2018;{'nameRu': 'Электронный магазин'};0.00;17250.00;{'nameRu': 'Товар'}
930140000343/230091/01;{'nameRu': 'КОТЕНЕВА НАТАЛЬЯ ВИКТОРОВНА'};Стол пеленальный;{'nameRu': 'Электронный магазин'};0.00;1090000.00;{'nameRu': 'Товар'}
930140000343/230096/00;"{'nameRu': 'ТОО""Альфа Плюс""'}";Стул медицинский;{'nameRu': 'Электронный магазин'};0.00;11700000.00;{'nameRu': 'Товар'}
930140000343/230095/00;"{'nameRu': 'ТОО ""Национальный центр медицинского образования""'}";«Алгоритм ранней диагностики злокачественных новообразований на уровне ПМСП» 40 часов.;{'nameRu': 'Из одного источника по несостоявшимся закупкам'};0.00;50000.16;{'nameRu': 'Услуга'}
930140000343/230094/00;"{'nameRu': 'НАО ""Медицинский университет Астана""'}";Особенности заполнения больным формы 031(направление на медико-социальную экспертизу);{'nameRu': 'Из одного источника по несостоявшимся закупкам'};0.00;21600.00;{'nameRu': 'Услуга'}
930140000343/230093/00;"{'nameRu': 'ТОО""Альфа Плюс""'}";Стол компьютерный, стол металлический ,кухонный;{'nameRu': 'Электронный магазин'};0.00;4254352.35;{'nameRu': 'Товар'}
930140000343/230092/00;"{'nameRu': 'ТОО""Альфа Плюс""'}";Стул каркас металлический, обивка из ткани, мягкий;{'nameRu': 'Электронный магазин'};0.00;2312410.46;{'nameRu': 'Товар'}
930140000343/230091/00;{'nameRu': 'КОТЕНЕВА НАТАЛЬЯ ВИКТОРОВНА'};Стол пеленальный;{'nameRu': 'Электронный магазин'};0.00;1090000.00;{'nameRu': 'Товар'}
930140000343/230090/00;{'nameRu': 'ИП Аида'};Тактильная ПВХ плитка, 300*300 мм., желтая, Толщина основания: 7мм. Материал: ПВХ. По ГОСТу. Самоклеющаяся. Согласовать с заказчиком.;{'nameRu': 'Электронный магазин'};0.00;314160.00;{'nameRu': 'Товар'}
930140000343/230089/00;"{'nameRu': 'ТОО ""Житикаринская дезинфекционная станция""'}";Услуги санитарные ( дезинсекция, дератизация ) ежемесячная обработка;{'nameRu': 'Запрос ценовых предложений'};0.00;73896.00;{'nameRu': 'Услуга'}
930140000343/230088/00;"{'nameRu': 'ТОО ""Учебный Центр ""ВСЕ ЗАКУПКИ""'}";«Государственные закупки» и «ЗАКУПКИ ЛС И МИ в рамках ГОБМП и ОСМС по новому приказу № 110»;{'nameRu': 'Из одного источника путем прямого заключения договора'};0.00;118600.00;{'nameRu': 'Услуга'}
930140000343/230087/00;"{'nameRu': 'Некоммерческое акционерное общество ""Национальный научный кардиохирургический центр""'}";"Услуги по повышению квалификации медицинских работников (семинар по теме :&quot;Актуальные вопросы ао ХСН&quot;";{'nameRu': 'Из одного источника по несостоявшимся закупкам'};0.00;80000.00;{'nameRu': 'Услуга'}
930140000343/230086/00;"{'nameRu': 'Некоммерческое акционерное общество ""Национальный научный кардиохирургический центр""'}";"Услуги по повышению квалификации медицинских работников (семинар по теме :&amp;amp;quot;Актуальные вопросы ао ХСН&amp;amp;quot;";{'nameRu': 'Из одного источника по несостоявшимся закупкам'};0.00;80000.00;{'nameRu': 'Услуга'}
930140000343/230085/00;{'nameRu': 'ИП Омельяненко Виталий Алексеевич'};Губка металлическая для мытья посуды;{'nameRu': 'Электронный магазин'};0.00;5450.00;{'nameRu': 'Товар'}
930140000343/230084/00;{'nameRu': 'ИП Омельяненко Виталий Алексеевич'};для чистки ванн и раковин, порошкообразное;{'nameRu': 'Электронный магазин'};0.00;124750.00;{'nameRu': 'Товар'}
930140000343/230083/00;{'nameRu': 'ИП Омельяненко Виталий Алексеевич'};Ведро из капрона ,объема 10-12 л;{'nameRu': 'Электронный магазин'};0.00;44950.00;{'nameRu': 'Товар'}
930140000343/230082/00;"{'nameRu': 'ТОО ""Угольная компания ""Богатырь-Костанай""'}";Уголь каменный с доставкой в каждое село;{'nameRu': 'Через товарные биржи'};0.00;3440799.70;{'nameRu': 'Товар'}
930140000343/230081/00;{'nameRu': 'ИП Жолдыбаева'};дрова чурками;{'nameRu': 'Запрос ценовых предложений'};0.00;620550.00;{'nameRu': 'Товар'}
930140000343/230080/00;{'nameRu': 'ИП DAULET-INVEST'};Благодарственное письмо ,формат А4,полноцвет,Грамота ,формат А4;{'nameRu': 'Запрос ценовых предложений'};0.00;28800.00;{'nameRu': 'Товар'}
930140000343/230079/00;"{'nameRu': 'ТОО ""Kst trade""'}";Топливо дизельное (талоны);{'nameRu': 'Из одного источника по несостоявшимся закупкам'};0.00;354000.00;{'nameRu': 'Товар'}
930140000343/230078/00;{'nameRu': 'ИП МУХИН ВЛАДИМИР АЛЕКСАНДРОВИЧ'};Наконечник для флагштока Государственного флага;{'nameRu': 'Запрос ценовых предложений'};0.00;10778.00;{'nameRu': 'Товар'}
930140000343/230077/00;"{'nameRu': 'Товарищество с ограниченной ответственностью ""Афина-KZ""'}";Лампа специализированная;{'nameRu': 'Электронный магазин'};0.00;16688.00;{'nameRu': 'Товар'}
930140000343/230076/00;{'nameRu': 'ИП Омельяненко Виталий Алексеевич'};Беспроводной двух диапазонный маршрутизатор со встроенным модемом ,скорость передачи данных до 300 Мбит /с;{'nameRu': 'Электронный магазин'};0.00;35980.00;{'nameRu': 'Товар'}
930140000343/230075/00;"{'nameRu': 'ТОО ""Асгард 2012""'}";"Текущий ремонт здания КГП &quot;Камыстинская районная больница&quot; в селе Камысты Камыстинского района Костанайской области (Общесоматическое Отделение)";{'nameRu': 'Открытый конкурс'};0.00;27521957.12;{'nameRu': 'Работа'}
930140000343/230074/00;"{'nameRu': 'ТОО ""ИЛЬМУР""'}";"Текущий ремонт здания КГП &amp;amp;quot;Камыстинская районная больница&amp;amp;quot; с.Камысты Камыстинского района Костанайской области (прачечная)";{'nameRu': 'Открытый конкурс'};8000000.00;8000000.00;{'nameRu': 'Работа'}
930140000343/230073/00;{'nameRu': 'ИП Омельяненко Виталий Алексеевич'};Ветошь обтирочная в рулоне, 110см*60м;{'nameRu': 'Электронный магазин'};0.00;327000.00;{'nameRu': 'Товар'}
930140000343/230072/00;{'nameRu': 'ИП Омельяненко Виталий Алексеевич'};Приобретение дисков CD-RW для компьютера;{'nameRu': 'Электронный магазин'};0.00;40000.00;{'nameRu': 'Товар'}
930140000343/230071/00;{'nameRu': 'ИП Омельяненко Виталий Алексеевич'};Стиральный порошок ,3 кг;{'nameRu': 'Электронный магазин'};450000.00;450000.00;{'nameRu': 'Товар'}
930140000343/230070/00;"{'nameRu': 'ТОО ""Катэп- АЭ""'}";Услуги по обеспечению радиационной безопасности;{'nameRu': 'Из одного источника путем прямого заключения договора'};0.00;470400.00;{'nameRu': 'Услуга'}
930140000343/230069/00;"{'nameRu': 'ТОО ""АЛАРЗУ""'}";Услуги по брокерским операциям с товарами;{'nameRu': 'Запрос ценовых предложений'};0.00;1.00;{'nameRu': 'Услуга'}
930140000343/230068/00;"{'nameRu': 'ТОО ""Костанайские новости""'}";Размещение информационных материалов в газете;{'nameRu': 'Из одного источника по несостоявшимся закупкам'};48258.93;54050.00;{'nameRu': 'Услуга'}
930140000343/230067/00;"{'nameRu': 'ЖК  ""Судебная экспертиза дорожно-транспортных проишествий и транспортных средств""'}";Услуги независимого эксперта по приобретению санитарного транспорта.;{'nameRu': 'Запрос ценовых предложений'};0.00;20000.00;{'nameRu': 'Услуга'}
930140000343/230066/00;"{'nameRu': 'Товарищество с ограниченной ответственностью ""Аршин""'}";Услуги по поверке и калибровке средств измерений на 2023;{'nameRu': 'Запрос ценовых предложений'};0.00;481225.92;{'nameRu': 'Услуга'}
930140000343/230065/00;{'nameRu': 'ИП Кожуров С.М.'};Тормозная жидкость-4(455 гр);{'nameRu': 'Запрос ценовых предложений'};0.00;5835.20;{'nameRu': 'Товар'}
930140000343/230064/00;{'nameRu': 'ИП МИРОНОВА ДАРЬЯ ВЛАДИМИРОВНА'};Масло трансмиссионное (3 литр),антифриз зеленый;{'nameRu': 'Запрос ценовых предложений'};68800.00;77056.00;{'nameRu': 'Товар'}
930140000343/230063/00;"{'nameRu': 'Товарищество с ограниченной ответственностью ""Республиканский Медицинский Институт""'}";Услуги по сопровождению и технической поддержке информационной системы;{'nameRu': 'Из одного источника путем прямого заключения договора'};0.00;268200.00;{'nameRu': 'Услуга'}
930140000343/230062/00;{'nameRu': 'ИП Trade and service'};Работа аппарата стационарного для цифровой рентгенографии DX-D300(удаленно, без выезда инженера на место нахождения оборудования );{'nameRu': 'Из одного источника по несостоявшимся закупкам'};0.00;1300000.00;{'nameRu': 'Работа'}
930140000343/230061/00;"{'nameRu': 'Костанайский областной филиал РГП на ПХВ ""ННЦРЗ имени Салидат Каирбековой"" МЗ РК'}";Услуги по обработке информации/данных/материалов и аналогичное;{'nameRu': 'Из одного источника по несостоявшимся закупкам'};0.00;680764.00;{'nameRu': 'Услуга'}
930140000343/230060/00;{'nameRu': 'ИП Омельяненко Виталий Алексеевич'};Полиэтиленовая плёнка. Клеенка;{'nameRu': 'Запрос ценовых предложений'};28000.00;28000.00;{'nameRu': 'Товар'}
930140000343/230059/00;{'nameRu': 'KLEVER'};Удлинитель 5 м белый;{'nameRu': 'Запрос ценовых предложений'};14650.00;14650.00;{'nameRu': 'Товар'}
930140000343/230058/00;{'nameRu': 'ИП Жанбирова'};Бумажные полотенца 2-х слойные, 2 рулона, белые;{'nameRu': 'Электронный магазин'};95000.00;95000.00;{'nameRu': 'Товар'}
930140000343/230057/00;"{'nameRu': 'ТОО ""EkoLabRecycling""'}";Услуги по утилизации мед отходов классов Б,В,;{'nameRu': 'Из одного источника по несостоявшимся закупкам'};0.00;3024000.00;{'nameRu': 'Услуга'}
930140000343/230056/00;{'nameRu': 'Улан'};Сода кальцинированная 600 гр;{'nameRu': 'Электронный магазин'};0.00;130500.00;{'nameRu': 'Товар'}
930140000343/230055/00;"{'nameRu': 'ИП ""Аида""'}";Губки для посуды профильные , 85 х 65 х 43 мм, 5 шт;{'nameRu': 'Электронный магазин'};131250.00;131250.00;{'nameRu': 'Товар'}
930140000343/230054/00;"{'nameRu': '""Capital Win""'}";Губки для посуды профильные , 85 х 65 х 43 мм, 5 шт;{'nameRu': 'Электронный магазин'};40200.00;40200.00;{'nameRu': 'Товар'}
930140000343/230053/00;{'nameRu': 'ИП Кожуров С.М.'};Автошина летняя 225/75 R16;{'nameRu': 'Запрос ценовых предложений'};442788.00;495922.56;{'nameRu': 'Товар'}
930140000343/230019/01;"{'nameRu': 'ТОО ""АУДИТОРСКАЯ КОМПАНИЯ ""КАЗФИНАУДИТ""'}";Услуги по проведению аудита финансовой отчетности;{'nameRu': 'Запрос ценовых предложений'};467997.00;467997.00;{'nameRu': 'Услуга'}
930140000343/230052/00;{'nameRu': 'ИП Miradj'};Лампа светодиодная, отсутствие пульсации, тип колбы А60, размер не более 60*124 мм, эквивалентно не менее 180 Вт, цветовая температура не менее 4000 К, свет холодный белый, угол рассеивания не менее 220.;{'nameRu': 'Запрос ценовых предложений'};162300.00;181776.00;{'nameRu': 'Товар'}
930140000343/230051/00;{'nameRu': 'Көккөз'};Беспроводной телефон c двумя трубками;{'nameRu': 'Запрос ценовых предложений'};72740.00;72740.00;{'nameRu': 'Товар'}
930140000343/230050/00;"{'nameRu': 'Костанайский областной филиал ТОО ""РМА""'}";"Повышение квалификации по специальности &quot;Фармация&quot; на тему : &quot;Правила обращение с лекарственными препаратами&quot;";{'nameRu': 'Из одного источника по несостоявшимся закупкам'};0.00;169900.00;{'nameRu': 'Услуга'}
930140000343/230049/00;{'nameRu': 'ИП Сарсебаев С'};Средство чистящее для унитазов;{'nameRu': 'Электронный магазин'};126500.00;126500.00;{'nameRu': 'Товар'}
930140000343/230048/00;{'nameRu': 'ИП Ерланқызы'};Пакеты для мусора , 30 л;{'nameRu': 'Электронный магазин'};84000.00;84000.00;{'nameRu': 'Товар'}
930140000343/230047/00;"{'nameRu': 'ИП ""MEDBARS""'}";Контейнер внутрикорпусной с педальным механизмом, 15 л, с фиксатором для пакета, серый;{'nameRu': 'Электронный магазин'};176600.00;176600.00;{'nameRu': 'Товар'}
930140000343/230046/00;{'nameRu': 'ИП Голод И.С.'};Хозяйственное мыло 72% 200 г;{'nameRu': 'Электронный магазин'};118990.00;118990.00;{'nameRu': 'Товар'}
930140000343/230045/00;{'nameRu': 'ИП КУЛИКОВСКАЯ ИРИНА ПЕТРОВНА'};Отбеливатель белизна ,1000 мл;{'nameRu': 'Электронный магазин'};0.00;64000.00;{'nameRu': 'Товар'}
930140000343/230044/00;{'nameRu': 'ИП TechService'};Набор для уборки (совок + щетка), сиреневый;{'nameRu': 'Электронный магазин'};20089.20;20089.20;{'nameRu': 'Товар'}
930140000343/230043/00;{'nameRu': 'ИП Сейітхан'};Ершик туалетный ,серый;{'nameRu': 'Электронный магазин'};120000.00;120000.00;{'nameRu': 'Товар'}
930140000343/230042/00;{'nameRu': 'ИП AITUAR'};Компьютерные колонки, черные;{'nameRu': 'Электронный магазин'};5290.00;5290.00;{'nameRu': 'Товар'}
